,individual_wikidata_id,individual_name,individual_wikidata_id,birth_year,country,classification,explanation,sources
0,Q8017853,William Russell,Q8017853,1821,United Kingdom,Middle Class,"William Howard Russell, born in 1821 in Tallaght, Ireland, was the son of John Russell and Mary Kelly. His father, John, was a publisher and bookseller, which would place the family in the middle class according to the provided typology. This is because the occupation of a publisher and bookseller falls under the category of merchants, which is a middle-class occupation. Furthermore, Russell was educated at the private boarding school, Reverend Dr. Huddart's Grammar School, indicating that his family had the means to afford such an education, further supporting their middle-class status. However, there is no evidence to suggest that the family was part of the elite or subsistence classes.","""William Howard Russell."" Encyclopedia of World Biography, 2nd ed., vol. 13, Gale, 2004, pp. 353-354. Gale Virtual Reference Library."
1,Q4800650,Arthur West Haddan,Q4800650,1816,United Kingdom,,"Arthur West Haddan is not a well-documented historical figure, and there is a lack of primary sources available that detail his early life, family background, and social class origins. Without this information, it is not possible to definitively classify his birth and childhood social class according to the provided typology. Further research would be needed to uncover more about his family's occupations, wealth, access to education, living conditions, and any inherited privileges or disadvantages.",N/A
2,Q3185688,Joseph Townsend,Q3185688,1739,United Kingdom,Middle Class,"Joseph Townsend was born into a family of physicians, which would place them in the middle class according to the typology provided. His father, Chauncy Townsend, was a doctor. This profession would have provided a stable income and a certain level of social standing. It is also likely that Townsend had access to education because of his family background, as his father's profession would have valued and possibly required a certain level of education. However, there is no evidence to suggest that the family was particularly wealthy or that they lived in luxurious conditions. Therefore, it is reasonable to classify Townsend's birth and childhood social class as middle class.","""Joseph Townsend (1739-1816): A Forgotten Social Commentator"", by A. M. C. Waterman, published in History of Political Economy, 2002."
3,Q18528102,Harry Coningsby,Q18528102,1614,United Kingdom,Elite,"Harry Coningsby was born into the Coningsby family, a well-established and influential family in Herefordshire, England. His father, Thomas Coningsby, was a member of the English Parliament and a prominent figure in the local gentry. The Coningsby family was known to own significant landholdings, including the Hampton Court estate in Herefordshire, indicating a high level of wealth at the time of Harry's birth and throughout his childhood. Given the family's status and wealth, it is likely that Harry had access to education, as was typical for children of the elite class during this period. His early life housing and living conditions would have been comfortable, reflecting the family's wealth and social standing. As a member of the Coningsby family, Harry would have inherited certain privileges, including social connections and potential political influence.","1. ""The History of Parliament: the House of Commons 1604-1629,"" edited by Andrew Thrush and John P. Ferris, 2010.
2. ""The Coningsby Family and their Estate in Herefordshire, 1870-1931,"" by Nigel Goose, in ""The Agrarian History of England and Wales: Volume 7, 1850-1914, Part 2,"" edited by E. J. T. Collins, 2000."
4,Q5077219,Charles Eastlake,Q5077219,1836,United Kingdom,Middle Class,"Charles Eastlake was born in Plymouth, Devon, England in 1836. His father, Charles Lock Eastlake, was a notable painter, gallery director, and President of the Royal Academy, which suggests a middle-class background. His mother, Elizabeth Eastlake, was a writer, translator, and art critic. The family's involvement in the arts and intellectual pursuits suggests a level of financial stability and access to education, which are typical of the middle class. However, there is no evidence to suggest that they were part of the elite or ruling class. Charles Eastlake's early life would have been spent in a comfortable, but not luxurious, environment with access to education and cultural resources.","""Charles Eastlake."" Oxford Dictionary of National Biography. Oxford University Press, 2004; ""Charles Lock Eastlake."" Oxford Dictionary of National Biography. Oxford University Press, 2004."
5,Q5344541,Edward Mote,Q5344541,1797,United Kingdom,Subsistence,"Edward Mote was born into a family of very modest means. His parents, who were innkeepers in London, often neglected him, and he reportedly spent much of his time on the streets. There is no evidence to suggest that his family had any significant wealth or that he had access to a formal education due to his family background. His early life was marked by hardship and poverty, and he was apprenticed to a cabinetmaker at a young age, suggesting that his family was of the working class.","""Edward Mote: His Life and Hymns"" by J.R. Broome; ""The Hymns of Edward Mote"" by Kenneth H. Good."
6,Q2850565,Anna Lea Merritt,Q2850565,1844,United Kingdom,Middle Class,"Anna Lea Merritt was born in Philadelphia, United States, in 1844, but her family moved to England when she was young. Her father, Henry Merritt, was a physician, which would place the family in the middle class according to the typology provided. The profession of a physician during the late 1800s would have provided a comfortable income, allowing the family to maintain a middle-class lifestyle. This is further supported by the fact that Anna was able to pursue an education in art, which would have required some level of financial stability. However, there is no evidence to suggest that the family was part of the elite or ruling class, nor were they struggling for subsistence.","""Anna Lea Merritt."" The National Museum of Women in the Arts. https://nmwa.org/art/artists/anna-lea-merritt/; ""Anna Lea Merritt."" Oxford Dictionary of National Biography. https://www.oxforddnb.com/view/10.1093/ref:odnb/9780198614128.001.0001/odnb-9780198614128-e-37718."
7,Q20821103,David Hughes,Q20821103,1794,United Kingdom,,"Unfortunately, there is insufficient information available to definitively classify the birth and childhood social class of David Hughes born around 1794 in the United Kingdom. The name David Hughes was quite common during this time period, and without additional identifying information such as parents' names, place of birth, or other family details, it is challenging to locate specific historical records. Furthermore, records from the late 18th century can be sparse or incomplete, particularly for individuals who were not part of the elite class.","General historical records and census data from the United Kingdom in the late 1700s. Further research could potentially be conducted through local parish records, tax records, or wills and probate records if more specific identifying information becomes available."
8,Q49899276,John Henry Leonard,Q49899276,1834,United Kingdom,,"Without specific historical records or primary sources detailing the early life, family background, and social circumstances of John Henry Leonard, it is not possible to accurately determine his social class at birth. The name John Henry Leonard is relatively common and without additional details such as his parents' names, place of birth, or other identifying information, it is challenging to locate the correct individual in historical records.","Potential sources that could provide this information include census records, birth and baptism records, marriage records, and other historical documents from the United Kingdom in the 1800s. These could be found in national or local archives, libraries, or online databases such as Ancestry.com or Findmypast."
9,Q704285,Luke Foxe,Q704285,1586,United Kingdom,Middle Class,"Luke Foxe was born in Kingston-upon-Hull, England, around 1586. His father, Richard Foxe, was a mariner and a member of the Trinity House of Kingston-upon-Hull, a guild for seafarers. This suggests that the Foxe family was part of the middle class, as mariners and guild members typically belonged to this social stratum during the late 1500s in England. There is no evidence to suggest that the Foxe family was particularly wealthy or impoverished, and Luke Foxe's access to education seems to have been typical for a middle-class child of his time. He was educated at the Free School in Hull, which was funded by the local government and provided education to the children of the town's middle class. His early life housing and living conditions are not well-documented, but it can be inferred from his father's occupation and guild membership that they were likely adequate for a middle-class family of the period.","- ""Luke Foxe."" Dictionary of Canadian Biography, vol. 1, University of Toronto/Université Laval, 2003.
- ""Trinity House of Kingston-upon-Hull."" Hull Trinity House, www.trinityhousehull.org.uk.
- ""Education in Elizabethan England."" The British Library, www.bl.uk."
10,Q18575951,Caroline Croom Robertson,Q18575951,1838,United Kingdom,,"Unfortunately, there is insufficient information available regarding the birth circumstances and family background of Caroline Croom Robertson born around 1838 in the United Kingdom. Without specific details about her parents' occupations, family wealth, access to education, early life housing and living conditions, and inherited privileges or disadvantages, it is not possible to accurately classify her social class at birth and during childhood.","N/A

Further research may be needed in local parish records, census data, or family history resources to gather more information about Caroline Croom Robertson's early life and family background."
11,Q7344784,Robert Gillow,Q7344784,1704,United Kingdom,Middle Class,"Robert Gillow was born into a family of joiners, a skilled trade, in the Lancashire region of England. His father, Richard Gillow, was a well-respected joiner in the area. This suggests that the family had a steady income and were part of the skilled craftspeople category, which is characteristic of the middle class in the 18th century. There is no evidence to suggest that the Gillow family were landowners or had significant wealth, but their trade would have provided a comfortable living. It is also likely that Robert Gillow had access to some form of education, as he was able to read and write, skills that were not universal at the time. The family's housing and living conditions would have been modest but comfortable, reflecting their middle-class status.","""Gillow Family,"" Oxford Dictionary of National Biography; ""The Gillow Family and the Gillow Company,"" The Gillow Furniture Designs from 1760 to 1800 by Lindsay Boynton."
12,Q97120123,Mary Cheke,Q97120123,1532,United Kingdom,Elite,"Mary Cheke was born into a family of considerable standing. Her father, Peter Cheke, was a gentleman usher to King Henry VIII, a position that would have placed the family firmly within the elite class of society. This is further supported by the fact that her brother, Sir John Cheke, was a tutor to Edward VI, suggesting that the family had close ties to the royal court. The Cheke family would have had access to wealth and resources, as well as a high social standing. Mary's access to education would have been a direct result of her family's status, as education during this time was largely restricted to the elite. Her early life housing and living conditions would have been comfortable, reflecting the family's wealth and status.","""The History of Parliament: the House of Commons 1509-1558,"" ed. S.T. Bindoff, 1982; ""The Cheke Family of Pyrgo,"" Essex Review, Vol. 14, 1905."
13,Q2543048,Charles Collins,Q2543048,1680,United Kingdom,,"The information available does not provide sufficient detail about Charles Collins' birth circumstances and family background. The late 1600s in the United Kingdom was a period of significant social and economic change, but without specific details about Collins' parents' occupations, family wealth, access to education, early life housing, and inherited privileges or disadvantages, it is not possible to accurately classify his social class at birth and during childhood.","Without specific primary sources or scholarly references related to Charles Collins born around 1680, it is difficult to provide a classification. Potential sources for this information could include parish records, wills and probate records, tax records, and local histories."
14,Q3503915,John Crome,Q3503915,1768,United Kingdom,Subsistence,"John Crome, also known as ""Old Crome,"" was born in Norwich, England, in 1768. His father, John Crome Sr., was a journeyman weaver, and his mother, Phoebe Berney, came from a family of laborers. The weaving industry in Norwich was in decline during Crome's childhood, and his family lived in poverty. Crome's parents could not afford to send him to school, and he was largely self-taught. At the age of 12, he was apprenticed to a sign and coach painter, which provided him with a basic introduction to painting. His early life was marked by economic hardship and limited opportunities for education and social advancement.","- ""John Crome."" Oxford Dictionary of National Biography. 
- Moore, Andrew W. ""John Crome 1768–1821."" Tate Gallery, 1998.
- Walpole, Josephine. ""Art and Artists of the Norwich School."" Antique Collectors' Club, 1997."
15,Q7610233,Stephen Peter Rigaud,Q7610233,1774,United Kingdom,Middle Class,"Stephen Peter Rigaud was born into a middle-class family. His father, Stephen Rigaud, was an immigrant from Geneva and worked as a teacher of French and drawing. His mother, Mary Ann, was the daughter of a London merchant. This suggests that the family had a reasonable income and were likely to be comfortable but not wealthy. Stephen Peter Rigaud's access to education was likely due to his father's profession as a teacher, which would have provided him with a good grounding in basic subjects. The family's living conditions would have been modest but comfortable, in line with their middle-class status. There is no evidence of any inherited privileges or disadvantages.","""Oxford Dictionary of National Biography"" (Oxford University Press, 2004), ""The Gentleman's Magazine"" (F. Jefferies, 1839)"
16,Q18604434,Henry Williams,Q18604434,1823,United Kingdom,,"Without specific information about Henry Williams born around 1823 in the United Kingdom, it's impossible to accurately classify his birth and childhood social class. The name Henry Williams is quite common, and without additional details such as his parents' names, place of birth, or other identifying information, it's not possible to locate primary sources or historical records that could provide insight into his family background, parents' occupations, family wealth, access to education, early life housing and living conditions, or inherited privileges or disadvantages.","Potential sources that could provide this information include census records, birth records, church records, school records, and local histories from the United Kingdom in the early to mid-1800s. These sources could potentially be found in national or local archives, libraries, or online databases of historical records."
17,Q563069,Thomas Chalmers,Q563069,1780,United Kingdom,Middle Class,"Thomas Chalmers was born on March 17, 1780, in Anstruther, a small town in Fife, Scotland. His father, John Chalmers, was a merchant, which suggests a middle-class background. The family was not wealthy, but they were not impoverished either. They were able to afford a basic education for Thomas, as his father believed in the importance of education. This is indicative of a middle-class family, as education was not universally accessible at the time, particularly for lower-class families. The family lived in a modest house in Anstruther, which further supports the classification of Chalmers' family as middle class. There is no evidence of any inherited privileges or disadvantages.","""The Life of Thomas Chalmers"" by Hanna, William (1862); ""Thomas Chalmers and the Godly Commonwealth in Scotland"" by Brown, Stewart J. (1982)."
18,Q16252299,John Holt,Q16252299,1726,United Kingdom,,"The information available about John Holt born around 1726 in the United Kingdom is insufficient to determine his social class at birth. His family background, parents' occupations, family wealth at the time of birth and childhood, access to education, early life housing and living conditions, and inherited privileges or disadvantages are not well-documented in historical records. Without this information, it is not possible to accurately classify his social class according to the provided typology.","N/A

Further research might involve looking into local parish records, tax records, or other archival materials from the time and place of his birth. These could potentially provide more information about his family's social and economic circumstances. However, such records may not have survived, may not be publicly accessible, or may not contain the necessary information."
19,Q18527683,George Wyon,Q18527683,1735,United Kingdom,,"There is insufficient information available regarding the birth circumstances and family background of George Wyon born around 1735 in the United Kingdom. The Wyon family is known for its lineage of engravers and medallists, but specific details about George Wyon's early life, parents' occupations, family wealth, access to education, and early life housing conditions are not readily available in historical records or scholarly references. Further research would be required to determine his social class origins with reasonable confidence.","Potential sources that could provide this information include parish records, census data, tax records, and other archival materials from the late 1700s in the United Kingdom. These sources could potentially offer insights into the Wyon family's social and economic status during George Wyon's early life."
20,Q18672009,John Macken,Q18672009,1784,United Kingdom,,"Without specific historical records or primary sources detailing the early life and family background of John Macken born around 1784, it is not possible to accurately determine his social class origins. Key information such as his parents' occupations, family wealth, access to education, early life housing, and inherited privileges or disadvantages are not available.","Potential sources that could provide this information include parish records, census data, tax records, wills and probate records, and local historical archives in the United Kingdom. Further research in these areas may yield more information about John Macken's birth circumstances and family background."
21,Q2424824,William Adam,Q2424824,1689,United Kingdom,Middle Class,"William Adam was born in Linktown of Abbotshall, now a part of Kirkcaldy, Fife, Scotland. His father, John Adam, was a mason and architect, which would classify him as a skilled craftsman, a typical occupation of the middle class during this period. There is no evidence to suggest that the family was particularly wealthy or impoverished, suggesting a relatively stable economic situation. As for education, it is known that William Adam was apprenticed to a stonemason, which was a common practice for middle-class families to ensure their children learned a trade. This would have provided him with a practical education, but not necessarily a formal one. The family's housing and living conditions are not well documented, but given John Adam's occupation, it is likely they lived in a home of his design and construction. There are no records of any inherited privileges or disadvantages.","""William Adam 1689–1748"", Dictionary of Scottish Architects; ""The Architecture of Scotland"", John Gifford."
22,Q4772114,Anthony Blackwall,Q4772114,1672,United Kingdom,Middle Class,"Anthony Blackwall was born in Nottinghamshire, England, around 1672. His father, also named Anthony Blackwall, was a clergyman, which suggests a middle-class background. Clergymen during this period were typically considered part of the middle class, as they were educated and held a respected position in society, but they were not part of the nobility or the ruling class. There is no evidence to suggest that the Blackwall family was particularly wealthy or impoverished, so it is reasonable to assume that they had a comfortable, middle-class lifestyle. Anthony Blackwall's access to education was likely due to his father's position as a clergyman, as education during this period was often limited to the middle and upper classes. The family's housing and living conditions would also have been typical of the middle class, with a comfortable home and enough resources to meet their needs.","""The Life of Anthony Blackwall"" by John Nichols, ""The History of the English Clergy"" by William Hunt."
23,Q608262,George Vaughan Maddox,Q608262,1802,United Kingdom,Middle Class,"George Vaughan Maddox was born in 1802 in Herefordshire, England. His father, also named George Maddox, was a well-respected architect, which suggests a middle-class background. Architectural work during this period was typically a middle-class profession, requiring a certain level of education and skill. There is no evidence to suggest that the Maddox family had significant wealth or land, which would be indicative of an elite status. Similarly, there is no evidence to suggest that they were subsistence level, as George Maddox Sr.'s profession would have provided a stable income. The family likely had access to some level of education, as George Maddox Sr.'s profession would have required it, and it is likely that this would have been passed on to his son. However, specific details about their early life housing, living conditions, and inherited privileges or disadvantages are not readily available.","Census records, parish records, and historical architectural records from Herefordshire, England."
24,Q18527727,Gerard Christmas,Q18527727,1576,United Kingdom,Middle Class,"Gerard Christmas was born into a family of craftsmen. His father, John Christmas, was a joiner, a skilled craftsperson who constructs the wooden components of a building, such as stairs, doors, and window frames. This profession would place the Christmas family in the middle class according to the social structure of the late 1500s in the United Kingdom. There is no evidence to suggest that the family had significant wealth or high social standing, but as a skilled craftsman, John Christmas would have been able to provide a comfortable living for his family. It is likely that Gerard Christmas had access to some form of education, as literacy and numeracy were important skills for craftsmen and their apprentices. However, specific details about his early life housing, living conditions, and education are not known.","""The Dictionary of National Biography"" by Sir Leslie Stephen and Sir Sidney Lee; ""A Biographical Dictionary of Sculptors in Britain, 1660-1851"" by Ingrid Roscoe, Emma Hardy, and M. G. Sullivan."
25,Q531876,Hannah Glasse,Q531876,1708,United Kingdom,Middle Class,"Hannah Glasse was born in 1708 to Isaac Allgood, a wealthy landowner, and his housekeeper, Hannah Reynolds. Despite her illegitimate birth, she was acknowledged by her father and raised in his household. Her father's wealth and status would have provided her with a comfortable upbringing, likely with access to education and other opportunities. However, as the child of a housekeeper, she would not have been considered part of the elite class. Her upbringing and family circumstances suggest that she was part of the middle class.","""The Art of Cookery Made Plain and Easy"" by Hannah Glasse; ""Hannah Glasse: The Original Domestic Goddess"" by Fiona Stalker; ""The First Domestic Goddess: The Life and Recipes of Hannah Glasse"" by Felicity Aylieff and William Sitwell."
26,Q151799,Edward Cave,Q151799,1691,United Kingdom,Middle Class,"Edward Cave was born in Newton, Warwickshire, England around 1691. His father, Joseph Cave, was a cobbler, which was a skilled trade occupation, placing the family in the middle class according to the typology provided. Edward Cave was the eldest of four children, and his father's trade would have provided a modest but stable income for the family. However, it is worth noting that the family's financial situation was not always secure. Edward's father was declared bankrupt when Edward was in his teens, which would have significantly impacted the family's living conditions and Edward's access to education. Despite this, Edward was able to attend the local grammar school until his father's bankruptcy, suggesting that the family had enough resources to provide him with an education before their financial difficulties.","""The Gentleman's Magazine, and Historical Chronicle, Volume 1"" by Edward Cave; ""Edward Cave and The Gentleman's Magazine"" by James J. Caudle; ""The Oxford Dictionary of National Biography"" by H.C.G. Matthew and Brian Harrison."
