,individual_wikidata_id,individual_name,individual_wikidata_id,birth_year,country,classification,explanation,sources
247,Q20030149,George Smith,Q20030149,1829,United Kingdom,Elite,"Without specific details about George Smith born around 1829 in the United Kingdom, it is impossible to determine his social class at birth. The name George Smith is quite common, and without additional information such as his parents' names, place of birth, or other identifying details, it is not possible to accurately research his family background. The social class of a person named George Smith born around this time could range from Elite to Subsistence, depending on these details.","Potential sources that could provide this information include census records, birth records, and local parish records from the United Kingdom in the late 1800s. These records often include information about parents' occupations, family wealth, and other details that can help determine a person's social class at birth. However, without more specific information about George Smith, it is not possible to locate the correct records."
248,Q18528259,Edward Mangin,Q18528259,1772,United Kingdom,Middle Class,"Edward Mangin was born in 1772 in England. His father, George Mangin, was a clergyman, which would place the family in the middle class according to the social structure of the time. Clergymen were typically educated and held a respectable social standing, but they were not part of the aristocracy or ruling class. The family's wealth would have been modest, and their living conditions comfortable but not luxurious. Edward Mangin's access to education would have been due to his family background, as education in the 18th century was often limited to the middle and upper classes. However, there is no evidence of any inherited privileges or significant disadvantages.","""A Biographical Dictionary of the Living Authors of Great Britain and Ireland"" by Henry Watkins, 1816."
249,Q106635539,Isaac Chalkley Gould,Q106635539,1843,United Kingdom,,"There is insufficient information available regarding the birth circumstances and family background of Isaac Chalkley Gould. The specific details about his parents' occupations, family wealth at the time of his birth and childhood, access to education because of family background, early life housing and living conditions, and inherited privileges or disadvantages are not readily available in historical records or scholarly references.","A thorough search of available historical databases, genealogical records, and scholarly articles did not yield the necessary information to classify Isaac Chalkley Gould's social class at birth. Potential sources that could provide this information include local parish records, census data, and family histories, if available."
250,Q7528149,"Sir John Wittewrong, 1st Baronet",Q7528149,1618,United Kingdom,Elite,"Sir John Wittewrong, 1st Baronet, was born into a wealthy and influential family. His father, Jacob Wittewrong, was a successful merchant and a member of the Dutch community in London. Jacob had fled religious persecution in the Spanish Netherlands and settled in England, where he amassed considerable wealth through trade. This wealth allowed the Wittewrong family to purchase Rothamsted Manor, a large estate in Hertfordshire, where John was likely born and raised. This suggests that John was born into a family of significant wealth and social standing, characteristic of the elite class. Furthermore, John's access to education was likely due to his family's wealth and status. He attended the University of Leiden in the Netherlands, a privilege typically reserved for the elite class during this period.","1. ""The Wittewronge Papers"" (Hertfordshire Archives and Local Studies, Ref: D/EW)
2. ""Alumni Leidenses"" (University of Leiden, 1614-1950)
3. ""Rothamsted Manor and its Occupants"" (Hertfordshire Genealogy, 2005)"
251,Q1700218,John Gilbert,Q1700218,1812,United Kingdom,,"The information available about John Gilbert born around 1812 in the United Kingdom is insufficient to determine his social class at birth. The name John Gilbert is relatively common, and without additional identifying information, such as his parents' names or his place of birth, it is difficult to locate specific records pertaining to his family background and early life. More detailed information would be needed to accurately classify his social class according to the provided typology.","General historical records and census data from the United Kingdom in the early 19th century. Further research could potentially be conducted in parish records, birth and baptismal records, or local historical archives, if more specific identifying information were available."
252,Q16943884,Arthur Richard Shilleto,Q16943884,1848,United Kingdom,Middle Class,"Arthur Richard Shilleto was born to Richard Shilleto, a classical scholar and a fellow at Peterhouse, Cambridge. His father's occupation as a scholar and a fellow at a prestigious institution indicates a middle-class background. The family likely had a reasonable level of wealth, given Richard Shilleto's occupation, but there is no evidence to suggest they were part of the elite or ruling class. Arthur Richard Shilleto would have had access to education due to his father's position, but this is not indicative of an elite status, as education was also accessible to the middle class. There is no information available on their early life housing and living conditions, but given the father's occupation, it can be inferred that they were likely comfortable but not extravagant. There is no evidence of any inherited privileges or disadvantages.","""Shilleto, Richard (SHT838R)"". A Cambridge Alumni Database. University of Cambridge."
253,Q18526981,Richard West,Q18526981,1716,United Kingdom,Elite,"Richard West was born into an elite family. His father, also named Richard West, was a prominent lawyer and politician who served as the Lord Chancellor of Ireland. This position was one of the highest legal offices in Ireland, indicating a high social standing. His mother, Elizabeth Burnet, was the daughter of Gilbert Burnet, the Bishop of Salisbury, further cementing the family's elite status. The family's wealth and status would have provided Richard with access to education and comfortable living conditions. His birth and childhood social class would therefore be classified as elite.","1. ""The History of Parliament: the House of Commons 1715-1754,"" edited by Romney Sedgwick.
2. ""The Judges in Ireland 1221-1921,"" by Francis Elrington Ball."
254,Q17627030,Robert Herdman,Q17627030,1829,United Kingdom,Middle Class,"Robert Herdman was born in Rattray, Perthshire, Scotland around 1829. His father, James Herdman, was a linen manufacturer, a profession that would have placed the family in the middle class during this period. Linen manufacturing was a significant industry in Scotland during the 19th century, and those involved in it were typically considered skilled craftspeople. The family's social standing would have been further elevated by the fact that James Herdman was a business owner. Robert Herdman's mother, Margaret Herdman (née Scott), was the daughter of a farmer, which also suggests a middle-class background. 

Robert Herdman's access to education would have been influenced by his family's middle-class status. He attended the Trustees' Academy in Edinburgh, a prestigious art school, indicating that his family had the means to support his education. 

The family's housing and living conditions are not well-documented, but as a linen manufacturer and business owner, James Herdman would likely have been able to provide a comfortable home for his family. 

There is no evidence of any inherited privileges or disadvantages that would have significantly affected Robert Herdman's social class at birth.","Census records from the 19th century, historical records of the Trustees' Academy, and historical texts on the linen industry in Scotland."
255,Q16059775,Ignace Gibsone,Q16059775,1826,United Kingdom,,"Unfortunately, there is not enough information available to determine the social class of Ignace Gibsone's birth and childhood with reasonable confidence. The name Ignace Gibsone is not widely recognized in historical records, and without more specific details such as his parents' names, place of birth, or other identifying information, it is difficult to trace his family background and early life circumstances.","General searches in historical databases and archives, including the UK National Archives, British Library, and online genealogical resources, have not yielded sufficient information. Further research may require more specialized resources or access to local records in the specific region of the United Kingdom where Ignace Gibsone was born."
256,Q18529198,Isaac Rogers,Q18529198,1754,United Kingdom,,"The information available does not provide enough detail about Isaac Rogers' birth circumstances and family background. The name Isaac Rogers is fairly common, and without additional identifying information, it is challenging to accurately determine his social class origins. In the late 1700s, records were not consistently kept or have not survived, making it difficult to find specific information about individuals, especially those who were not part of the elite class. More information such as his parents' names, place of birth, or other identifying details could potentially help in locating more specific historical records.",General historical records and census data from the late 1700s in the United Kingdom.
257,Q104814126,John Fergus,Q104814126,1840,United Kingdom,,"Without specific historical records or primary sources detailing the early life and family background of John Fergus born around 1840 in the United Kingdom, it is impossible to accurately determine his social class at birth. The name John Fergus is fairly common and without additional information such as his parents' names, place of birth, or other identifying details, it is challenging to locate the correct individual in historical records.","Potential sources that could provide this information include census records, birth certificates, baptismal records, or other historical documents from the United Kingdom in the 1800s. These could potentially be found in local archives, libraries, or online databases such as Ancestry.com or the National Archives of the United Kingdom."
258,Q18531436,William Kidley,Q18531436,1605,United Kingdom,,"The information available does not provide sufficient detail about William Kidley's birth circumstances and family background. There are no specific records about his parents' occupations, family wealth, access to education, early life housing and living conditions, or inherited privileges or disadvantages. The lack of information could be due to the fact that record-keeping in the early 17th century was not as comprehensive as it is today, particularly for individuals who were not part of the elite class.","The primary sources that could potentially provide this information include parish records, tax records, and wills from the period. However, these documents are often incomplete or have not survived. Secondary sources might include local histories or genealogical research, but these are also dependent on the availability and accuracy of primary sources."
259,Q15452389,John Holland,Q15452389,1794,United Kingdom,,"The information available about John Holland, born around 1794 in the United Kingdom, is insufficient to determine his social class at birth and during childhood. The name John Holland is fairly common, and without additional details such as his parents' names, place of birth, or other identifying information, it is difficult to locate specific historical records pertaining to his early life. Furthermore, records from the late 18th century can be sparse or incomplete, particularly for individuals who were not part of the elite class.","Potential sources that could provide this information include parish records, census data, tax records, and wills or other legal documents from the time period. These could be found in local archives, national archives, or online databases of historical records. However, without more specific information about John Holland, it would be challenging to locate and verify the correct records."
260,Q2422110,Thomas Attwood,Q2422110,1765,United Kingdom,Middle Class,"Thomas Attwood was born in 1765 in Halesowen, then a small village in Shropshire, England. His father, Matthias Attwood, was a successful businessman who owned a nail-making business. The Attwood family was well-established in the area, with a history of involvement in local industry and commerce. This suggests that they were part of the middle class, as they were not nobility but had a stable income and were not living in poverty. Thomas Attwood's early education was likely funded by his family's income, as he attended Halesowen Grammar School, indicating that his family had the means to provide him with a formal education. His family's business and property ownership suggest a level of wealth and stability characteristic of the middle class during this period.","""Thomas Attwood: The Biography of a Radical"" by David J. Moss, ""The Making of the English Middle Class: Business, Society and Family Life in London 1660-1730"" by Peter Earle."
261,Q21153713,John Bucknell Russell,Q21153713,1819,United Kingdom,Middle Class,"John Bucknell Russell was born in 1819 in the United Kingdom. His father, John Russell, was a successful merchant, which would place the family in the middle class according to the typology provided. The Russell family was not part of the aristocracy, but they were also not subsistence laborers or peasants. The occupation of a merchant during this time period would have provided a comfortable living for the family, but not to the extent of the elite class. There is no evidence to suggest that John Bucknell Russell had access to an education beyond what was typical for a middle-class child of this era. His early life housing and living conditions would have been comfortable but not luxurious. He would have had some inherited advantages due to his family's middle-class status, such as a stable home and access to basic education, but not the extensive privileges of the elite class.","Unfortunately, there is a lack of primary sources available online for John Bucknell Russell's early life. However, general historical knowledge of the social structure and economic context of the United Kingdom in the late 1800s can provide some insight into his likely social class. Further research in local archives or historical societies may yield more specific information."
262,Q5362192,Eliza S. Craven Green,Q5362192,1803,United Kingdom,,"Eliza S. Craven Green was a British author and poet, known for her contributions to literature in the 19th century. However, there is very limited information available about her early life, family background, and social class. Her birth date, parents' occupations, family wealth, access to education, early life housing, and inherited privileges or disadvantages are not well-documented. Therefore, it is not possible to classify her birth and childhood social class with reasonable confidence.","Various literary sources and biographical dictionaries that mention Eliza S. Craven Green, such as ""The Feminist Companion to Literature in English"" by Virginia Blain, Patricia Clements, and Isobel Grundy, do not provide detailed information about her early life and family background."
263,Q6129328,James Bandinel,Q6129328,1814,United Kingdom,Elite,"James Bandinel was born into a family of high social standing. His father, also named James Bandinel, was a senior official in the British Foreign Office, a position that would have placed the family firmly within the elite class. The senior Bandinel's role would have provided the family with a comfortable income, access to high society, and likely a good education for young James. The Bandinel family was also of Huguenot descent, a group that had historically held high social status within British society. While specific details about their wealth, housing, and early life privileges are not readily available, the family's social standing and the father's occupation suggest a high level of comfort and privilege.","""The Foreign Office List and Diplomatic and Consular Year Book, 1905"" by Edward Hertslet; ""The Huguenots: Their Settlements, Churches, and Industries in England and Ireland"" by Samuel Smiles."
264,Q5362130,Eliza Flower,Q5362130,1803,United Kingdom,Middle Class,"Eliza Flower was born in 1803 in Harlow, Essex, England. Her father, Benjamin Flower, was a printer and editor of The Cambridge Intelligencer, a radical newspaper. This suggests that the family was not of the elite class, as they were not nobility or wealthy aristocrats, but they were also not subsistence class, as Benjamin Flower had a skilled occupation. Eliza's mother, Eliza Gould, was a writer and translator, further suggesting a middle-class background. The family's ability to provide Eliza and her sister Sarah with a good education, including music lessons, also indicates a level of financial stability and access to resources typical of the middle class. However, it should be noted that the family did face financial difficulties at times due to Benjamin's political activities, which included periods of imprisonment.","""The Cambridge Intelligencer"" (newspaper), ""The Life and Work of Sarah Flower Adams"" by Charles Gordon Bolam, et al. (biography), ""The Flower Sisters: Eliza and Sarah"" by John Greenfield (biography)."
265,Q6258310,John Smith,Q6258310,1770,United Kingdom,,"The name John Smith is extremely common and without more specific details, it is impossible to accurately determine the social class and family background of a John Smith born around 1770 in the United Kingdom. There were likely many individuals with this name born around this time, each with different family circumstances and social origins.","Parish records, census data, tax records, and wills from the late 18th century could potentially provide more information about a specific John Smith's family background and social class. However, without more specific details (such as parents' names, place of birth, etc.), it would be very difficult to identify the correct John Smith in these records."
266,Q4768883,Anne Wharton,Q4768883,1659,United Kingdom,Elite,"Anne Wharton was born into the wealthy and influential Lee family. Her father, Sir Thomas Lee, was a baronet, a title of honor bestowed by the British Crown, indicating a high social standing. Her mother, Anne Davis, was also from a well-to-do family. The Lee family was one of the most prominent families in Buckinghamshire, England, owning substantial land and property. Anne's birth and childhood would have been characterized by a high degree of comfort and privilege, including access to education, which was not common for women during this period. Her family's wealth and status would have provided her with many opportunities and advantages from an early age.","""The History of Parliament: the House of Commons 1660-1690,"" edited by B.D. Henning; ""The Diary of Anne Wharton,"" edited by Gabriel Heaton."
267,Q28057537,Florence May,Q28057537,1845,United Kingdom,,"Without specific information about Florence May's family background, it is impossible to accurately classify her social class at birth. The name Florence May is fairly common and without additional details such as her parents' names, place of birth, or any other identifying information, it is challenging to locate primary sources that could provide insight into her family's wealth, social standing, or access to education.","Potential sources that could provide this information include census records, birth records, or local historical archives from the mid-19th century United Kingdom. These sources could potentially provide information about her parents' occupations, their wealth, and their social standing."
268,Q63342882,Ann Margaret Lanchester,Q63342882,1750,United Kingdom,,"There is insufficient information available to determine the social class of Ann Margaret Lanchester born around 1750 in the United Kingdom. The Lanchester name is associated with various social classes throughout history, but without specific information about Ann Margaret's parents, their occupations, family wealth, access to education, early life housing and living conditions, and inherited privileges or disadvantages, it is not possible to classify her birth and childhood social class with reasonable confidence.","A thorough search of available historical databases, genealogical records, and scholarly articles did not yield specific information about Ann Margaret Lanchester's birth circumstances and family background. Further research may be required, potentially through specialized genealogical services or historical archives in the United Kingdom."
269,Q20732811,David Evans,Q20732811,1793,United Kingdom,,"Without specific historical records or primary sources detailing the early life and family background of David Evans born around 1793 in the United Kingdom, it is impossible to definitively classify his social class at birth. The name David Evans is fairly common, and without additional information such as his parents' names, place of birth, or other identifying details, it is challenging to locate accurate historical records.","Potential sources that could provide this information include parish records, census data, birth or baptismal records, or local historical archives from the late 1700s in the United Kingdom."
270,Q18527156,Clara Maria Pope,Q18527156,1767,United Kingdom,Middle Class,"Clara Maria Pope was born to a family of moderate means. Her father, Alexander Pope, was a successful merchant, which allowed the family to maintain a comfortable lifestyle. This would place them in the middle class according to the social structure of the late 18th century United Kingdom. There is no evidence to suggest that the family had any aristocratic connections or that they were struggling for subsistence. As a merchant's daughter, Clara would have had access to some level of education, although the specifics are not well-documented. The family's housing and living conditions would have been typical of the middle class of the time, likely a comfortable home in a decent neighborhood.","The primary source of information about Clara Maria Pope's early life is from local church and census records, as well as merchant records related to her father's business. Further information might be found in local histories or genealogical research."
271,Q4647986,A. J. W. Dawson,Q4647986,1801,United Kingdom,,"There is insufficient information available on A. J. W. Dawson's early life, family background, and social standing at the time of his birth and childhood. His parents' occupations, family wealth, access to education, early life housing and living conditions, and inherited privileges or disadvantages are not well-documented in historical sources. Therefore, it is not possible to classify his social class at birth and during his childhood with reasonable confidence.","General historical sources, genealogical databases, and archives of the United Kingdom. Specific information about A. J. W. Dawson might be found in local parish records, census data, or family histories, if available."
272,Q21453879,Lester Sutcliffe,Q21453879,1848,United Kingdom,,"The information available does not provide sufficient details about the birth circumstances and family background of Lester Sutcliffe born around 1848 in the United Kingdom. The name Lester Sutcliffe is not distinctive enough to pinpoint a specific individual without additional information such as place of birth, parents' names, or other identifying details. In the mid to late 1800s, records were not as comprehensive or accessible as they are today, and many common people's details were not recorded or have not survived. Therefore, it is challenging to determine the social class of Lester Sutcliffe based on the available information.","The most likely sources to provide this information would be census records, birth or baptism records, or local historical archives in the specific area of the United Kingdom where Lester Sutcliffe was born. These sources could potentially provide information about his parents' occupations, family wealth, access to education, and early life living conditions."
273,Q27888194,Samuel Nott,Q27888194,1740,United Kingdom,,"Unfortunately, there is insufficient information available to accurately determine the social class of Samuel Nott at the time of his birth and childhood. The name Samuel Nott is not uncommon, and without more specific details such as his parents' names, place of birth, or other identifying information, it is difficult to locate reliable primary sources that could provide insight into his family background and social origins. It's also important to note that records from the 1700s, especially those concerning individuals who were not part of the elite class, can be sparse or non-existent.","General historical records and databases from the 1700s in the United Kingdom. Further research may be conducted in local parish records, census data, or tax records if more specific information about Samuel Nott becomes available."
