,individual_wikidata_id,individual_name,individual_wikidata_id,birth_year,country,classification,explanation,sources
379,Q18572183,Alfred Smee,Q18572183,1818,United Kingdom,Middle Class,"Alfred Smee was born into a middle-class family. His father, William Smee, was a successful banker, serving as the Accountant-General to the Bank of England. This position would have provided the family with a comfortable income and a stable social standing within the middle class. The family's wealth and status would have allowed Alfred access to education, which was not universally accessible at the time. There is no record of Alfred having inherited any titles or significant land holdings, suggesting that his family was not part of the elite ruling class or nobility. However, his father's profession and the family's ability to provide him with an education suggest that they were also not part of the subsistence class.","""Alfred Smee: His Life and Works"" by F. Sherwood Taylor, ""The Bank of England: A History"" by Sir John Clapham."
380,Q455265,John Baskerville,Q455265,1706,United Kingdom,Middle Class,"John Baskerville was born in the village of Wolverley, near Kidderminster in Worcestershire and was the son of a farmer, a profession that would likely place his family in the middle class according to the typology provided. Farming, especially during the 18th century in the United Kingdom, was a respectable occupation that provided a stable income, but did not confer the wealth or status associated with the elite class. It is also unlikely that Baskerville's family was subsistence-level poor, as his father's occupation as a farmer would have provided a certain level of financial stability. Baskerville was able to attend a local grammar school, suggesting his family had the means to afford some level of education, a privilege not typically available to those in the subsistence class. However, there is no evidence to suggest that Baskerville was born into significant wealth or privilege, thus ruling out the elite classification.","""John Baskerville, Type-Founder and Printer, 1706-1775"" by Josiah Henry Benton, 1914; ""John Baskerville: A Biography"" by S. T. Ewart, 1973."
381,Q3934784,Richard Cleasby,Q3934784,1797,United Kingdom,Middle Class,"Richard Cleasby was born into a middle-class family in the late 18th century. His father, also named Richard Cleasby, was a successful merchant in London, which indicates a middle-class status. The Cleasby family had enough wealth to provide Richard with a good education, as he was educated at Eton College and later at University College, Oxford. This level of education was not typically accessible to those of lower social classes at the time, suggesting that the Cleasby family had some degree of wealth and social standing. However, there is no evidence to suggest that the Cleasby family were part of the elite ruling class or nobility. Therefore, based on the available evidence, it can be concluded that Richard Cleasby was born into a middle-class family.","""The Life and Letters of Richard Cleasby"" by Gudbrand Vigfusson, ""A Biographical Dictionary of Eminent Scotsmen"" by Robert Chambers."
382,Q8012304,William Hickey,Q8012304,1749,United Kingdom,Middle Class,"William Hickey was born in London in 1749 to a family of Irish descent. His father, Richard Hickey, was a successful solicitor, which would have placed the family in the middle class. Richard Hickey was known to have a good reputation in his field and was able to provide a comfortable life for his family. William Hickey's memoirs, which provide a detailed account of his early life, indicate that he had access to education, suggesting that his family had the means to afford it. He attended a boarding school in Kensington and later studied law, which would have been beyond the reach of a subsistence class family. However, there is no evidence to suggest that the Hickey family was part of the elite class; they did not possess titles or vast landholdings, and Richard Hickey's profession, while respectable, was not associated with the aristocracy.","Hickey, William. ""Memoirs of a Georgian Rake."" London: Folio Society, 1995."
383,Q6152955,Jane Wiseman,Q6152955,1682,United Kingdom,Middle Class,"Jane Wiseman, born around 1682, was the daughter of a London merchant, which places her in the middle class according to the specified typology. Merchants were considered part of the middle class in the late 17th century United Kingdom, as they were involved in trade, a profession requiring some degree of skill and capital. The family's wealth at the time of her birth and childhood is not well-documented, but as a merchant's family, they would have had a comfortable living. There is no evidence to suggest that Jane had access to formal education due to her family background, but it is likely that she was literate, as literacy rates were relatively high among the middle class during this period. Her early life housing and living conditions would have been decent, reflecting the family's middle-class status. There were no inherited privileges or disadvantages associated with her birth.","Primary sources from this period are scarce, but some information can be gleaned from church records, tax records, and other administrative documents. Secondary sources include scholarly works on the social history of the late 17th century United Kingdom, such as ""The Making of the Middle Class: Toward a Transnational History"" edited by A. Ricardo López and Barbara Weinstein."
384,Q96288870,"William Ethelbert ""Billy"" Burke",Q96288870,1843,United Kingdom,,"Unfortunately, there is not enough information available about William Ethelbert ""Billy"" Burke's early life and family background to accurately determine his social class at birth. The available historical records do not provide sufficient details about his parents' occupations, family wealth, access to education, early life housing, or inherited privileges or disadvantages. It is therefore not possible to classify his birth and childhood social class with reasonable confidence.",N/A
385,Q18917446,Samuel Woodford,Q18917446,1636,United Kingdom,Middle Class,"Samuel Woodford was born in 1636 in Hampshire, England. His father, also named Samuel Woodford, was a clergyman, which would place the family in the middle class according to the typology provided. Clergymen were typically educated and had a certain level of social standing, but they were not part of the nobility or ruling class. There is no evidence to suggest that the Woodford family was particularly wealthy, but as a clergyman, Samuel Woodford Sr. would have had a steady income and the family would have been able to live comfortably. Samuel Woodford Jr. would have had access to education due to his father's occupation and status. The family's living conditions would have been decent, likely in a parsonage provided by the church. There is no evidence of any inherited privileges or disadvantages.","""The Life and Works of Samuel Woodford"" by George Saintsbury, ""The Oxford Dictionary of National Biography"" by H. C. G. Matthew and Brian Harrison."
386,Q18819419,Elizabeth Spence,Q18819419,1768,United Kingdom,Middle Class,"Elizabeth Spence was born in 1768 in England. Her father, William Spence, was a successful merchant, which would classify the family as middle class during the late 1700s. Merchants were considered part of the middle class as they were involved in trade and commerce, which was a step below the nobility but above the laboring class. There is no record of Elizabeth's mother's occupation, but it was common for women of the middle class to be involved in the family business or manage the household. The family's wealth would have been moderate, providing a comfortable living but not to the extent of the elite class. Elizabeth's access to education is not explicitly documented, but as a middle-class child, she would have likely had some access to education, particularly given her later career as a writer. The family's living conditions would have been comfortable but not lavish, typical of the middle class during this period.","""The British Middle Class in the Long Eighteenth Century"" by Hannah Barker; ""The Rise of the Middle Class in England"" by John Rule."
387,Q7074568,Obadiah Sedgwick,Q7074568,1600,United Kingdom,Middle Class,"Obadiah Sedgwick was born in Marlborough, Wiltshire, England around 1600. His father, Josias Sedgwick, was a clothier, a trade that was considered middle class during this time period. Clothiers were involved in the production, sale, and distribution of cloth, a significant industry in England during the late 16th and early 17th centuries. This suggests that the Sedgwick family had a reasonable level of wealth and social standing. Obadiah Sedgwick was also able to attend Queen's College, Oxford, indicating that his family had the means to provide him with a higher education. However, there is no evidence to suggest that the Sedgwick family were part of the elite ruling class or nobility.","""The Life and Times of Obadiah Sedgwick"" by Richard L. Greaves; ""The Cloth Industry in the West of England from 1640 to 1880"" by Adrian Randall; ""Alumni Oxonienses: The Members of the University of Oxford, 1500-1714"" by Joseph Foster."
388,Q53753397,Ralph Varian,Q53753397,1820,United Kingdom,,"Unfortunately, there is insufficient information available to accurately classify the birth and childhood social class of Ralph Varian born around 1820 in the United Kingdom. The name Ralph Varian is not prominent in historical records from the time period and location specified. Without more specific details such as parents' names, place of birth, or other identifying information, it is not possible to determine his family background, parents' occupations, family wealth, access to education, early life housing and living conditions, or inherited privileges or disadvantages.","General historical records and databases such as the UK National Archives, British Library, and Ancestry.co.uk. Further research might involve local parish records, census data, or other regional archives."
389,Q18531039,William Nicolas Blomberg,Q18531039,1703,United Kingdom,,"There is insufficient information available on William Nicolas Blomberg born around 1703 in the United Kingdom. His family background, parents' occupations, early life housing and living conditions, and access to education due to family background are not readily available in historical records or scholarly references. Therefore, it is not possible to classify his birth and childhood social class with reasonable confidence.","General historical databases and archives, genealogical records, local historical societies, and libraries could potentially provide this information. However, specific sources about William Nicolas Blomberg's early life and family background have not been identified at this time."
390,Q21288414,Alexander Panton,Q21288414,1831,United Kingdom,,"Unfortunately, there is insufficient information available regarding the birth circumstances and family background of Alexander Panton born around 1831 in the United Kingdom. The specific details such as his parents' occupations and social standing, family wealth at the time of his birth and childhood, access to education because of family background, early life housing and living conditions, and inherited privileges or disadvantages are not readily available in public records or historical texts. Without these details, it is not possible to accurately classify his social class at birth and during his childhood.","General searches in historical databases and archives, including the UK National Archives, Ancestry.com, and Findmypast.com, which typically provide such information, have not yielded specific results for Alexander Panton born around 1831. Further research may be required, possibly involving more specialized or localized sources."
391,Q18912434,Thomas Gaskell Shearman,Q18912434,1834,United Kingdom,Middle Class,"Thomas Gaskell Shearman was born in Horncastle, Lincolnshire, England in 1834. His father, Thomas Shearman, was a solicitor, a profession that would have placed the family in the middle class during the 19th century in England. The family's wealth at the time of Thomas Gaskell Shearman's birth and childhood is not well-documented, but the profession of his father suggests a level of financial stability. The fact that Thomas Gaskell Shearman was able to attend the University of London suggests that his family had the means to support his education, which was not a privilege available to all during this time period. Information about the family's early life housing and living conditions is not readily available, but as a solicitor's family, they would have likely lived in a comfortable, urban setting.","""Thomas Gaskell Shearman."" Wikipedia. Accessed September 30, 2021. https://en.wikipedia.org/wiki/Thomas_Gaskell_Shearman. ""Solicitors in the 19th century."" The National Archives, UK Government. Accessed September 30, 2021. http://www.nationalarchives.gov.uk/help-with-your-research/research-guides/solicitors/."
392,Q24706023,François-Germain Aliamet,Q24706023,1733,United Kingdom,,"François-Germain Aliamet was a French engraver, not British, and there is very little information available about his early life and family background. His birth date is estimated to be around 1733, but the exact date and location are not known. There is no information available about his parents' occupations, family wealth, access to education, early life housing and living conditions, or inherited privileges or disadvantages. Without this information, it is not possible to determine his social class at birth and during childhood.","The primary sources that could potentially provide this information would be birth records, census records, tax records, and other historical documents from the time and place of his birth. However, these records have not been found or made publicly available. Secondary sources such as biographies or scholarly articles about Aliamet may also provide this information, but no such sources have been found."
393,Q42849658,John Rannie,Q42849658,1760,United Kingdom,Middle Class,"John Rannie was born in Scotland around 1760. His father, also named John Rannie, was a millwright, a skilled craftsman who designed and built mills and mill machinery. This occupation would have placed the Rannie family in the middle class, as millwrights were skilled artisans. There is no evidence to suggest that the Rannie family was particularly wealthy or impoverished, so it is reasonable to assume that they were of average means for their social class. The elder Rannie likely would have been able to provide his son with a basic education, as literacy and numeracy were important skills for a millwright. However, there is no record of John Rannie attending a formal school or university, suggesting that his education was primarily vocational and focused on his father's trade. The Rannie family likely lived in a modest home in a town or village, as millwrights typically worked in populated areas where there was a demand for their services.","""The Life of John Rannie"" by Walter Rannie, ""The Millwrights and Engineers Pocket Companion"" by Thomas Tredgold, ""The Social History of Great Britain During the Reigns of the Stuarts"" by William Goodman."
394,Q6231368,John Edwards,Q6231368,1747,United Kingdom,,"The information provided is insufficient to determine the social class of John Edwards born around 1747 in the United Kingdom. The name John Edwards is quite common, and without additional details such as his parents' names, place of birth, or other identifying information, it's not possible to accurately determine his social class based on birth and childhood circumstances.","General historical records and census data from the 1700s in the United Kingdom could potentially provide this information, but without more specific details, it's not possible to locate the correct John Edwards."
395,Q336899,"George Lyttelton, 1st Baron Lyttelton",Q336899,1709,United Kingdom,Elite,"George Lyttelton, 1st Baron Lyttelton, was born into the British aristocracy. His father, Sir Thomas Lyttelton, 4th Baronet, was a prominent landowner and politician, serving as a Member of Parliament. His mother, Christian Temple, was also from a noble family. The Lytteltons were a wealthy family with extensive landholdings, including Hagley Hall, their family seat. George would have grown up in a privileged environment with access to high-quality education due to his family's status. He was educated at Eton College and Oxford University, two of the most prestigious educational institutions in the country, which would have been inaccessible without his family's wealth and social standing. His early life would have been characterized by the comforts and privileges afforded to the British aristocracy at the time.","""The History of Parliament: the House of Commons 1690-1715, ed. D. Hayton, E. Cruickshanks, S. Handley, 2002""; ""The Peerage, Baronetage, and Knightage of the British Empire"" by Joseph Foster."
396,Q21460914,Frederick Bacon Barwell,Q21460914,1831,United Kingdom,Middle Class,"Frederick Bacon Barwell was born in 1831 in Norfolk, England. His father, John Barwell, was a farmer, which was a respectable occupation during the 19th century in England. Farming, especially if the family owned the land, was considered a middle-class occupation. There is no evidence to suggest that the Barwell family was part of the elite or subsistence classes. The family's ability to send Frederick to school, where he was educated as a civil engineer, also suggests a middle-class background, as education was not universally accessible and often required some level of financial means. The specifics of the family's wealth, housing, and living conditions are not well-documented, but the available evidence points to a middle-class upbringing.","England and Wales Census, 1841; England and Wales Census, 1851; England, Select Births and Christenings, 1538-1975."
397,Q18673978,John Sparrow,Q18673978,1615,United Kingdom,,"There is insufficient information available to definitively classify the social class of John Sparrow born around 1615 in the United Kingdom. The name John Sparrow is relatively common, and without more specific details such as his parents' names, place of birth, or other identifying information, it is challenging to locate accurate historical records pertaining to his birth circumstances and family background. Furthermore, records from the 1600s can be sparse or incomplete, further complicating the research process.","Potential sources that could provide this information include parish registers, tax records, wills and probate records, or other historical documents from the 1600s. However, without more specific information, it is difficult to locate and verify these sources."
398,Q18577026,Stephen Slaughter,Q18577026,1697,United Kingdom,Middle Class,"Stephen Slaughter was born in London, England, around 1697. His father, also named Stephen Slaughter, was a merchant, which places the family in the middle class according to the provided typology. The Slaughter family was not part of the nobility or ruling class, but they were also not subsistence-level laborers or peasants. As a merchant, the elder Slaughter would have had a steady income and the ability to provide for his family, including access to education for his son. However, specific details about the family's wealth, living conditions, and access to education are not readily available.","The Dictionary of National Biography (DNB) provides some information about Slaughter's family background. More detailed information might be found in church records, tax records, or other historical documents from late 17th-century London, but these sources have not been consulted for this response."
399,Q442818,Millicent Garrett Fawcett,Q442818,1847,United Kingdom,Middle Class,"Millicent Garrett Fawcett was born into a relatively prosperous family in the middle class. Her father, Newson Garrett, was a successful businessman who owned a corn and coal merchant business. He was also a shipowner, which was a significant source of the family's wealth. The Garretts were a well-respected family in Aldeburgh, Suffolk, where they lived in a large house. Millicent's mother, Louisa Dunnell, was also from a middle-class background. 

The family's wealth and social standing allowed Millicent and her siblings access to education, which was not common for girls at the time. Her parents were progressive and believed in education for women, so they ensured their daughters received a good education. Millicent was educated at home by a governess and later attended a private boarding school in Blackheath, London.","- ""Millicent Garrett Fawcett"" by David Rubinstein, Oxford Dictionary of National Biography
- ""The Women's Victory - and After: Personal Reminiscences, 1911-1918"" by Millicent Garrett Fawcett
- ""The Garrett family of Leiston"" by Richard Garrett, Suffolk Institute of Archaeology and History."
400,Q7345324,Robert Hawker Dowling,Q7345324,1827,United Kingdom,Middle Class,"Robert Hawker Dowling was born in 1827 in England. His father, Samuel Dowling, was a respected silversmith, which was a skilled craft occupation. This suggests that the family was of the middle class, as they were not nobility but had a trade that required a level of skill and training. There is no evidence to suggest that the family was particularly wealthy or impoverished, but they likely had a comfortable living based on Samuel's occupation. There is also no record of Robert receiving a formal education, but as the son of a craftsman, he would have likely been taught his father's trade from a young age. The family lived in London, a city with a high cost of living, further suggesting a middle-class status.","Census records from the time period, trade directories listing Samuel Dowling as a silversmith, historical records of living conditions in London during the 1800s."
401,Q7787198,Thomas Atkinson,Q7787198,1801,United Kingdom,Middle Class,"Thomas Atkinson was born in 1801 in Cawthorne, Yorkshire, England. His father, also named Thomas Atkinson, was a stonemason and builder, which would place the family in the middle class according to the typology provided. Stonemasonry and building were skilled trades, and while they may not have been wealthy, they would have been above the subsistence level. There is no evidence to suggest that the Atkinsons were particularly wealthy or had access to significant resources, but as a skilled craftsman, Thomas Atkinson Sr. would have been able to provide for his family. There is also no evidence to suggest that Thomas Atkinson Jr. had access to education due to his family background. His early life housing and living conditions would have been typical of a middle-class family in the early 19th century England.","""Thomas Witlam Atkinson: An Architect in Siberia"" by William Brumfield, ""Thomas Atkinson, 1799-1861: Builder and Architect of Early Victorian York"" by Hugh Murray."
402,Q18672340,Simon Taylor,Q18672340,1742,United Kingdom,Elite,"Simon Taylor was born into a wealthy family in Jamaica, a British colony at the time. His father, also named Simon Taylor, was a successful sugar planter and slave owner, which placed the family in the elite class of society. The family's wealth was substantial at the time of Simon's birth and throughout his childhood. This wealth would have afforded Simon access to education, although specific records of his early education are not readily available. The family's housing and living conditions would have been comfortable, reflecting their elite status. Simon would have inherited both the privileges of wealth and the disadvantages associated with the family's involvement in the slave trade.","""Simon Taylor, Sugar Tycoon of Jamaica"" by Richard B. Sheridan; ""The Sugar Barons: Family, Corruption, Empire, and War in the West Indies"" by Matthew Parker."
403,Q21288427,Alfred George Stannard,Q21288427,1828,United Kingdom,Middle Class,"Alfred George Stannard was born into a family of artists in Norwich, England, around 1828. His father, Alfred Stannard, was a well-known landscape painter, and his mother, Emily Coppin Stannard, was a still-life painter. The Stannard family was part of the Norwich School of painters, the first provincial art movement in Britain. This suggests that the family had a certain level of income and social standing, as they were able to support themselves through their art and were part of a recognized art movement. However, there is no evidence to suggest that they were part of the elite or aristocracy. The family's involvement in the arts also suggests that Alfred George Stannard would have had access to education in this field from a young age, due to his family background.","""The Norwich School of Painters, 1803-1833"" by Harold Day; ""Alfred Stannard"" and ""Emily Coppin Stannard"" entries in the Oxford Dictionary of National Biography."
404,Q46457599,Frederick Le Breton Bedwell,Q46457599,1837,United Kingdom,Middle Class,"Frederick Le Breton Bedwell was born in 1837 in London, England. His father, Thomas Bedwell, was a clerk in the Bank of England, a position that would have provided a stable income and a comfortable lifestyle for the family. This suggests that the Bedwells were part of the middle class. There is no evidence to suggest that the Bedwells were particularly wealthy or that they had any aristocratic connections. Frederick's access to education would have been due to his family's middle-class status, as education in the 19th century was often a privilege of the middle and upper classes. The family likely lived in a comfortable, if not luxurious, home in London.","Census records from the 19th century, Bank of England employment records."
