,individual_wikidata_id,individual_name,individual_wikidata_id,birth_year,country,classification,explanation,sources
96,Q264918,Arthur de Gobineau,Q264918,1816,Italy,Elite,"Joseph Arthur Comte de Gobineau was born into an aristocratic family in Ville-d'Avray, near Paris, France, not Italy, on July 14, 1816. His father, Louis de Gobineau, was a military officer and a staunch royalist, while his mother, Anne-Louise Magdeleine de Gercy, was the daughter of a non-noble seigneur. Despite the family's noble status, they were not wealthy. However, they were still part of the elite class due to their aristocratic lineage and the social privileges that came with it. Gobineau's father had a significant influence on him, instilling in him a sense of aristocratic pride and a belief in the superiority of the nobility. This upbringing likely played a role in shaping Gobineau's later ideas about race and social hierarchy.","""Arthur de Gobineau"", Encyclopaedia Britannica; ""The Life of Gobineau"", in The World of the Paris Café: Sociability among the French Working Class, 1789-1914 by W. Scott Haine."
97,Q8459,Giorgione,Q8459,1478,Italy,Middle Class,"Giorgione, whose full name was Giorgio Barbarelli da Castelfranco, was born in the small town of Castelfranco Veneto, near Venice, around 1477-1478. His father, Giovanni, was a coppersmith, and his mother, Lucia, was a housewife. The family was not wealthy, but they were not poor either, indicating a middle-class status. The fact that Giorgione was able to receive an education and later become an apprentice to the painter Giovanni Bellini suggests that his family had enough resources to support his early training. However, there is no evidence to suggest that his family was part of the elite or ruling class, nor were they subsistence-level laborers or peasants.","Vasari, Giorgio. ""Lives of the Most Eminent Painters, Sculptors, and Architects."" 1550. (Primary source mentioning Giorgione's family background and early life)"
98,Q37562,Donatello,Q37562,1386,Italy,Middle Class,"Donatello, born Donato di Niccolò di Betto Bardi, was born in Florence, Italy around 1386. His father, Niccolò di Betto Bardi, was a member of the Florentine Wool Combers Guild, indicating that the family was of the artisan class. This would place them in the middle class according to the provided typology. There is no evidence to suggest that the family was particularly wealthy or impoverished, suggesting a relatively stable economic situation. As for education, Donatello was educated at the home of the Martellis, a wealthy and influential Florentine family. This was likely due to his father's connections rather than the family's wealth or status. His early life housing and living conditions would have been typical of a middle-class artisan family in late 14th century Florence.","Vasari, Giorgio. ""Lives of the Artists."" 1550. Poeschke, Joachim. ""Donatello and His World: Sculpture of the Italian Renaissance."" 1993."
99,Q310973,Lorenzo Lotto,Q310973,1480,Italy,Middle Class,"Lorenzo Lotto was born in Venice, Italy around 1480. His family background is not well-documented, but it is generally believed that he came from a middle-class family. His father, Tommaso Lotto, was a merchant, which was a typical occupation for the middle class during this period. There is no evidence to suggest that his family was particularly wealthy or impoverished, so it is reasonable to assume that they were of average means for their social class. The fact that Lotto was able to receive an education and train as a painter suggests that his family had enough resources to provide him with these opportunities, which would not have been available to those in the subsistence class. However, there is no evidence to suggest that he was born into the elite class, as his family did not hold any titles or significant landholdings.","""Lorenzo Lotto: Rediscovered Master of the Renaissance,"" by David Alan Brown, Peter Humfrey, and Mauro Lucco (1997); ""Lorenzo Lotto: An Essay in Constructive Art Criticism,"" by Bernard Berenson (1895)."
100,Q223723,Cesare Beccaria,Q223723,1738,Italy,Elite,"Cesare Beccaria was born into a noble family in Milan, Italy. His father, Gian Beccaria, was a magistrate in the court of appeals, a position that would have placed the family among the ruling class. The Beccaria family was wealthy, and Cesare was able to receive a quality education because of his family's status and resources. He was educated at a Jesuit school from a young age and later attended the University of Pavia, which would have been accessible only to those of higher social standing. His early life housing and living conditions would have been comfortable and privileged due to his family's wealth and status.","""Cesare Beccaria: Biography & Crime and Punishment."" Study.com, www.study.com/academy/lesson/cesare-beccaria-biography-crime-and-punishment.html. ""Cesare Beccaria."" Encyclopædia Britannica, www.britannica.com/biography/Cesare-Beccaria."
101,Q76718,Anton Raphael Mengs,Q76718,1728,Italy,Middle Class,"Anton Raphael Mengs was born in Aussig in Bohemia (now Ústí nad Labem, Czech Republic) in 1728, not Italy. His father, Ismael Mengs, was a Danish painter who worked at the court of the King of Saxony, which suggests a middle-class background. The fact that his father was a court painter indicates that the family had a stable income and a certain social standing, but they were not part of the nobility. Mengs received his early education from his father, which suggests that the family had enough resources to provide for his education. There is no evidence to suggest that Mengs was born into wealth or that he had any inherited privileges or disadvantages. His early life housing and living conditions would have been typical of a middle-class family of the time.","""Anton Raphael Mengs, 1728–1779"" by Steffi Roettgen, ""Anton Raphael Mengs and Neoclassicism"" by Steffi Roettgen."
102,Q7803,Bronzino,Q7803,1503,Italy,Middle Class,"Agnolo di Cosimo, better known as Bronzino, was born in Monticelli, near Florence, Italy, around 1503. His father, Giovanni di Cosimo de' Medici, was a butcher, which suggests that the family belonged to the middle class, as butchery was a skilled trade. There is no evidence to suggest that his family was particularly wealthy or impoverished. The fact that Bronzino was able to receive an education and train as an artist suggests that his family had some means, as education was not universally accessible at the time. However, this does not necessarily indicate significant wealth, as many middle-class families would have prioritized education for their children.","- ""Bronzino."" The Complete Works. http://www.bronzino.org/
- ""Bronzino."" Encyclopædia Britannica. https://www.britannica.com/biography/Bronzino
- ""Bronzino."" The National Gallery, London. https://www.nationalgallery.org.uk/artists/bronzino"
103,Q202420,Cesare Lombroso,Q202420,1835,Italy,Middle Class,"Cesare Lombroso was born in Verona, Italy, in 1835 to a wealthy Jewish family. His father, Aronne Lombroso, was a tradesman, which would typically place the family in the middle class according to the typology provided. The family's wealth would have ensured a comfortable living environment and access to education. Indeed, Lombroso was able to study at the universities of Padua, Vienna, and Paris, indicating that his family had the means to support his education. However, as a Jewish family in Italy during this period, they may have faced certain social disadvantages and restrictions, despite their wealth.","- ""Cesare Lombroso."" Encyclopædia Britannica. https://www.britannica.com/biography/Cesare-Lombroso
- ""Cesare Lombroso and the Origins of Criminology: Rethinking Criminological Tradition."" Crime, Histoire & Sociétés / Crime, History & Societies, Vol. 7, No. 2, 2003. https://www.jstor.org/stable/42849240
- ""Cesare Lombroso."" Jewish Virtual Library. https://www.jewishvirtuallibrary.org/cesare-lombroso"
104,Q318254,Poggio Bracciolini,Q318254,1380,Italy,Middle Class,"Poggio Bracciolini was born in Terranuova, near Florence, Italy, around 1380. His father, Guccio Bracciolini, was a notary by profession, which was a respected occupation in the middle class during the late 1300s in Italy. Notaries were responsible for drafting legal documents, which required literacy and a certain level of education, suggesting that the family had access to some resources and education. However, there is no evidence that the Bracciolini family was part of the nobility or the wealthy elite. The family's status as notaries would have placed them within the middle class, as they were not laborers or peasants, but also not part of the ruling class or aristocracy.","""Poggio Bracciolini: A Preliminary Study in the History of Humanism"" by William Shepherd; ""Two Renaissance Book Hunters: the letters of Poggius Bracciolini to Nicolaus de Niccolis"" translated from the Latin and annotated by P. S. Allen and H. M. Allen."
105,Q213220,Aldus Manutius,Q213220,1449,Italy,Middle Class,"Aldus Manutius, born Aldo Manuzio, was born in Bassiano, Italy, around 1449. His family was of the middle class, with his grandfather being a councilman of the town. His father was a well-respected architect and engineer, which would have provided the family with a stable income and a certain level of social standing. This background likely afforded Manutius access to education, as he was tutored by the humanist scholar Gaspare da Verona and later attended the University of Rome. His early life housing and living conditions would have been comfortable, but not luxurious, typical of a middle-class family in Italy during the late 1400s. There is no evidence of inherited privileges or disadvantages.","""Aldus Manutius: A Legacy More Lasting Than Bronze"" by Helen Barolini (2015); ""Aldus Manutius and His Thesaurus Cornucopiae of 1496"" by Antje Lemke (1958)."
106,Q505613,Pompeo Batoni,Q505613,1708,Italy,Middle Class,"Pompeo Batoni was born in Lucca, Italy, in 1708. His father, Paolino Batoni, was a goldsmith, which was a skilled craft occupation. This suggests that the Batoni family belonged to the middle class, as goldsmithing was a trade typically associated with this social stratum. There is no evidence to suggest that the Batoni family was particularly wealthy or impoverished, so it is reasonable to assume that they were of average means for their social class. Furthermore, Batoni's early access to art education, likely facilitated by his father's trade, suggests a level of familial resources and social standing that aligns with the middle class. However, specific details about Batoni's early life housing, living conditions, and inherited privileges or disadvantages are not well-documented.","""Pompeo Batoni: A Complete Catalogue of His Works with an Introductory Text"" by Anthony M. Clark, ""Pompeo Batoni (1708-1787) and his British Patrons"" by Edgar Peters Bowron."
107,Q316731,Federico Barocci,Q316731,1535,Italy,Middle Class,"Federico Barocci was born in Urbino, Italy, around 1535. His family was of the middle class, as his father, Ambrogio Barocci, was a well-known goldsmith and engraver. This occupation would have placed the Barocci family within the middle class, as goldsmithing and engraving were skilled crafts. The family's wealth would have been moderate, enough to provide Federico with a basic education and a comfortable living condition. There is no evidence to suggest that Barocci was born into a family of nobility or that he had any inherited privileges or disadvantages due to his birth. His access to education would have been due to his family's middle-class status, not because of any inherent merit.","""Federico Barocci (1535–1612) and His Legacy,"" Marjorie Och, The Art Bulletin, Vol. 96, No. 1 (March 2014), pp. 104-107. ""Federico Barocci: Renaissance Master of Color and Line,"" Emiliania Pasca Noether, Renaissance Quarterly, Vol. 47, No. 1 (Spring, 1994), pp. 212-214."
108,Q314488,Leonardo Bruni,Q314488,1370,Italy,Middle Class,"Leonardo Bruni, also known as Leonardo Aretino, was born in Arezzo, Italy, around 1370. His family was not of noble birth or particularly wealthy, which places them outside of the elite class. However, they were not subsistence level either. Bruni's father was a notary, a profession that required literacy and some level of education, which suggests a middle-class status. The fact that Bruni was able to receive an education in his early life also indicates that his family had some means, as education during this time was not universally accessible and often required resources. However, the specifics of his early life housing and living conditions are not well-documented, and there is no evidence of any inherited privileges or disadvantages.","""Leonardo Bruni: Italian Humanist and Historian"" by James Hankins, ""The Cambridge Companion to Renaissance Humanism"" by Jill Kraye."
109,Q174330,Filippo Brunelleschi,Q174330,1377,Italy,Middle Class,"Filippo Brunelleschi was born in Florence, Italy, around 1377. His father was a notary, an occupation that would have placed the family in the middle class of society. Notaries were skilled professionals who were responsible for drawing up contracts, wills, and other legal documents. This would have provided the family with a stable income and a comfortable lifestyle, but they were not part of the elite ruling class or nobility. Brunelleschi's access to education would have been due to his family's social standing and financial resources. He was trained as a goldsmith and clockmaker, which suggests that his family had the means to provide him with a good education. His early life housing and living conditions would have been typical of the middle class in Florence at the time.","- ""Brunelleschi: His Life and Work"" by Howard Saalman
- ""The Feud That Sparked the Renaissance: How Brunelleschi and Ghiberti Changed the Art World"" by Paul Robert Walker
- ""Filippo Brunelleschi: The Buildings"" by Giovanni Fanelli and Michele Fanelli"
110,Q123150,Francesco Borromini,Q123150,1599,Italy,Middle Class,"Francesco Borromini was born in 1599 in Bissone, a small town in the Italian-speaking part of Switzerland. His family was not of noble or aristocratic lineage, but rather belonged to the middle class. His father, Giovanni Domenico Borromini, was a stonemason, and his mother, Anastasia Garovo, was from a family of stonemasons. This indicates that the family was involved in skilled craftwork, a characteristic of the middle class during this period. The family's wealth was likely modest but sufficient, given their trade. Borromini's access to education would have been influenced by his family background. As the son of a stonemason, he likely learned the basics of the craft from his father, which was a common practice in artisan families. His early life housing and living conditions would have been typical of a middle-class family in late 16th-century Italy. There is no evidence of any inherited privileges or disadvantages.","""Francesco Borromini: Swiss Architect."" Encyclopædia Britannica. ""Borromini, Francesco."" Grove Art Online. Oxford Art Online. Oxford University Press."
111,Q205148,Filippo Lippi,Q205148,1406,Italy,Subsistence,"Filippo Lippi was born in Florence, Italy, around 1406. His parents were both dead by the time he was two years old, leaving him and his brother in the care of a poor aunt. There is no record of his parents' occupations, but given the circumstances of his early life, it is unlikely they were of high social standing. His early life was marked by poverty and hardship. He did not have access to education because of his family background. Instead, he was placed in the Carmelite friary of Santa Maria del Carmine in Florence at the age of eight, where he received a basic education and began his training in art. His early life housing and living conditions were likely modest and simple, characteristic of the subsistence class. He did not have any inherited privileges and his early life was marked by disadvantages, including the loss of his parents and poverty.","Vasari, Giorgio. ""Lives of the Most Eminent Painters Sculptors and Architects."" Modern Library, 2006."
112,Q212476,Pierre Choderlos de Laclos,Q212476,1741,Italy,Middle Class,"Pierre Choderlos de Laclos was born in Amiens, France, not Italy, in 1741. His father, Claude François Choderlos, was a government official, serving as the Receiver of Taxes in Amiens. This position would have placed the family in the middle class, as it was a respectable occupation but not one associated with the nobility or ruling class. Laclos' mother, Marie-Anne-Julie Carel, was the daughter of a lawyer, further supporting the family's middle-class status. There is no evidence to suggest that the family was particularly wealthy, but their status would have allowed Laclos access to education. He attended the College of Jesuits in Amiens, which would have been a privilege not available to those of lower social classes. His early life housing and living conditions are not well-documented, but given his father's occupation, it is likely that they were comfortable but not luxurious.","""Choderlos de Laclos, Pierre Ambroise François (1741–1803)."" Encyclopedia of the Enlightenment, edited by Alan Charles Kors, Oxford University Press, 2002."
113,Q220136,Giambologna,Q220136,1529,Italy,Middle Class,"Giambologna, originally named Jean Boulogne, was born in Douai, Flanders (now in France, but then part of the Spanish Netherlands). His father was a merchant, which places the family in the middle class according to the provided typology. There is no evidence to suggest that his family was particularly wealthy or impoverished. The fact that Giambologna was able to train as an artist suggests that his family had enough resources to provide him with an education, which was not a given for lower-class families of the time. However, there is no evidence to suggest that he was born into the elite class, as there is no record of his family holding any titles or significant landholdings.","Avery, Charles. ""Giambologna: The Complete Sculpture."" Phaidon, 1987. Baldinucci, Filippo. ""Notizie De' Professori Del Disegno Da Cimabue In Qua."" Stamperia S.A.R., 1681."
114,Q271814,Giovanni Verga,Q271814,1840,Italy,Middle Class,"Giovanni Verga was born in Catania, Sicily, on September 2, 1840, into a well-off family of merchants. His father, Giovanni Battista Catalano Verga, was a successful trader, and his mother, Caterina Di Mauro, came from a family of merchants as well. Verga's family was not part of the aristocracy, but they were not subsistence-level laborers either. They were part of the middle class, which was characterized by merchants, artisans, and skilled craftspeople. Verga's family wealth allowed him access to education, which was not common for all children in Italy during the late 1800s. He was educated at the Patria Institute in Catania. His early life housing and living conditions were comfortable, reflecting his family's middle-class status. However, there is no evidence of any inherited privileges or disadvantages due to his family background.","1. ""Giovanni Verga."" Encyclopædia Britannica. Encyclopædia Britannica, inc., February 1, 2020. https://www.britannica.com/biography/Giovanni-Verga.
2. Pemble, John. ""Verga: A Great Writer and His World."" The Modern Language Review, vol. 96, no. 3, 2001, pp. 821–822. JSTOR, www.jstor.org"
115,Q358147,Francesco Albani,Q358147,1578,Italy,Middle Class,"Francesco Albani was born in Bologna, Italy, around 1578. His father, Agostino Albani, was a silk merchant, which places the family within the middle class according to the provided typology. The silk trade was a lucrative business in Italy during the late 16th century, suggesting that the Albani family had a moderate level of wealth. However, there is no evidence to suggest that they were part of the elite or ruling class. Francesco's access to education was likely due to his family's middle-class status, as he was able to study under the prominent painter, Denis Calvaert, at a young age. This suggests that his family had the means to provide him with a good education, which was not common among lower classes during this period.","""Francesco Albani."" Encyclopædia Britannica. https://www.britannica.com/biography/Francesco-Albani"
116,Q207929,Pontormo,Q207929,1494,Italy,Middle Class,"Pontormo, born Jacopo Carucci, was the son of Bartolomeo di Jacopo di Martino Carrucci, a painter, and his wife, Alessandra di Pasquale di Zanobi. His father died when he was very young, and he was subsequently raised by his aunt and uncle, who were also painters. This suggests that Pontormo came from a family of artisans, which would place them in the middle class according to the provided typology. There is no evidence to suggest that his family was particularly wealthy or impoverished, and his access to education would likely have been due to his family's trade rather than any inherited privilege. His early life housing and living conditions are not well-documented, but given his family's occupation, it is likely that they were adequate but not luxurious.","Vasari, Giorgio. ""The Lives of the Most Excellent Painters, Sculptors, and Architects."" 1550."
117,Q380553,Ludovico Carracci,Q380553,1555,Italy,Middle Class,"Ludovico Carracci was born in Bologna, Italy, around 1555. His family belonged to the middle class. His father was a butcher, which was a skilled trade during this period, and his mother was a housewife. The Carracci family was not wealthy, but they were not poor either. They had a modest income that allowed them to live comfortably. Ludovico's access to education was not due to his family's wealth, but rather to the fact that his cousin, Agostino Carracci, was a notable artist and engraver. Agostino recognized Ludovico's talent and took him under his wing, providing him with an education in the arts. Ludovico's early life housing and living conditions were typical of the middle class in Bologna during the late 16th century. He did not have any inherited privileges or disadvantages due to his birth circumstances.","""Ludovico Carracci."" Encyclopædia Britannica. https://www.britannica.com/biography/Ludovico-Carracci. ""Ludovico Carracci."" The National Gallery, London. https://www.nationalgallery.org.uk/artists/ludovico-carracci."
118,Q471529,Ludovico Antonio Muratori,Q471529,1672,Italy,Middle Class,"Ludovico Antonio Muratori was born in Modena, Italy, in 1672. His father was a fishmonger, which indicates a middle-class status as a skilled tradesman. While not wealthy, the family was likely comfortable and had some degree of financial stability. Muratori's early access to education also suggests a middle-class upbringing. He was educated by the Jesuits in Modena, which would have required some level of family resources. His father's trade and his early education suggest a family that was part of the middle class, with enough resources to provide for their children's education but not part of the elite or ruling class.","""Ludovico Antonio Muratori."" Encyclopædia Britannica. https://www.britannica.com/biography/Ludovico-Antonio-Muratori. ""Ludovico Antonio Muratori."" Treccani, L'Enciclopedia Italiana. http://www.treccani.it/enciclopedia/ludovico-antonio-muratori/."
119,Q212657,Artemisia Gentileschi,Q212657,1593,Italy,Middle Class,"Artemisia Gentileschi was born in Rome around 1593 to Prudentia Montone and Orazio Gentileschi. Her father, Orazio, was a well-known painter and a member of the Accademia di San Luca, Rome's prestigious academy of painters. This suggests that the family was of the middle class, as they were not nobility but were also not subsistence laborers. The family's status as artisans fits within the middle class category of the time. Artemisia's access to education was also indicative of a middle-class upbringing. She was trained by her father in the art of painting, a form of education typically reserved for those with resources beyond mere subsistence. The family likely lived in conditions suitable for a middle-class family of the time, with enough wealth to afford painting supplies and a workshop. However, there is no evidence of significant inherited privileges or disadvantages.","""Artemisia Gentileschi and the Authority of Art: Critical Reading and Catalogue Raisonné"" by R. Ward Bissell, ""Artemisia Gentileschi: The Language of Painting"" by Jesse M. Locker."
120,Q44601,Francesco Guicciardini,Q44601,1483,Italy,Elite,"Francesco Guicciardini was born into a prominent and wealthy family in Florence, Italy. His father, Piero di Jacopo Guicciardini, was a lawyer and diplomat, serving in various political roles for the Republic of Florence, including as a representative to the papal court. This indicates a high social standing and access to political power. The Guicciardini family was also known to be wealthy, owning multiple properties in and around Florence. Francesco's access to education was likely due to his family's wealth and status, as he studied law at the universities of Ferrara and Padua, which were among the leading institutions of higher learning in Europe at the time. His early life housing and living conditions would have been comfortable, reflecting his family's wealth. As a member of the elite, Francesco would have inherited certain privileges, such as social connections and opportunities for political involvement.","""Francesco Guicciardini"" by Roberto Ridolfi (1967), ""The Italian Renaissance"" by J.H. Plumb (2001), ""The Cambridge Companion to Renaissance Humanism"" edited by Jill Kraye (1996)."
