,individual_wikidata_id,individual_name,individual_wikidata_id,birth_year,country,classification,explanation,sources
144,Q297565,Giacomo Barozzi da Vignola,Q297565,1507,Italy,Middle Class,"Giacomo Barozzi da Vignola was born in Vignola, near Modena (Emilia-Romagna region) in Italy around 1507. His father was a mason, which places the family within the middle class according to the typology provided, as masons were skilled craftspeople. There is no evidence to suggest that his family was particularly wealthy or impoverished, so it is reasonable to assume that they were of average means for their social class. Vignola's access to education was likely facilitated by his family's middle-class status, as he was apprenticed to a painter in Bologna, a common practice for middle-class families to provide their children with education and skills. His early life housing and living conditions would have been typical of a middle-class family in Italy during this period, likely living in a modest but comfortable home. There is no evidence of any inherited privileges or disadvantages.","""Vignola: A Great Architect of the Italian Renaissance"" by Arthur L. Frothingham; ""Giacomo Barozzi da Vignola"" by Franca Trinchieri Camiz and others in Dizionario Biografico degli Italiani - Volume 6 (1964)."
145,Q317900,Caesar Baronius,Q317900,1538,Italy,Middle Class,"Caesar Baronius was born in Sora, Italy, to Camillo Baronio and Porzia Febonia. His father, Camillo, was a doctor, which was a respected profession in the 16th century Italy, indicating a middle-class status. There is no evidence to suggest that the Baronius family was particularly wealthy or impoverished, suggesting a comfortable, middle-class upbringing. However, it is worth noting that Baronius was able to attend school in Veroli and Naples, suggesting that his family had the means to afford his education, a privilege not accessible to all during this period. This further supports the classification of Baronius's family as middle class.","""Caesar Baronius."" The Catholic Encyclopedia. Vol. 2. New York: Robert Appleton Company, 1907. 25 Dec. 2021 <http://www.newadvent.org/cathen/02305b.htm>."
146,Q318769,Francesco Guardi,Q318769,1712,Italy,Middle Class,"Francesco Guardi was born into a family of minor nobility and painters, which suggests a middle-class background. His father, Domenico Guardi, and his brothers, Gian Antonio and Niccolò, were all painters, indicating that the family had some level of wealth and social standing to support such a profession. This also suggests that Francesco would have had access to education and training in the arts from a young age, a privilege not typically available to those in the subsistence class. However, there is no evidence to suggest that the Guardi family was part of the elite ruling class or nobility. Their status as painters, while respected, would likely have placed them in the middle class of Italian society in the 18th century.","Wittkower, Rudolf. ""Art and Architecture Italy, 1600-1750"". Pelican History of Art, 1980. Pignatti, Terisio. ""Francesco Guardi"". Electa, 1984."
147,Q372032,Giuseppe Giacosa,Q372032,1847,Italy,Middle Class,"Giuseppe Giacosa was born on 21 October 1847 in Colleretto Parella, now Colleretto Giacosa, near Turin, Italy. His father, Luigi Giacosa, was a magistrate and his mother, Marzia, was a homemaker. The profession of his father suggests that the family belonged to the middle class, as magistrates were typically educated and held a respectable position in society, but were not part of the nobility or ruling class. The family's ability to provide Giuseppe with a good education, as he attended the University of Turin, further supports this classification. However, there is no evidence to suggest that the family was particularly wealthy or that Giuseppe had any inherited privileges. His early life housing and living conditions are not well-documented, but it can be inferred from his father's occupation that they were likely comfortable but not luxurious.","""Giuseppe Giacosa."" Encyclopædia Britannica. https://www.britannica.com/biography/Giuseppe-Giacosa. ""Giacosa, Giuseppe."" Treccani, il portale del sapere. http://www.treccani.it/enciclopedia/giuseppe-giacosa_(Dizionario-Biografico)/."
148,Q310757,Ruđer Josip Bošković,Q310757,1711,Italy,Middle Class,"Ruđer Josip Bošković was born on May 18, 1711, in Dubrovnik, in what is now Croatia, not Italy. His father, Nikola Bošković, was a merchant and trader, which would place the family in the middle class according to the given typology. His mother, Paola Bettera, came from a relatively well-off family of Italian origin. The family was not part of the ruling class or nobility, but they were not subsistence-level laborers or peasants either. 

Bošković's access to education was also indicative of his middle-class status. His father died when he was young, leaving the family in financial difficulties. However, Bošković was able to attend the Jesuit Collegium Ragusinum due to his mother's connections and the family's standing in the community. This suggests that the family had some level of social capital, even if their financial resources were strained.

The family's living conditions also suggest a middle-class background. They lived in a house in Dubrovnik, which was a significant trading and maritime center at the time. While the house was not luxurious, it was a step above the conditions experienced by laborers or peasants.","1. ""Ruđer Bošković"", Croatian Encyclopedia, Leksikografski zavod Miroslav Krleža,"
149,Q263270,Carlo Gozzi,Q263270,1720,Italy,Middle Class,"Carlo Gozzi was born into a middle-class family in Venice, Italy, in 1720. His father, Giovanni Battista Gozzi, was a grain dealer, which was a respectable occupation in the 18th century Venice. The family was not wealthy but had enough resources to provide Carlo with a good education, which was typical for middle-class families at the time. Carlo's early life housing and living conditions were likely comfortable but not luxurious. There is no evidence of any inherited privileges or disadvantages due to his family background.","""Carlo, Count Gozzi"", Encyclopædia Britannica, 1911. ""Carlo Gozzi"", The New International Encyclopædia, 1905."
150,Q208125,Lorenzo Ghiberti,Q208125,1378,Italy,Middle Class,"Lorenzo Ghiberti was born in Florence, Italy, around 1378. His father, Bartoluccio Ghiberti, was a trained artist and goldsmith, a profession that would have placed the family in the middle class of the social structure. This is because goldsmithing was a skilled craft that required training and skill, and it was a profession that was respected and well-compensated in the late 1300s. Lorenzo's mother's background is not well-documented, but there is no evidence to suggest that she came from a higher or lower social class than her husband. The family likely had a comfortable, but not extravagant, lifestyle. Lorenzo's access to education would have been due to his family background, as his father would have been able to provide him with training in his craft. There is no evidence to suggest that Lorenzo lived in particularly poor or particularly luxurious conditions in his early life.","Vasari, Giorgio. ""Lives of the Artists."" 1550. (Primary source that provides information about Ghiberti's early life and family background)"
151,Q7780,Fra Bartolomeo,Q7780,1472,Italy,Middle Class,"Fra Bartolomeo, also known as Baccio della Porta, was born in Savignano di Prato, Tuscany, around 1472. His father was a mule driver and a peasant, which would typically suggest a subsistence class. However, it's important to note that his family was able to provide him with an education, as he was sent to study under Cosimo Rosselli, a prominent Florentine painter, at a young age. This suggests that his family had some means and were not living in extreme poverty. Therefore, considering the social structure and economic context of Italy in the late 1400s, it's reasonable to classify Fra Bartolomeo's birth and childhood social class as middle class.","Vasari, Giorgio. ""Lives of the Artists."" Oxford University Press, 1991."
152,Q447058,Pietro Longhi,Q447058,1701,Italy,Middle Class,"Pietro Longhi was born in Venice, Italy around 1701. His father was a silversmith, a profession that would have placed the family in the middle class, as it required a high level of skill and craftsmanship. This occupation would have provided a comfortable living, but not to the extent of the elite class. There is no evidence to suggest that Longhi's family was particularly wealthy or that they held any significant social standing beyond their trade. Longhi's access to education was likely due to his family's middle-class status, as he was able to study under the painter Antonio Balestra, which suggests that his family had the resources to support his education. His early life housing and living conditions would have been typical of a middle-class family in Venice at the time, comfortable but not luxurious. There is no evidence to suggest that Longhi inherited any significant privileges or disadvantages due to his birth.","""Pietro Longhi."" Encyclopædia Britannica. https://www.britannica.com/biography/Pietro-Longhi"
153,Q605447,Antonio Tempesta,Q605447,1555,Italy,Middle Class,"Antonio Tempesta was born in Florence, Italy, around 1555. His father, Giovanni Tempesta, was a successful artisan, specifically a tailor, which places the family in the middle class according to the social structure of the time. The tailoring profession was a skilled trade, often associated with the middle class in the late 16th century Italy. There is no evidence to suggest that the Tempesta family was part of the nobility or the subsistence class. 

In terms of education, Antonio Tempesta was apprenticed to the Flemish painter and engraver, Joannes Stradanus, at a young age. This suggests that his family had enough resources to secure an apprenticeship, a common practice among middle-class families who could afford to invest in their children's education and future. 

There is no specific information available about the Tempesta family's wealth, housing, or living conditions. However, given Giovanni Tempesta's occupation and Antonio's apprenticeship, it can be inferred that the family was likely comfortable but not extraordinarily wealthy.","- ""Antonio Tempesta: An Artist and His Universe,"" by Lucia Meoni (2005)
- ""The Art of Antonio Tempesta,"" by Miles L. Chappell (1986)
- ""Artists in Early Modern Italy: The Nature of the Practitioner,"" by Evelyn Welch (1997)"
154,Q202303,Giovanni Paisiello,Q202303,1740,Italy,Middle Class,"Giovanni Paisiello was born in Taranto, Italy, in 1740. His father was a lawyer, which suggests a middle-class background. The profession of law during the 18th century in Italy was a respected occupation, often associated with the middle class, as it required a certain level of education and literacy. There is no evidence to suggest that Paisiello's family was particularly wealthy or part of the nobility, nor that they were living in poverty. Paisiello's access to education, specifically his admission to the Jesuit college in Taranto, also indicates a middle-class upbringing, as education during this period was not universally accessible and often required some level of family resources. His early musical education, which began at the age of 5, also suggests that his family had the means to provide him with such training.","""Giovanni Paisiello: His Life and Times"" by Barry S. Brook; ""The New Grove Dictionary of Music and Musicians"" by Stanley Sadie."
155,Q84296,Ludwig Boltzmann,Q84296,1844,Italy,Middle Class,"Ludwig Boltzmann was born on February 20, 1844, in Vienna, Austria, not Italy. His father, Ludwig Georg Boltzmann, was a tax official, and his mother, Katharina Pauernfeind, was a well-educated woman from a family of civil servants. The occupation of Boltzmann's father indicates that the family belonged to the middle class, as tax officials were typically considered part of the bourgeoisie during this period. Boltzmann's mother's background further supports this classification, as civil servants were also typically middle class. The family's middle-class status likely provided Boltzmann with access to education, as the middle class typically valued education and could afford to provide it for their children. However, specific details about the family's wealth, housing, and living conditions are not readily available.","""Ludwig Boltzmann: The Man Who Trusted Atoms"" by Carlo Cercignani, ""Ludwig Boltzmann: His Later Life and Philosophy, 1900–1906"" by John T. Blackmore."
156,Q366081,Paris Bordone,Q366081,1500,Italy,Middle Class,"Paris Bordone was born in Treviso, Italy, around 1500. His father, Pellegrino Bordone, was a saddle maker, which was a skilled craft occupation. This suggests that the Bordone family belonged to the middle class, as they were not nobility or peasants, but skilled artisans. There is no evidence to suggest that Bordone's family was particularly wealthy or impoverished, but they likely had a comfortable living from Pellegrino's trade. The fact that Bordone was able to receive training as a painter from an early age also suggests that his family had some means, as this kind of education would not have been accessible to the lower classes. However, there is no evidence to suggest that Bordone was born into the elite class, as his family did not hold any titles or significant wealth.","""Paris Bordone."" The J. Paul Getty Museum. www.getty.edu/art/collection/artists/1001/paris-bordone-italian-about-1500-1571/ ; ""Paris Bordone."" Encyclopædia Britannica. www.britannica.com/biography/Paris-Bordone"
157,Q311082,Pisanello,Q311082,1395,Italy,Middle Class,"Pisanello, also known as Antonio di Puccio Pisano, was born around 1395 in Pisa, Italy. His father, Puccio di Giovanni, was a painter, which suggests that Pisanello was born into a family of artisans. This places him in the middle class according to the given typology, as artisans were considered skilled craftspeople. The family's wealth at the time of Pisanello's birth and childhood is not well-documented, but as a painter, his father likely had a steady income, although not an extravagant one. Pisanello's access to education would have been influenced by his family background. As the son of a painter, he likely received training in the arts from a young age. His early life housing and living conditions would have been modest but comfortable, typical of the middle class. He would not have had any significant inherited privileges or disadvantages due to his birth circumstances.","The primary source of information about Pisanello's early life is Giorgio Vasari's ""Lives of the Most Excellent Painters, Sculptors, and Architects,"" which includes a biography of Pisanello. However, this source focuses more on his artistic achievements than his family background. Other sources include scholarly articles and books about Italian Renaissance art and artists."
158,Q209212,Girolamo Frescobaldi,Q209212,1583,Italy,Middle Class,"Girolamo Frescobaldi was born in Ferrara, Italy, into a family of property owners. His father, Filippo, was a man of property and likely engaged in mercantile activities. The family was not of noble lineage but was certainly not poor. They were able to afford a good education for Girolamo, who studied under Luzzasco Luzzaschi, a prominent musician and composer of the time. This suggests that the family had the means to invest in their children's education, a characteristic of the middle class. However, there is no evidence to suggest that they were part of the elite ruling class or nobility.","""Girolamo Frescobaldi: An Extended Biography"" by Frederick Hammond, ""The New Grove Dictionary of Music and Musicians"" by Stanley Sadie."
159,Q5811,Masaccio,Q5811,1401,Italy,Middle Class,"Masaccio, born Tommaso di Ser Giovanni di Simone, was born in the town of Castel San Giovanni di Altura (now San Giovanni Valdarno) in 1401. His father, Ser Giovanni di Simone Cassai, was a notary, which was a respected profession in the middle class during this period. His mother, Monna Iacopa, was the daughter of an innkeeper. After his father's death in 1406, his mother remarried to another notary. This suggests that Masaccio's family was part of the middle class, as they were not nobility but also not subsistence laborers. His family's status likely provided him with some access to education, as was common for children of the middle class during this period. However, specific details about his early life housing, living conditions, and inherited privileges or disadvantages are not well-documented.","Vasari, Giorgio. ""Life of Masaccio."" In Lives of the Artists. Oxford University Press, 1991. Berti, Luciano. ""Masaccio."" In The Complete Paintings of Masaccio. Penguin, 1968."
160,Q213351,Lazzaro Spallanzani,Q213351,1729,Italy,Middle Class,"Lazzaro Spallanzani was born in Scandiano, Modena, Italy, in 1729. His father, Giuseppe Spallanzani, was a lawyer by profession, which suggests that the family was part of the middle class. The legal profession was a respected occupation in the 18th century Italy, often associated with the middle class. His mother, Lucia Zigliani, was from a family of minor nobility, but it appears that her family's status did not significantly elevate the Spallanzanis' social standing. Lazzaro's access to education also suggests a middle-class background. He was educated by the Jesuits, a religious order known for its emphasis on education. This education would have been more accessible to middle-class families than to those of lower social standing. However, it's important to note that his education was also influenced by his uncle, who was a priest and provided him with further education. The family's living conditions are not well-documented, but given his father's profession, it's reasonable to assume that they were comfortable but not luxurious.","""Lazzaro Spallanzani: Italian Biologist and Physiologist."" Encyclopedia Britannica. ""Lazzaro Spallanzani."" The Catholic Encyclopedia."
161,Q7751,Giuseppe Arcimboldo,Q7751,1527,Italy,Middle Class,"Giuseppe Arcimboldo was born in Milan, Italy, around 1527. His father, Biagio Arcimboldo, was a painter, which suggests that the family was of the middle class, as the profession of painting was typically associated with skilled craftspeople during this period. The family likely had some level of wealth, as Biagio was able to provide his son with an education in the arts. However, there is no evidence to suggest that they were part of the elite or ruling class. The family's housing and living conditions are not well-documented, but it can be inferred from their profession and social standing that they were likely comfortable but not extravagant. As a painter, Biagio would have had a certain level of social standing and respect, but it is unlikely that he had any significant inherited privileges or disadvantages.","""Giuseppe Arcimboldo"" by Thomas DaCosta Kaufmann, ""The World of the Renaissance Artists: Biographies of Italian Painters"" by Alessandro Conti."
162,Q437543,Paolo Giovio,Q437543,1483,Italy,Middle Class,"Paolo Giovio was born in Como, Italy, in 1483. His family was not of noble lineage, but they were not poor either. His father, Piero Giovio, was a physician, a profession that was respected and well-regarded in the society of the time, indicating a middle-class status. His mother, Fiammetta Giovio, came from a family of lawyers, another profession indicative of middle-class standing. The family's wealth and social standing allowed Paolo Giovio to receive a good education, which was not a privilege accessible to everyone in the late 15th century Italy. The family lived in a comfortable home in Como, suggesting they were not struggling for basic necessities. However, there is no evidence to suggest they had any inherited privileges or disadvantages.","""Paolo Giovio: The Historian and the Crisis of Sixteenth-Century Italy"" by T.C. Price Zimmermann."
163,Q503322,Carlo Dolci,Q503322,1616,Italy,Middle Class,"Carlo Dolci was born in Florence, Italy, in 1616 to a family of moderate means. His father, Giovanni Dolci, was a tailor, which would place the family within the middle class according to the social structure of the time. Tailoring was a skilled craft, and while it did not provide the wealth of the elite, it would have allowed the family a comfortable living. There is no record of significant wealth or property owned by the family at the time of Carlo's birth. As for education, Carlo was apprenticed to Jacopo Vignali, a prominent Florentine painter, at a young age. This suggests that his family had the means and connections to secure such an apprenticeship, which was a common form of education for middle-class children in this period. The family's living conditions and any inherited privileges or disadvantages are not well-documented, but the occupation of Carlo's father and his early education suggest a middle-class upbringing.","""Carlo Dolci: A Refreshing Look at the Man and His Art"" by Eve Borsook, ""Carlo Dolci"" by Frederick Hartt, ""The Oxford Companion to Western Art"" edited by Hugh Brigstocke."
164,Q319557,Matteo Maria Boiardo,Q319557,1441,Italy,Elite,"Matteo Maria Boiardo was born into the noble Boiardo family, one of the most powerful families in Reggio Emilia, a region in Northern Italy. His father, Giovanni, was the count of Scandiano, and his mother, Lucia Strozzi, was from an equally prominent family. The Boiardo family had a long history of political influence and wealth, which would have provided Matteo with a privileged upbringing. He would have had access to the best education available at the time, as was typical for children of the nobility. His family's wealth and status would have also ensured comfortable living conditions and numerous inherited privileges.","""Matteo Maria Boiardo: A Critical Review of the Italian Humanist"" by JoAnn Cavallo; ""The World of the Italian Renaissance"" by Paul F. Grendler."
165,Q336798,Alessandro Algardi,Q336798,1598,Italy,Middle Class,"Alessandro Algardi was born in Bologna, Italy around 1598. His father, Giovanni, was a silk merchant, which would place the family in the middle class, specifically within the category of merchants. The family was not of noble birth or extreme wealth, but they were also not impoverished. The fact that Algardi was able to train as an artist from a young age suggests that his family had enough resources to support this, which was not a possibility for those in the subsistence class. However, there is no evidence to suggest that the family owned significant property or had access to high levels of education, which would be more typical of the elite class.","""Alessandro Algardi"", The J. Paul Getty Museum; ""Alessandro Algardi"", The National Gallery, London; ""Alessandro Algardi"", Encyclopaedia Britannica."
166,Q335112,"Anthony Ashley-Cooper, 3rd Earl of Shaftesbury",Q335112,1671,Italy,Elite,"Anthony Ashley-Cooper, 3rd Earl of Shaftesbury, was born into a family of high social standing and wealth. His father, Anthony Ashley-Cooper, 2nd Earl of Shaftesbury, was a member of the English nobility, and his mother, Lady Dorothy Manners, was the daughter of John Manners, 8th Earl of Rutland. This indicates that he was born into the elite class, as both his parents were part of the nobility. 

The family's wealth at the time of his birth and childhood was substantial, as they held the title of Earl of Shaftesbury, which came with significant land holdings and wealth. This wealth would have provided him with access to education, as was common for children of the elite class during this time period. His early life housing and living conditions would have been comfortable and luxurious, befitting his family's status.

In terms of inherited privileges, as the son of an Earl, Anthony Ashley-Cooper would have been born with the title of Lord Ashley, indicating his high social status. His family's wealth and status would have also provided him with opportunities and advantages not available to those of lower social classes.","- ""Anthony Ashley Cooper, 3rd Earl of Shaftesbury."" Encyclopædia Britannica. https://www.britannica.com/biography/Anthony-Ashley-Cooper-3rd-Earl-of-Shaft"
167,Q60080,Wilhelm Dilthey,Q60080,1833,Italy,Middle Class,"Wilhelm Dilthey was born on November 19, 1833, in Biebrich, Duchy of Nassau, which is now a part of Germany, not Italy. His father, Reinhard Dilthey, was a theologian and a preacher in the Protestant church, which would place the family in the middle class. The family was not nobility, nor were they laborers or peasants. The fact that Wilhelm Dilthey was able to attend the University of Heidelberg suggests that his family had some means, as education at this time was not universally accessible and often required financial resources. His early life housing and living conditions would likely have been comfortable but not luxurious, typical of a middle-class family. As the son of a theologian, Dilthey would have had access to religious texts and intellectual discussions, but this is not the same as the inherited privileges of the elite class.","""Wilhelm Dilthey: A Hermeneutic Approach to the Study of History and Culture"" by H.P. Rickman; ""Wilhelm Dilthey: Selected Works, Volume III: The Formation of the Historical World in the Human Sciences"" by Wilhelm Dilthey (edited by Rudolf A. Makkreel and Frithjof Rodi)."
