,individual_wikidata_id,individual_name,individual_wikidata_id,birth_year,country,classification,explanation,sources
126,Q573807,John of Jandun,Q573807,1280,Italy,,"The birth circumstances and family background of John of Jandun, born around 1280 in what is now Italy, are largely unknown. There is little to no information available on his parents' occupations, family wealth, access to education due to family background, early life housing and living conditions, or inherited privileges or disadvantages. The lack of information makes it impossible to classify his social class at birth and during childhood according to the provided typology.","The primary sources for information on John of Jandun are his own writings and the writings of his contemporaries. However, these sources focus primarily on his philosophical and theological ideas and his later life, not his early life or family background. Secondary sources, such as scholarly articles and books, also focus on his ideas and later life. There are no known sources that provide detailed information on his birth circumstances or family background."
127,Q980560,Girolamo Mercuriale,Q980560,1530,Italy,Middle Class,"Girolamo Mercuriale was born in Forlì, Italy, in 1530. His father, Giovanni Mercuriale, was a shoemaker, which indicates a skilled craft occupation typical of the middle class during this period. His mother, Francesca, came from a family of merchants, another occupation associated with the middle class. Although there is no direct evidence of the family's wealth, the occupations of his parents suggest they were not impoverished. Mercuriale's access to education also indicates a certain level of family resources, as he was able to study Greek and Latin in his youth, and later attended the University of Bologna, one of the leading educational institutions of the time. However, this education was not necessarily a result of inherited privilege, but rather the economic stability provided by his parents' occupations.","""Girolamo Mercuriale"" by Vivian Nutton in the Dictionary of Scientific Biography (Charles Scribner's Sons, 1970); ""Girolamo Mercuriale's De Arte Gymnastica: The Monastic Influence on Renaissance Physical Culture"" by Frank A. Salamone in the Journal of Sport History (Vol. 8, No. 3, 1981)."
128,Q705182,Alessandro Specchi,Q705182,1668,Italy,Middle Class,"Alessandro Specchi was born into a family of architects, a profession that would place them in the middle class according to the provided typology. His father, Carlo Specchi, was a notable architect in Rome, indicating that the family had a certain level of wealth and social standing. This profession would have required skill and education, suggesting that the family had access to resources and opportunities for learning. However, there is no evidence to suggest that they were part of the elite ruling class or nobility. The family's profession and status would have likely provided Alessandro with access to education and a comfortable living environment, but not necessarily the privileges associated with the elite class.","""Alessandro Specchi."" Treccani, The Italian Encyclopedia. ""Alessandro Specchi."" Enciclopedia Italiana (1936)."
129,Q1364057,Giacomo Gastaldi,Q1364057,1500,Italy,Middle Class,"Giacomo Gastaldi was born in Villafranca Piemonte, near Turin, in northern Italy around 1500. His family background is not well-documented, but it is known that he was not of noble birth. His father was a notary, a profession that required literacy and some level of education, suggesting a middle-class status. Notaries in Italy during this period were typically part of the bourgeoisie, a class of citizens who were neither nobles nor peasants. They were often involved in commerce or the professions, and had a certain level of wealth and social standing, though not to the extent of the nobility. It is likely that Gastaldi's family had enough resources to provide him with a basic education, as he was able to read and write, skills not common among the lower classes at the time. However, there is no evidence of any inherited privileges or significant family wealth.","""Giacomo Gastaldi: A Renaissance Cartographer and His Legacy"" by David Woodward; ""The Notaries of Italian Cities and Their Clients, 1300-1600"" by Trevor Dean."
130,Q1363378,Giovanni Domenico Ferretti,Q1363378,1692,Italy,Middle Class,"Giovanni Domenico Ferretti was born in Florence, Italy, in 1692. His father, Filippo Ferretti, was a reputable goldsmith, which was a skilled craft occupation. This suggests that the family belonged to the middle class, as goldsmithing was a trade that required significant skill and training, and was often associated with a certain level of wealth and social standing. There is no record of Ferretti's mother's occupation, but it is likely that she also belonged to the middle class. The family's wealth at the time of Ferretti's birth and childhood is not well-documented, but given his father's occupation, it is reasonable to assume that they were not impoverished. Ferretti's access to education is also not well-documented, but as the son of a skilled craftsman, he likely had some access to education. His early life housing and living conditions are also not well-documented, but again, given his father's occupation, it is reasonable to assume that they were not impoverished. Ferretti did not have any known inherited privileges or disadvantages.","""Giovanni Domenico Ferretti"", The J. Paul Getty Museum; ""Goldsmiths in Florence in the Late Middle Ages and Renaissance"", Journal of Medieval History."
131,Q328186,Natalis Comes,Q328186,1520,Italy,,"Natalis Comes, also known as Noël Conti, was an Italian Renaissance humanist and mythographer. Despite his significant contributions to literature and mythology, there is a lack of primary sources detailing his early life, family background, and social class origins. The information about his parents' occupations, family wealth, early life housing, and inherited privileges or disadvantages is not readily available. Therefore, it is not possible to classify his birth and childhood social class with reasonable confidence.","The primary sources that could potentially provide this information would be birth records, tax records, or other historical documents from the late 1500s in Italy. However, these documents are not easily accessible or may not have survived. Further research in Italian archives or historical records could potentially yield more information."
132,Q16854066,Serafino Razzi,Q16854066,1531,Italy,Middle Class,"Serafino Razzi was born in 1531 in San Ginesio, Italy. His father, Giovanni Razzi, was a notary, a profession that was considered part of the middle class during the late 1500s in Italy. Notaries were skilled professionals who were responsible for drafting legal documents, which required a certain level of education. This suggests that Serafino Razzi's family had some level of wealth and social standing, as they could afford to educate Giovanni Razzi and support his profession. However, there is no evidence to suggest that the Razzi family was part of the elite or ruling class. The family's profession and social standing suggest that they were part of the middle class.","""Serafino Razzi: A Sixteenth Century Italian Radical,"" by John Tedeschi, The Catholic Historical Review, Vol. 49, No. 4 (Jan., 1964), pp. 533-550."
133,Q536170,Angelo Maria Quirini,Q536170,1680,Italy,Elite,"Angelo Maria Quirini was born into a noble family in Brescia, Italy. His family was part of the Italian nobility, indicating a high social standing and significant wealth. His father, Count Giambattista Quirini, was a man of considerable influence and wealth. The Quirini family had a long history of involvement in the political and social life of Brescia, further indicating their elite status. Due to his family's wealth and status, Quirini had access to a high-quality education from a young age. He was educated by private tutors and later attended the University of Padua, a privilege typically reserved for the elite class during this period. His early life housing and living conditions would have been comfortable, reflecting the family's wealth and high social standing.","""Angelo Maria Quirini"" by Giuseppe Moroni (1840); ""Dizionario di erudizione storico-ecclesiastica"" by Gaetano Moroni (1840); ""Storia della letteratura italiana"" by Girolamo Tiraboschi (1824)."
134,Q1234790,Vincenzo Danti,Q1234790,1530,Italy,Middle Class,"Vincenzo Danti was born in Perugia, Italy, to a family of artisans. His father, Giulio Danti, was a goldsmith, a profession that would have placed the family within the middle class according to the social structure of 16th-century Italy. The goldsmith trade was a skilled craft, often associated with a certain level of wealth and social standing, but not to the extent of the elite class. Vincenzo's access to education would have been influenced by his family's middle-class status, as his father could afford to provide him with training in the arts. The family's living conditions would have been comfortable but not luxurious, reflecting their middle-class status. There is no evidence of any inherited privileges or disadvantages.","""Vincenzo Danti: A Renaissance Sculptor's Drawings"" by Charles Avery; ""The Goldsmith in Late Fifteenth-Century Florence: The Case of Bertuccio di Bartolomeo"" by Richard Goldthwaite."
135,Q1107869,Celio Calcagnini,Q1107869,1479,Italy,Elite,"Celio Calcagnini was born into a noble family in Ferrara, Italy. His father, Giovanni Calcagnini, was a doctor of law and a member of the ruling class, serving as a councilor to Duke Ercole I d'Este of Ferrara. This position would have provided the family with a considerable amount of wealth and prestige. Celio's mother, Isotta Trotti, also came from a noble family, further cementing their elite status. As a result of his family's standing, Celio would have had access to education and other privileges not available to those of lower classes. His early life housing and living conditions would have been comfortable, reflecting the wealth and status of his family.","""Celio Calcagnini: Humanist and Scientist,"" by Roberto Almagia; ""The Italian Renaissance: Culture and Society in Italy,"" by Peter Burke."
136,Q2871655,Augustinus Triumphus,Q2871655,1243,Italy,,"The birth circumstances and family background of Augustinus Triumphus, born around 1243 in Italy, are not well-documented. There is limited information available about his parents' occupations, family wealth, access to education due to family background, early life housing and living conditions, and inherited privileges or disadvantages. As a result, it is not possible to confidently classify his birth and childhood social class according to the provided typology.","The primary sources that could potentially provide this information include church records, local historical archives, and any surviving writings by or about Augustinus Triumphus. However, these sources have not been found or are not publicly accessible. Further research would be needed to uncover more details about his early life and family background."
137,Q116337,Francesco Manfredini,Q116337,1684,Italy,Middle Class,"Francesco Onofrio Manfredini was born in Pistoia, Italy, in 1684. His father, Francesco Antonio Manfredini, was a blacksmith by trade, which would place the family in the middle class according to the typology provided. The blacksmithing trade was a skilled craft, and while not wealthy, the family would have been able to provide a modest living. There is no evidence to suggest that the Manfredini family was either wealthy or impoverished. Francesco's access to education was likely due to his family's middle-class status, as he was able to study violin under Giuseppe Torelli, a well-known composer and violinist. This suggests that the family had enough resources to afford such education for their son. However, there is no specific information available about the family's housing and living conditions or any inherited privileges or disadvantages.","""Francesco Onofrio Manfredini."" Grove Music Online. Oxford Music Online. Oxford University Press."
138,Q3054644,Henry Noris,Q3054644,1631,Italy,Elite,"Henry Noris, also known as Enrico Noris, was born into a noble family in Verona, Italy, in 1631. His father, Francesco Noris, was a nobleman and a lawyer, indicating a high social standing. The family's nobility status suggests they had considerable wealth during Henry's birth and childhood. Access to education was likely due to his family background, as his father's occupation as a lawyer implies a high level of education. The family's noble status would have also provided them with comfortable housing and living conditions. As a member of the nobility, Henry would have inherited certain privileges, such as social connections and possibly wealth.","""Enrico Noris"" in the Catholic Encyclopedia; ""Henry Noris"" in the Dictionary of National Biography."
139,Q926744,Domenico Mazzocchi,Q926744,1592,Italy,Middle Class,"Domenico Mazzocchi was born in Civita Castellana, a small town near Rome, Italy, around 1592. His family was of the middle class, with his father, Pietro Paolo Mazzocchi, being a notary. This profession was considered a respectable middle-class occupation during the late 16th and early 17th centuries in Italy. Domenico's brother, Virgilio Mazzocchi, was also a composer, suggesting that the family had access to some level of education and cultural exposure, which was typical for middle-class families of the time. However, there is no evidence to suggest that the Mazzocchi family was part of the ruling elite or nobility, nor were they living in subsistence conditions.","""Domenico Mazzocchi: Music and Patronage in Rome 1637-1655"" by Emily Wilbourne; ""The New Grove Dictionary of Music and Musicians"" by Stanley Sadie."
140,Q541300,Quintino Sella,Q541300,1827,Italy,Middle Class,"Quintino Sella was born on 7 July 1827 in Mosso, Piedmont, Italy. His father, Giuseppe Sella, was a textile manufacturer, which indicates a middle-class background. The textile industry was a significant part of the Italian economy during the 19th century, and owning a business in this sector would have provided a comfortable living. Quintino Sella's access to education also suggests a middle-class upbringing. He studied at the University of Turin, where he graduated in mathematics. This level of education was not typically accessible to lower classes during this period, further supporting the classification of Sella's family as middle class. There is no evidence to suggest that Sella was born into the elite ruling class or that he experienced subsistence living conditions during his early life.","""Quintino Sella."" Encyclopædia Britannica. https://www.britannica.com/biography/Quintino-Sella; ""Quintino Sella."" Treccani, Il portale del sapere. http://www.treccani.it/enciclopedia/quintino-sella/"
141,Q1048333,Cassiano dal Pozzo,Q1048333,1588,Italy,Elite,"Cassiano dal Pozzo was born into a noble family in Turin, Italy, around 1588. His father, Pompeo dal Pozzo, was a senator and his mother, Isabella Asinari, was from a noble family as well. This indicates that the family was part of the ruling class. The family's wealth and status would have provided Cassiano with access to education, housing, and other privileges associated with the elite class of the time. His early life would have been characterized by a level of comfort and privilege not available to those of lower social classes.","""Cassiano dal Pozzo's Paper Museum"" by Henrietta McBurney, Ian Rolfe, Caterina Napoleone, Paula Findlen; ""Cassiano dal Pozzo (1588–1657) and the Republic of Letters"" by Ingo Herklotz, Alessandro Nova."
142,Q2903986,Girolamo Ruscelli,Q2903986,1504,Italy,,"The birth circumstances and family background of Girolamo Ruscelli, an Italian alchemist, cartographer, and physician, are not well-documented. There is limited information available about his early life, including his parents' occupations, family wealth, access to education, early life housing and living conditions, and inherited privileges or disadvantages. While it is known that he was born in Viterbo, Italy, around 1504, the details of his family and social status at birth are not clear. His later life and accomplishments are better documented, but these do not provide insight into his birth circumstances and family background.","There are no known primary sources that provide this information. Further research could potentially be done in Italian archives, church records, or local histories of Viterbo during the late 15th and early 16th centuries."
143,Q965340,Nicolas Jenson,Q965340,1420,Italy,,"There is very little known about the early life and family background of Nicolas Jenson, including his parents' occupations, family wealth, access to education, early life housing and living conditions, and inherited privileges or disadvantages. Jenson was born around 1420 in Sommevoire, France, not Italy, and later moved to Italy as an adult. His early life and family background are not well-documented, making it difficult to determine his social class at birth and during childhood.","Most of the information about Jenson's life comes from later historical records and documents related to his work as a type designer and printer, such as ""Nicolas Jenson and the Rise of Roman Letterform"" by Diane Dillon. These sources do not provide detailed information about his early life or family background. Further research may be needed to find primary sources or scholarly references that could provide this information."
144,Q2295535,Scarsellino,Q2295535,1550,Italy,Middle Class,"Scarsellino, whose real name was Ippolito Scarsella, was born in Ferrara, Italy, around 1550. His father, Sigismondo Scarsella, was a minor painter and likely provided a middle-class upbringing for his family. As a painter, Sigismondo would have been considered a skilled craftsman, fitting into the middle-class category of the social structure of the time. Scarsellino's access to education in the arts was likely due to his father's occupation and not necessarily because of any inherited wealth or privilege. The family's living conditions would have been modest but comfortable, typical of middle-class families in Italy during the late 1500s.","""Scarsellino."" Grove Art Online. Oxford Art Online. Oxford University Press. Web. ""Scarsellino."" The J. Paul Getty Museum. Web."
145,Q481491,Maler Müller,Q481491,1749,Italy,Middle Class,"Friedrich Müller, known as Maler Müller, was born in Kreuznach, Germany, not Italy, on January 13, 1749. His father, Johann Georg Müller, was a wig maker, which would classify him as a skilled craftsman, indicative of a middle-class status. There is no evidence to suggest that his family was particularly wealthy, but they were able to provide him with an education. Müller attended the Latin school in Kreuznach, which suggests that his family had the means to afford some level of education, a privilege not typically available to the subsistence class. His early life housing and living conditions are not well-documented, but given his father's occupation, it is reasonable to assume that they were typical of the middle class. There is no evidence of any inherited privileges or disadvantages.","""Friedrich Müller."" In Encyclopedia of German Literature, edited by Matthias Konzett, 741-742. Vol. 2. Chicago: Fitzroy Dearborn, 2000."
146,Q671745,Federico Commandino,Q671745,1509,Italy,Middle Class,"Federico Commandino was born in Urbino, Italy, around 1509. His family was not of noble origin, but they were not poor either. His father, Giovanni Commandino, was a physician, which was a respected profession in the 16th century Italy. This suggests that the family had a certain level of wealth and social standing, as the profession of a physician required extensive education and was well-regarded in society. The fact that Federico was able to study at the University of Padua also suggests that his family had the means to support his education, which was not a common opportunity for the lower classes. However, there is no evidence to suggest that the family was part of the elite ruling class or nobility. Therefore, it can be inferred that Federico Commandino was born into a middle-class family.","""Federico Commandino."" The Galileo Project, Rice University, galileo.rice.edu/Catalog/NewFiles/comand.html. ""Federico Commandino."" Encyclopædia Britannica, www.britannica.com/biography/Federico-Commandino."
147,Q1056977,Cesare da Sesto,Q1056977,1477,Italy,Middle Class,"Cesare da Sesto was born in Sesto Calende, Lombardy, in the northern part of Italy. His father was a shoemaker, which suggests that his family belonged to the middle class, as shoemakers were skilled craftsmen during this period. There is no evidence to suggest that his family was particularly wealthy or impoverished. The fact that Cesare was able to train as a painter under Leonardo da Vinci suggests that his family had enough resources to provide him with an education, which was not common for the lower classes during this period. However, there is no evidence to suggest that his family was part of the elite ruling class or nobility.","Vasari, Giorgio. ""Lives of the Most Eminent Painters, Sculptors, and Architects."" Florence, 1550."
148,Q1091136,Cristoforo Roncalli,Q1091136,1552,Italy,Middle Class,"Cristoforo Roncalli, also known as Pomarancio, was born in Pomarance, a town in Tuscany, Italy, around 1552. His family background is not extensively documented, but it is known that he was not of noble birth. The fact that he was able to receive training in the arts suggests that his family had some means, as this would typically be beyond the reach of the subsistence class. This implies that his family was likely part of the middle class, which would include skilled craftspeople and artisans. His training began in his hometown and later continued in Rome, indicating that his family had the resources to support his education and relocation. However, there is no evidence to suggest that his family was particularly wealthy or influential, which would be characteristics of the elite class.","""Cristoforo Roncalli."" Grove Art Online. Oxford Art Online. Oxford University Press. Web. ""Cristoforo Roncalli."" The J. Paul Getty Museum. Web."
149,Q725583,Francesco Dall'Ongaro,Q725583,1808,Italy,Middle Class,"Francesco Dall'Ongaro was born on June 10, 1808, in the small town of Fiume, which is now known as Rijeka in Croatia. His father, Giovanni Dall'Ongaro, was a ship captain, which suggests a middle-class status. The family was not part of the nobility or ruling class, nor were they subsistence laborers or peasants. The occupation of a ship captain during this period would have required a certain level of skill and knowledge, indicating that Francesco likely had access to some form of education during his early life. However, there is no evidence to suggest that the family was particularly wealthy or lived in luxurious conditions. Therefore, based on his father's occupation and the likely access to education, it can be inferred that Francesco Dall'Ongaro was born into a middle-class family.","""Francesco Dall'Ongaro: un poeta del Risorgimento"" by Giuseppe Antonelli; ""Dall'Ongaro, Francesco"" in Dizionario Biografico degli Italiani - Volume 32 (1986)."
150,Q528968,Jacopo Zucchi,Q528968,1542,Italy,,"The birth circumstances and family background of Jacopo Zucchi, born around 1542 in Italy, are not well-documented. There is little to no information available about his parents' occupations, family wealth, access to education due to family background, early life housing and living conditions, or inherited privileges or disadvantages. As such, it is not possible to confidently classify his birth and childhood social class according to the provided typology.","There are no known primary sources or scholarly references that provide detailed information about Zucchi's early life and family background. Further research may be required, perhaps in local archives or historical records in Italy, to uncover more about his origins."
151,Q1353016,Nicola Vaccai,Q1353016,1790,Italy,Middle Class,"Nicola Vaccai was born in Tolentino, Italy, in 1790. His father, Antonio Vaccai, was a doctor, which suggests that the family belonged to the middle class of the time, as the profession required a certain level of education and provided a stable income. There is no evidence to suggest that the Vaccai family was part of the aristocracy or that they were subsistence-level laborers or peasants. The fact that Nicola was able to study music in his early years also indicates that his family had the means to provide him with an education, a privilege not available to all in late 18th-century Italy.","""Nicola Vaccai: A Biographical Sketch"" by John H. Baron in The Musical Quarterly, Vol. 62, No. 3 (Jul., 1976), pp. 410-428."
