,individual_wikidata_id,individual_name,individual_wikidata_id,birth_year,country,classification,explanation,sources
0,Q1067,Dante Alighieri,Q1067,1265,Italy,Elite,"Dante Alighieri was born into a family that was part of the lower nobility. His family was wealthy and involved in the complex politics of Florence, indicating a high social standing. His father, Alighiero di Bellincione, was a White Guelph who suffered no reprisals after the Ghibellines won the Battle of Montaperti in the mid 13th century, suggesting he enjoyed certain protections due to his social status. 

Dante's family could afford to provide him with an education, which was a privilege not accessible to all during this period. He was tutored at home and studied Tuscan poetry, which was a sign of a high social standing. His family's wealth and status also allowed him to marry Gemma di Manetto Donati, a member of a powerful Tuscan family.","1. ""Dante Alighieri."" Encyclopædia Britannica. Encyclopædia Britannica, Inc., 2021.
2. ""Dante."" Poetry Foundation. Poetry Foundation, 2021.
3. ""Dante Alighieri."" The Dante Museum in Florence: His Life, His Books and A Virtual Tour Through Hell, Purgatory and Paradise. Museo Casa di Dante, 2021."
1,Q1511,Richard Wagner,Q1511,1813,Italy,Middle Class,"Richard Wagner was born in Leipzig, Germany, not Italy, on May 22, 1813. His father, Carl Friedrich Wagner, was a clerk in the Leipzig police service, and his mother, Johanna Rosine Wagner, was the daughter of a baker. After his father's death, his mother remarried to Ludwig Geyer, an actor and playwright. This indicates that Wagner's family was not part of the elite or subsistence classes, but rather the middle class, as they were engaged in skilled professions. Wagner's stepfather, Geyer, likely played a significant role in his early exposure to the arts, particularly theatre and music. Wagner attended the Kreuzschule in Dresden, indicating that his family had the means to provide him with an education, a privilege often associated with the middle class during this period.","""Richard Wagner: A Life in Music"" by Martin Geck (2013), ""Wagner Beyond Good and Evil"" by John Deathridge (2008), ""Richard Wagner: His Life, Art and Thought"" by Ronald Taylor (1979)."
2,Q5592,Michelangelo,Q5592,1475,Italy,Middle Class,"Michelangelo was born on March 6, 1475, in the small village of Caprese, near Arezzo, in Tuscany. His father, Ludovico di Leonardo Buonarroti Simoni, was a Florentine official with the title of the Judicial administrator, which was a middle-ranking official role. His family had lost much of its wealth by the time of Michelangelo's birth, but they still maintained an air of nobility due to their lineage tracing back to the counts of Canossa, a fact that Ludovico was very proud of. However, this ancestry did not translate into significant wealth or high social status at the time of Michelangelo's birth. 

Michelangelo's mother, Francesca di Neri del Miniato di Siena, died when he was six years old, after which he was placed in the care of a stonecutter's wife in the town of Settignano where he learned the basics of stonecutting and carving. This early exposure to the craft could be seen as a form of education, albeit not a formal one. 

In terms of housing and living conditions, Michelangelo likely lived in modest circumstances given his father's limited income. There is no evidence of any significant inherited privileges or disadvantages.","1. ""Michelangelo: A Biography"" by George Bull (1995)
2. ""Michelangelo"" by Howard Hibbard (1974"
3,Q307,Galileo Galilei,Q307,1564,Italy,Middle Class,"Galileo Galilei was born in Pisa, Italy, in 1564 to a family of modest means. His father, Vincenzo Galilei, was a musician and a music theorist. Although the family was not wealthy, they were well-respected and belonged to the middle class. Vincenzo's profession as a musician and music theorist indicates a certain level of education and cultural capital, which is characteristic of the middle class. Galileo's mother, Giulia Ammannati, came from an ancient but not particularly distinguished noble family. 

The family's financial situation was not stable, and they often struggled with debt. However, despite their financial struggles, Galileo was able to receive an education. He initially studied at a monastery near Florence and later enrolled at the University of Pisa to study medicine, although he did not complete his degree. This access to education, even in the face of financial hardship, suggests a middle-class background.","""Galileo: A Life"" by James Reston Jr., ""Galileo's Daughter: A Historical Memoir of Science, Faith, and Love"" by Dava Sobel, ""Galileo: Watcher of the Skies"" by David Wootton."
4,Q1401,Petrarch,Q1401,1304,Italy,Middle Class,"Petrarch, also known as Francesco Petrarca, was born in Arezzo, Tuscany in 1304. His father, Ser Petracco, was a notary by profession, which was a respected occupation in the middle class of the time. His mother, Eletta Canigiani, came from a middle-class family as well. The family was not of noble birth or particularly wealthy, but they were not impoverished either. 

Petrarch's access to education was a direct result of his family background. His father, recognizing his son's intellectual potential, sent him to study law in Montpellier and later in Bologna, which were among the best universities in Europe at the time. This level of education was not common among the lower classes and was usually reserved for those of middle or upper-class status.

The family lived in comfortable, if not luxurious, circumstances. After his father's exile from Florence, the family moved to Pisa and then to Avignon, where they lived in a house owned by the family. This suggests a level of wealth and stability that would not be available to those in the subsistence class.","1. ""Petrarch."" Encyclopædia Britannica. https://www.britannica.com/biography/Petrarch
2. ""Francesco Petrarch."" The Biography.com. https://www.biography.com/writer/francesco-petrarch
3."
5,Q1402,Giovanni Boccaccio,Q1402,1313,Italy,Middle Class,"Giovanni Boccaccio was born to an unknown woman and Boccaccino di Chellino, a merchant from Certaldo. His father was not a member of the nobility, but as a merchant, he would have been considered part of the middle class. Boccaccio's father was successful enough to arrange for his son to be educated, which was not a common privilege for those in the subsistence class. Boccaccio was initially trained by his father to follow in his footsteps as a merchant, and later he was sent to study canon law at the Studium (an institution of higher learning) in Naples, which further suggests a middle-class background. The family's living conditions and wealth are not well-documented, but Boccaccio's access to education and his father's occupation suggest a level of financial stability.","""Giovanni Boccaccio: A Critical Guide to the Complete Works,"" edited by Victoria Kirkham, Michael Sherberg, and Janet Levarie Smarr; ""Boccaccio: The Man and His Works"" by Edward Hutton."
6,Q7317,Giuseppe Verdi,Q7317,1813,Italy,Middle Class,"Giuseppe Verdi was born in Le Roncole, a village in the Duchy of Parma in the Kingdom of Italy, in 1813. His parents, Carlo Verdi and Luigia Uttini, were innkeepers and small-scale farmers. While they were not wealthy, they were not impoverished either, placing them in the middle class according to the social structure of Italy at that time. Verdi's parents recognized his musical talent early on and made sacrifices to provide him with a basic education and music lessons. This indicates a certain level of financial stability and access to resources, characteristic of the middle class. Verdi's early life was spent in a rural setting, living in modest but not destitute conditions. There is no evidence of any inherited privileges or disadvantages.","""Giuseppe Verdi: A Research and Information Guide"" by Gregory Harwood, ""Verdi: A Biography"" by Mary Jane Phillips-Matz."
7,Q1399,Niccolò Machiavelli,Q1399,1469,Italy,Middle Class,"Niccolò Machiavelli was born in Florence, Italy, to parents Bernardo di Niccolò Machiavelli, a legal official, and Bartolomea di Stefano Nelli. His father was a lawyer, albeit not a very prosperous one, which would place the family in the middle class according to the social structure of the time. The family was not wealthy, but they were not poor either. They owned a house in Florence and a small property in the country. 

Machiavelli's access to education was also a result of his family's middle-class status. His father, despite not being wealthy, valued education and had a small personal library of books on Latin and Italian history, which Niccolò had access to. This indicates that the family had enough resources to invest in education, a luxury not available to the lower classes.

Early life housing and living conditions for Machiavelli would have been modest but comfortable, consistent with a middle-class lifestyle. There is no evidence of any significant inherited privileges or disadvantages.","1. ""Machiavelli: A Biography"" by Miles J. Unger
2. ""Machiavelli in Love: The Modern Politics of Love and Fear"" by Haig Patapan
3. ""The Life of Niccolò Machiavelli"" by Roberto Ridolfi."
8,Q9438,Thomas Aquinas,Q9438,1225,Italy,Elite,"Thomas Aquinas was born into a wealthy family of the lower nobility. His father, Landulph, was a count of Aquino and his mother, Theodora, was the countess of Teano. This indicates that his family held significant social and economic status in the region. His family's wealth and status allowed him access to education from an early age. At the age of five, he was sent to the Benedictine monastery at Monte Cassino, a common practice for sons of nobility. This early education was not based on his personal merit, but rather a privilege of his noble birth. His family's wealth and status would have also ensured comfortable living conditions during his early life.","1. ""The Oxford Companion to Philosophy"" by Ted Honderich
2. ""The Cambridge Companion to Aquinas"" by Norman Kretzmann, Eleonore Stump
3. ""Aquinas: A Beginner's Guide"" by Edward Feser
4. ""Thomas Aquinas: A Historical and Philosophical Profile"" by Pasquale Porro."
9,Q5597,Raphael,Q5597,1483,Italy,Middle Class,"Raphael was born in Urbino, Italy, in 1483. His father, Giovanni Santi, was a painter and poet at the court of Federico III da Montefeltro, Duke of Urbino, which suggests a middle-class background. Giovanni Santi was not a nobleman, but his position at the court indicates a certain level of social standing and access to cultural and intellectual resources. Raphael's mother, Magia di Battista Ciarla, came from a merchant family, further supporting the middle-class classification. Raphael's early access to education was likely due to his father's position and connections. Giovanni Santi was known to have taught his son painting techniques and principles, and Raphael may have also had access to the Duke's library, one of the finest in Italy. Raphael's early life housing and living conditions would have been relatively comfortable given his father's court position. However, Raphael was orphaned at age 11, which may have impacted his family's wealth and social standing.","Vasari, Giorgio. ""Life of Raphael."" In Lives of the Artists. Oxford University Press, 1991; Jones, Roger. Raphael. Yale University Press, 1983."
10,Q128027,Giorgio Vasari,Q128027,1511,Italy,Middle Class,"Giorgio Vasari was born in Arezzo, Tuscany, to Antonio Vasari and Maddalena Tacci. His father was a potter, which was a skilled craft occupation, suggesting a middle-class background. Vasari's family was not of noble lineage, nor were they impoverished. They were able to provide him with an education, as he was sent to live with a relative, Luca Signorelli, who was a painter and likely provided Vasari with his initial artistic training. This indicates that his family had the means to support his education, further suggesting a middle-class status. His early life housing and living conditions are not well-documented, but his family's ability to support his education suggests they were not living in poverty. There is no evidence of any inherited privileges or disadvantages.","Vasari, Giorgio. ""Lives of the Most Eminent Painters, Sculptors, and Architects."" 1550."
11,Q93343,Percy Bysshe Shelley,Q93343,1792,Italy,Elite,"Percy Bysshe Shelley was born into a wealthy and influential family in Sussex, England, not Italy, on August 4, 1792. His father, Sir Timothy Shelley, was a Member of Parliament, landowner, and baronet, a rank of honor bestowed by the British Crown. This places the Shelley family within the aristocratic elite of late 18th century England. The family's wealth and social standing would have provided Percy with a comfortable early life and access to education. Indeed, Shelley was educated at Eton, one of England's most prestigious schools, and later at University College, Oxford. This level of education was typically only accessible to those from privileged backgrounds during this period.","1. ""Percy Bysshe Shelley."" Poetry Foundation. https://www.poetryfoundation.org/poets/percy-bysshe-shelley
2. ""Percy Bysshe Shelley."" The British Library. https://www.bl.uk/people/percy-bysshe-shelley
3. ""Percy Bysshe Shelley."" Encyclopædia Britannica. https://www.britannica.com/biography/Percy-Bysshe-Shelley"
12,Q48900,Ludovico Ariosto,Q48900,1474,Italy,Middle Class,"Ludovico Ariosto was born into a middle-class family in Reggio Emilia, Italy. His father, Niccolò Ariosto, was a commander in the service of the Este family, the ruling family of Ferrara, Modena, and Reggio Emilia. This position, while not of nobility, was of considerable importance and would have provided the family with a comfortable income. Ludovico was the eldest of 10 children, suggesting that the family had enough resources to support a large family. 

In terms of education, Ludovico's father was keen on his son receiving a good education. Ludovico was sent to study law at the University of Ferrara, but his interest lay in the classics and Latin literature. His ability to access education was a direct result of his family's social standing and financial stability.

The family's housing and living conditions would have been comfortable, given Niccolò's position. However, there is no evidence to suggest that they lived in luxury or had significant inherited privileges.","1. ""Ludovico Ariosto."" Encyclopædia Britannica. https://www.britannica.com/biography/Ludovico-Ariosto
2. ""Ludovico Ariosto."" Poetry Foundation. https://www.poetryfoundation.org/poets/ludovico-ariosto
3. ""Ludovico Ariosto."" Italian Renaissance Learning"
13,Q36330,Giordano Bruno,Q36330,1548,Italy,Middle Class,"Giordano Bruno was born in Nola, in the Kingdom of Naples, around 1548. His father, Giovanni Bruno, was a soldier, which suggests a middle-class background. The family was not of noble lineage or extreme poverty. Bruno's access to education was also indicative of a middle-class upbringing. At a young age, he was sent to Naples to study humanities, logic, and dialectics. This suggests that his family had the means to support his education, a privilege not typically afforded to those of lower social classes during this period. However, it's important to note that his education was also facilitated by his early entrance into the Dominican Order, which provided further educational opportunities. His early life housing and living conditions are not well-documented, but his father's occupation as a soldier would suggest a stable, if not affluent, household.","""Giordano Bruno: His Life and Thought"" by Dorothea Waley Singer, ""Giordano Bruno and Renaissance Science"" by Hilary Gatti."
14,Q168962,Torquato Tasso,Q168962,1544,Italy,Elite,"Torquato Tasso was born into a family of the elite class. His father, Bernardo Tasso, was a courtier and served as a secretary to the Prince of Salerno, Ferrante Sanseverino. This position would have placed the Tasso family within the upper echelons of society, as courtiers were typically of noble birth or had achieved a high social standing. Furthermore, Tasso's mother, Porzia de Rossi, was from a noble family, further cementing the family's elite status. The family's wealth and social standing would have provided Tasso with access to a high-quality education, a privilege typically reserved for the elite class during this time period. Tasso's early life housing and living conditions would have been comfortable, given his family's status.","""Torquato Tasso."" Encyclopædia Britannica. Encyclopædia Britannica, inc., February 28, 2020. ""Torquato Tasso."" Poetry Foundation. Poetry Foundation, n.d."
15,Q182046,Leon Battista Alberti,Q182046,1404,Italy,Elite,"Leon Battista Alberti was born into a wealthy and noble family. His father, Lorenzo Alberti, was a merchant and belonged to one of the most powerful families in Florence, the Alberti family. The Alberti family was part of the Florentine nobility and had significant influence in the city's political and economic affairs. Despite being exiled from Florence due to political conflict, the family maintained their wealth and status. Alberti's early education was likely facilitated by his family's wealth and status, as he was educated at the prestigious schools of Padua and Bologna. His family's wealth and status would also have afforded him a comfortable early life housing and living conditions. Therefore, Alberti's birth and childhood social class can be classified as elite.","""Leon Battista Alberti: Master Builder of the Italian Renaissance"" by Anthony Grafton, ""The Architecture of Leon Battista Alberti in Ten Books"" by Leon Battista Alberti, ""Alberti Family"" by Encyclopaedia Britannica."
16,Q101698,Gaetano Donizetti,Q101698,1797,Italy,Subsistence,"Gaetano Donizetti was born into a poor family in Bergamo, Italy. His father, Andrea Donizetti, worked as a weaver, a profession that typically fell into the lower social classes during this period. His mother, Simone Donizetti, was a seamstress. The family lived in a single room in the parish of San Pietro, which suggests that they were of limited means. Despite their poverty, Donizetti was able to receive some education due to the charity of others, not because of his family's wealth or status. The composer Johann Simon Mayr recognized Donizetti's talent and arranged for him to receive music lessons, but this was not a privilege that came from his family background.","""Gaetano Donizetti: A Research and Information Guide"" by James P. Cassaro, ""Donizetti and His Operas"" by William Ashbrook."
17,Q1064,Alessandro Manzoni,Q1064,1785,Italy,Elite,"Alessandro Manzoni was born into a wealthy and noble family. His father, Pietro Manzoni, was a high-ranking government official and his mother, Giulia Beccaria, was the daughter of the famous philosopher and economist Cesare Beccaria. His parents' marriage was not a happy one and they separated when Alessandro was just five years old. After the separation, he was sent to live with his maternal grandparents who were also of noble lineage. His grandfather, Cesare Beccaria, was a well-known figure in the intellectual circles of Milan and had a significant influence on Alessandro's early education. The family's wealth and status provided him with a privileged upbringing, including access to private tutors and a comprehensive education. His early life housing and living conditions were also of high standard, reflecting the family's elite status.","1. ""Alessandro Manzoni, Italian Poet and Novelist"" by Britannica.
2. ""Alessandro Manzoni and His Times"" by Giovanni Carsaniga.
3. ""Alessandro Manzoni"" by Enciclopedia Treccani."
18,Q190116,Benvenuto Cellini,Q190116,1500,Italy,Middle Class,"Benvenuto Cellini was born in Florence, Italy, in 1500. His father, Giovanni Cellini, was a musician and maker of musical instruments, which would classify him as a skilled craftsman. His mother, Maria Lisabetta Granacci, was from a middle-class family. Although the family was not wealthy, they were not impoverished either. Benvenuto's father was able to provide him with a basic education, teaching him how to read and write, as well as the basics of music and drawing. The family lived in a modest house in Florence, indicating a middle-class lifestyle. There is no evidence of inherited privileges or disadvantages.","""Benvenuto Cellini: A Psychosexual Study of an Infantile Reminiscence"" by Otto Rank; ""The Life of Benvenuto Cellini"" by Benvenuto Cellini; ""Benvenuto Cellini: Sexuality, Masculinity, and Artistic Identity in Renaissance Italy"" by Margaret A. Gallucci."
19,Q5669,Sandro Botticelli,Q5669,1445,Italy,Middle Class,"Alessandro di Mariano di Vanni Filipepi, known as Sandro Botticelli, was born in the city of Florence around 1445. His father, Mariano di Vanni d'Amedeo Filipepi, was a tanner, a profession that falls within the category of skilled craftspeople. This would suggest that Botticelli was born into a middle-class family. The family was not wealthy, but they were not poor either. They were able to provide for their children and ensure they had a decent upbringing. Botticelli's brother, Antonio, was a goldsmith, another profession that falls within the middle-class category. This suggests that the family had enough resources to provide their children with training in skilled crafts. Botticelli himself was initially trained as a goldsmith before becoming an apprentice to Fra Filippo Lippi, a well-known painter of the time. This apprenticeship would have required some level of financial resources, further suggesting a middle-class background. The family lived in a house in the Via Nuova in Florence, indicating a stable and decent living condition.","Vasari, Giorgio. ""Lives of the Most Eminent Painters Sculptors and Architects."" (1550). Lightbown, Ronald. ""Sandro Botticelli: Life and Work."" (1989)."
20,Q76738,Athanasius Kircher,Q76738,1602,Italy,Middle Class,"Athanasius Kircher was born in Geisa, a small town in the Holy Roman Empire, now part of modern-day Italy. His father, Johannes Kircher, was a magistrate and his mother, Anna Gansewinckel, came from a family of local administrators. This suggests that the Kircher family was part of the local middle class, with some degree of social standing and economic stability. Johannes Kircher's position as a magistrate would have provided the family with a reasonable income and some level of prestige within their community. Furthermore, Athanasius Kircher was able to attend the Jesuit school in Fulda, indicating that his family had the means to provide him with an education. However, there is no evidence to suggest that the Kircher family was part of the elite or aristocratic class.","""Athanasius Kircher: The Last Man Who Knew Everything"" by Paula Findlen, ""Athanasius Kircher's Theatre of the World"" by Joscelyn Godwin."
21,Q172599,Giacomo Leopardi,Q172599,1798,Italy,Elite,"Giacomo Leopardi was born into a noble and wealthy family in the small town of Recanati, in the Papal States of Italy. His father, Count Monaldo Leopardi, was a local nobleman and his mother, Adelaide Antici Mattei, came from a wealthy family. The Leopardi family was one of the oldest and most respected in Recanati, with a lineage dating back to the 14th century. They owned a large amount of land and had a significant number of servants. Giacomo's early life was spent in a large, comfortable family home, the Palazzo Leopardi, which included a library of over 20,000 volumes. This library, to which Giacomo had unrestricted access, was a clear sign of the family's wealth and status. His education was provided by private tutors, another privilege of his family's elite status.","""Giacomo Leopardi: A Life"" by Iris Origo; ""Leopardi: A Study in Solitude"" by Iris Origo; ""Giacomo Leopardi, Poet and Philosopher"" by Walter Binni."
22,Q228494,Elizabeth Barrett Browning,Q228494,1806,Italy,Elite,"Elizabeth Barrett Browning was born on March 6, 1806, in Coxhoe Hall, Durham, England, not Italy. She was the eldest of 12 children in a wealthy family. Her father, Edward Barrett Moulton Barrett, owned sugar plantations in Jamaica, which provided the family with a substantial income. The family lived in a large estate, indicating their high social standing. Elizabeth's access to education was also a result of her family's wealth; she was home-schooled and had access to her family's extensive library, which allowed her to read and learn from a young age.","- ""Elizabeth Barrett Browning."" Poetry Foundation. https://www.poetryfoundation.org/poets/elizabeth-barrett-browning
- ""Elizabeth Barrett Browning."" Encyclopædia Britannica. https://www.britannica.com/biography/Elizabeth-Barrett-Browning
- ""Elizabeth Barrett Browning."" Victorian Web. http://www.victorianweb.org/authors/ebb/ebbio.html"
23,Q309759,Edward Lear,Q309759,1812,Italy,Middle Class,"Edward Lear was born in Holloway, London, not Italy, on May 12, 1812. He was the 20th of 21 children born to Ann and Jeremiah Lear. His father, Jeremiah Lear, was a stockbroker, a profession that would place the family in the middle class. However, the family's financial situation deteriorated due to Jeremiah's poor financial decisions and the family fell into debt. Edward was raised by his eldest sister, Ann, after his mother and father were unable to care for him. Despite these financial difficulties, Edward was able to receive some education, likely due to his family's middle-class background. His early life housing and living conditions would have been comfortable initially, but became strained as the family's financial situation worsened. There is no evidence of any inherited privileges or disadvantages.","Noakes, V. (1985). Edward Lear, 1812-1888. Weidenfeld and Nicolson. ; Lehmann, J. (1977). Edward Lear and His World. Thames & Hudson."
