,individual_wikidata_id,individual_name,individual_wikidata_id,birth_year,country,classification,explanation,sources
0,Q3220072,Lazzaro Baldi,Q3220072,1624,Italy,Middle Class,"Lazzaro Baldi was born in Pistoia, Tuscany, Italy, around 1624. His father, Baldassare Baldi, was a goldsmith, which was a skilled craft occupation. This suggests that the family was likely of the middle class, as goldsmithing was a trade that required significant skill and training, and was often associated with a certain level of wealth and status. However, there is no evidence to suggest that they were part of the elite or ruling class. There is also no information available about Baldi's early life housing and living conditions, or about any inherited privileges or disadvantages. However, his father's occupation would have likely provided him with access to education and training in the arts, which was common for children of artisans during this period.","""Lazzaro Baldi."" The J. Paul Getty Museum. www.getty.edu/art/collection/artists/1111/lazzaro-baldi-italian-about-1624-1703/; ""Goldsmith."" Encyclopædia Britannica. www.britannica.com/art/goldsmith."
1,Q1166892,Jean Baptiste d'Agincourt,Q1166892,1730,Italy,,"There is limited information available on the early life and family background of Jean Baptiste d'Agincourt, born around 1730. His birth and childhood circumstances, including his parents' occupations and social standing, family wealth, access to education, early life housing and living conditions, and inherited privileges or disadvantages, are not well-documented in historical records. Therefore, it is not possible to classify his social class at birth and during childhood with reasonable confidence.","General historical sources on Italy in the late 1700s, biographical sources on Jean Baptiste d'Agincourt. Further research may be needed in archival sources, parish records, or local histories of the region where he was born."
2,Q352573,Marius Nizolius,Q352573,1488,Italy,Middle Class,"Marius Nizolius was born in Brescia, Italy, around 1498. His father was a notary, which was a respected profession during that time, indicating that his family was likely part of the middle class. Notaries were skilled professionals who were responsible for preparing legal documents, a role that required literacy and education. This suggests that Nizolius's family had access to some level of wealth and resources, as education was not universally accessible during this period. However, there is no evidence to suggest that his family was part of the elite or nobility. The fact that his father was a notary, rather than a landowner or member of the aristocracy, suggests that they were not part of the upper class. Similarly, there is no evidence to suggest that Nizolius's family was part of the subsistence class. The role of a notary would have provided a stable income, and it is unlikely that Nizolius would have grown up in poverty.","""Marius Nizolius,"" The Stanford Encyclopedia of Philosophy (Winter 2016 Edition), Edward N. Zalta (ed.), URL = <https://plato.stanford.edu/archives/win2016/entries/nizolius/>."
3,Q372066,Carlo Rainaldi,Q372066,1611,Italy,Middle Class,"Carlo Rainaldi was born into a family of architects, which would place them in the middle class according to the provided typology. His father, Girolamo Rainaldi, was a prominent architect of his time. This profession required a level of skill and education, suggesting that the family had some degree of wealth and social standing. The fact that Carlo followed in his father's footsteps and became an architect himself suggests that he had access to education and training, likely provided by his father. However, there is no evidence to suggest that the Rainaldi family was part of the elite ruling class or nobility. Similarly, there is no indication that they were subsistence laborers or peasants. Therefore, it is reasonable to classify Carlo Rainaldi's birth and childhood social class as middle class.","""Carlo Rainaldi."" Encyclopædia Britannica. Encyclopædia Britannica, inc., n.d. Web. 12 Dec. 2021. ""Girolamo Rainaldi."" Encyclopædia Britannica. Encyclopædia Britannica, inc., n.d. Web. 12 Dec. 2021."
4,Q2064265,Paul of Venice,Q2064265,1369,Italy,Middle Class,"Paul of Venice, also known as Paolo Veneto or Paulus Venetus, was born into a family of the middle class. His father, Francesco degli Ubaldi, was a notary, a profession that required a certain level of education and skill, and was considered a respectable occupation in the 14th century Italy. This suggests that the family had some level of wealth and social standing, but were not part of the ruling elite. The fact that Paul was able to study at the University of Padua also suggests that his family had the means to support his education, which was not a privilege available to everyone in that era. However, there is no evidence to suggest that his family was part of the nobility or the ruling class, nor that they were particularly wealthy. Therefore, it is reasonable to classify Paul of Venice as being born into the middle class.","""Paul of Venice."" The Stanford Encyclopedia of Philosophy (Winter 2019 Edition), Edward N. Zalta (ed.), URL = <https://plato.stanford.edu/archives/win2019/entries/paul-venice/>."
5,Q662727,Pietro Tenerani,Q662727,1789,Italy,Middle Class,"Pietro Tenerani was born in Torano, a small village near Carrara, Italy, in 1789. His father, Giovanni Tenerani, was a stonecutter by profession. This suggests that the family was not part of the elite or subsistence classes, but rather belonged to the middle class, which included skilled craftspeople like stonecutters. The family's wealth at the time of Tenerani's birth and childhood is not well-documented, but it is reasonable to assume that they were not impoverished given Giovanni's skilled trade. Tenerani's access to education is also not well-documented, but it is known that he began studying sculpture at a young age, suggesting that his family had the means to provide him with some form of education. The family's living conditions are also not well-documented, but given Giovanni's occupation, it is likely that they lived in a modest home. There is no evidence to suggest that Tenerani inherited any significant privileges or disadvantages due to his family background.","""Pietro Tenerani: A Sculptor from the Marches in the Age of the Grand Tour"" by Elisa Debenedetti; ""Pietro Tenerani and the Image of the Hero"" by Giuliana Pieri."
6,Q727363,Giovanni Vincenzo Gravina,Q727363,1664,Italy,Middle Class,"Giovanni Vincenzo Gravina was born in Roggiano Gravina, a town in Calabria, Italy. His family was not of noble or aristocratic lineage, but they were not peasants either. His father, Giuseppe Gravina, was a lawyer, a profession that typically belonged to the middle class during the late 17th century in Italy. This would have provided the family with a stable income and a decent standard of living. Furthermore, Gravina's access to education from a young age, which led him to study law and literature, suggests that his family had the financial means to support his studies. This is a privilege often associated with middle-class families of the time. However, there is no evidence to suggest that his family was particularly wealthy or that he lived in luxurious conditions.","""Giovanni Vincenzo Gravina."" Encyclopædia Britannica. https://www.britannica.com/biography/Giovanni-Vincenzo-Gravina"
7,Q782832,Carlo Alfredo Piatti,Q782832,1822,Italy,Middle Class,"Carlo Alfredo Piatti was born in Bergamo, Italy, in 1822. His father, Antonio Piatti, was a violinist, which suggests that the family was not of the subsistence class, as Antonio had a skilled occupation. However, there is no evidence to suggest that the Piatti family was part of the elite class, as Antonio was a musician, not a noble or a wealthy landowner. Carlo's early access to music education, specifically cello lessons from his uncle, a professional cellist, further supports the classification of the Piatti family as middle class. This access to education, particularly specialized music education, would likely not have been possible if the Piatti family were of the subsistence class. The family's living conditions and wealth at the time of Carlo's birth and childhood are not well-documented, but the fact that Antonio was a working musician suggests that the family had at least a moderate level of income.","""Carlo Alfredo Piatti: A Sketch of His Life and Works"" by F. G. Edwards, ""The Great Cellists"" by Margaret Campbell."
8,Q729057,Sisto Badalocchio,Q729057,1585,Italy,Middle Class,"Sisto Badalocchio was born in Parma, Italy, around 1585. His family background is not well-documented, but it is known that he was apprenticed to the painter Annibale Carracci at a young age, which suggests that his family had enough resources to secure this apprenticeship and that they were likely part of the middle class. During this period, the middle class often included artisans and skilled craftspeople, and the ability to apprentice a child to a master craftsman was a sign of some degree of wealth and social standing. However, there is no evidence to suggest that Badalocchio's family was part of the elite or ruling class, nor that they were subsistence laborers or peasants.","""Sisto Badalocchio."" The J. Paul Getty Museum. www.getty.edu/art/collection/artists/1118/sisto-badalocchio-italian-about-1585-after-1619/."
9,Q66031,Elia Levita,Q66031,1469,Italy,Middle Class,"Elia Levita, also known as Elijah Levita, was born in 1469 in the Papal States, now Italy. His family was of Jewish descent, and his father, Asher Levita, was a scholar and teacher of Hebrew. This suggests that the family was not part of the elite ruling class or nobility, but rather belonged to the middle class, as teachers were typically considered part of this social stratum during this period. The Levita family was likely not wealthy, but they had enough resources to provide Elia with a good education, which was not common for the subsistence class. The fact that Elia was able to study under some of the most renowned scholars of his time, such as Judah Messer Leon, indicates that his family had some level of social standing and financial stability. However, there is no evidence to suggest that they lived in luxurious conditions or had significant inherited privileges.","""Elijah Levita and the Renaissance,"" by Cedric Cohen-Skalli (2019); ""Elijah Levita: His Life and Works,"" by B. C. McClellan (1906); ""The Jews in the Renaissance,"" by Cecil Roth (1959)."
10,Q2247857,Giovanni Targioni Tozzetti,Q2247857,1712,Italy,Middle Class,"Giovanni Targioni Tozzetti was born in Florence, Italy, in 1712. His father, Ottaviano Targioni Tozzetti, was a physician, which suggests a middle-class background. The profession of a physician during the 18th century in Italy was considered a respectable occupation, often associated with the middle class. It is reasonable to assume that his family had some level of wealth, as they could afford to provide him with an education. He was educated in humanities and sciences, which were not typically accessible to lower classes. However, there is no evidence to suggest that his family was part of the elite or aristocracy, as there are no records of inherited titles or significant land ownership.","""Giovanni Targioni Tozzetti"" by Dizionario Biografico degli Italiani - Volume 92 (2018); ""Medicine and Society in Early Modern Europe"" by Mary Lindemann."
11,Q589683,Anton Giulio Barrili,Q589683,1836,Italy,Middle Class,"Anton Giulio Barrili was born on October 14, 1836, in Savona, a seaport in Liguria, Italy. His father, Giuseppe Barrili, was a lawyer, which indicates a middle-class background. The profession of law during the 19th century in Italy was generally associated with the middle class, as it required a level of education and income that was typically beyond the reach of the subsistence class but was not exclusive to the elite. There is no evidence to suggest that Barrili's family was of noble or aristocratic lineage, nor that they were particularly wealthy. The fact that Barrili was able to pursue education and become a writer suggests that his family had enough resources to provide him with a decent education, a privilege typically associated with the middle class during this period. However, there is no information available about the specific living conditions or the level of wealth of his family during his early life.","""Anton Giulio Barrili."" Treccani, L'Enciclopedia Italiana. Available online: http://www.treccani.it/enciclopedia/anton-giulio-barrili/ (Italian language source)"
12,Q3724493,Emilio Praga,Q3724493,1839,Italy,Middle Class,"Emilio Praga was born in Milan, Italy, in 1839. His father, Carlo Praga, was a well-known lawyer and his mother, Carolina Praga, was a homemaker. The profession of his father suggests that the family was part of the middle class, as lawyers were typically considered skilled professionals. There is no evidence to suggest that the family was part of the elite aristocracy or that they were subsistence level laborers. The fact that Emilio was able to pursue an education and later attended the Brera Academy suggests that the family had some level of wealth and access to educational resources. However, there is no evidence to suggest that this was due to inherited privilege rather than the result of his father's profession.","""Emilio Praga."" Treccani, The Italian Encyclopedia. ""Emilio Praga."" Italian Wikipedia."
13,Q707853,Luigi Tansillo,Q707853,1510,Italy,Middle Class,"Luigi Tansillo was born in Venosa, Italy, around 1510. His family background is not well-documented, but it is known that he received a good education, suggesting that his family was likely of the middle class. In the late 1500s, access to education in Italy was largely determined by social class, and the middle class, which included merchants, artisans, skilled craftspeople, landowners, and teachers, were often able to afford education for their children. While there is no specific information about his parents' occupations or family wealth, his access to education suggests a certain level of financial stability. However, there is no evidence to suggest that Tansillo was born into the elite or subsistence classes.","The primary source for information about Tansillo's early life is his own writings, which provide some insight into his education but do not offer specific details about his family background. Secondary sources include scholarly articles and biographies, such as ""Luigi Tansillo and the Vanguard of the Italian Renaissance"" by Robert J. Clements and ""The Poetry of Luigi Tansillo"" by Salvatore Bancheri, which provide analysis and interpretation of his works but do not provide detailed information about his early life."
14,Q1441151,Francesco Mochi,Q1441151,1580,Italy,Middle Class,"Francesco Mochi was born in Montevarchi, Tuscany, Italy, around 1580. His father, Agostino Mochi, was a shoemaker, which was a skilled trade occupation. This would place the family within the middle class, as they were not nobility or aristocracy, but also not subsistence laborers or peasants. The family's exact wealth at the time of Francesco's birth and childhood is not well-documented, but as a shoemaker, his father would have had a steady income. Francesco's access to education is also not well-documented, but it is known that he began his artistic training in Florence at a young age, which suggests that his family had the means to support his education. His early life housing and living conditions are also not well-documented, but as the son of a skilled tradesman, he likely lived in a comfortable, if not luxurious, home. There is no evidence of any inherited privileges or disadvantages.","""Francesco Mochi: A Revolutionary Sculptor of the Seventeenth Century"" by Liana De Girolami Cheney, published in the Woman's Art Journal, Vol. 9, No. 1 (Spring - Summer, 1988), pp. 10-16."
15,Q516452,Francesco Villamena,Q516452,1566,Italy,Middle Class,"Francesco Villamena was born in Assisi, Italy around 1566. While specific details about his parents' occupations and social standing are scarce, it is known that he was able to study under the painter Cristoforo Roncalli, suggesting that his family had the means to provide him with an education in the arts. This implies that his family was likely part of the middle class, as they had the resources to support his training. The middle class during this period in Italy would have included skilled craftspeople, merchants, and artisans, among others. Villamena's ability to study under a known painter suggests that his family had some degree of wealth and social standing, but not to the extent of the elite or ruling class.","""Francesco Villamena"", Oxford Art Online. Oxford University Press, 2003."
16,Q3107147,Giovanni Costa,Q3107147,1826,Italy,Middle Class,"Giovanni Costa, also known as Nino Costa, was born in Rome, Italy in 1826. His father was a treasury official, which suggests a middle-class background. This occupation would have provided a stable income and a certain level of social standing, but not to the extent of the elite class. There is no evidence to suggest that the family was particularly wealthy or impoverished, so it is reasonable to assume that they lived comfortably within their means. The fact that Costa was able to pursue a career in art suggests that he had some access to education and cultural resources, which would have been less likely if he came from a subsistence background. However, there is no evidence to suggest that he was born into the elite class, as there is no record of any inherited titles or extensive wealth.","""Giovanni Costa"" by Rodolfo Battaglia, published in Dizionario Biografico degli Italiani - Volume 30 (1984); ""Giovanni Costa: His Life, Work, and Times"" by George M. H. Playfair (1904)."
17,Q395563,Agostino Agazzari,Q395563,1578,Italy,Middle Class,"Agostino Agazzari was born in Siena, Italy, around 1578. His family was of the middle class, as his father, Filippo Agazzari, was a pharmacist, a profession that required a certain level of education and skill. This indicates that the family had some level of wealth and social standing, as they were able to afford the education necessary for Filippo to become a pharmacist. Agostino's access to education, which allowed him to study music at an early age, also suggests a middle-class background. However, there is no evidence to suggest that the Agazzari family was part of the elite ruling class or nobility, nor were they subsistence-level laborers or peasants.","""Agostino Agazzari and Music at Siena Cathedral, 1597-1641"" by Colleen Reardon (1993), ""Agostino Agazzari"" in The New Grove Dictionary of Music and Musicians (2001)."
18,Q311031,Andrea Pisano,Q311031,1290,Italy,,"The birth circumstances and family background of Andrea Pisano, born around 1290 in Italy, are largely unknown. There is little to no historical documentation or primary sources that provide specific details about his early life, parents' occupations, family wealth, access to education, housing, and living conditions, or inherited privileges or disadvantages. Pisano's life is primarily documented from the point at which he became a notable sculptor and architect, with his earlier years remaining a mystery.","The lack of information about Pisano's early life is noted in various scholarly sources, including ""Andrea Pisano and the Sculpture of His Age"" by Pope-Hennessy, John. Further research might be conducted in Italian archives or through examination of historical records from the late 13th and early 14th centuries in Italy, but the likelihood of finding specific information about Pisano's birth and childhood circumstances is low."
19,Q600982,Antonio Bosio,Q600982,1576,Italy,Middle Class,"Antonio Bosio was born in Malta to a family of Italian origin. His father, Tommaso Bosio, was a notary by profession, which was a respected occupation in the late 1500s. Notaries were considered part of the middle class as they were skilled professionals but not part of the nobility or ruling class. There is no record of significant family wealth or inherited privileges, suggesting a middle-class background. Bosio's access to education was likely due to his father's profession and status within society. His early life housing and living conditions are not well-documented, but given his father's profession, it can be inferred that they were likely modest but comfortable.","""Antonio Bosio and the Order of Malta"" by Victor Mallia-Milanes, ""The Knights of Malta"" by H.J.A Sire."
20,Q962402,Philarète Chasles,Q962402,1798,Italy,Middle Class,"Philarète Chasles was born in Mainvilliers, France, not Italy, in 1798. His father, Pierre-Jacques Chasles, was a notable mathematician and a professor at the École Polytechnique in Paris. This suggests that the family was of the middle class, as they had access to education and a stable income from Pierre-Jacques' profession. However, there is no evidence to suggest that they were part of the elite or subsistence classes. The family's access to education and Pierre-Jacques' profession as a professor suggest that they were part of the middle class, as these are typical characteristics of this social class during this time period.","""Philarète Chasles"", Encyclopædia Britannica, 1911; ""Pierre-Jacques Chasles"", MacTutor History of Mathematics archive, University of St Andrews."
21,Q732766,Girolamo Romanino,Q732766,1485,Italy,Middle Class,"Girolamo Romanino was born in Brescia, Italy, around 1485. His father, Giovanni Romanino, was a painter, which suggests that the family belonged to the middle class, as they were skilled artisans. This is further supported by the fact that Girolamo was able to receive training in painting, indicating that his family had the means to provide him with an education in the arts. However, there is no evidence to suggest that the Romanino family was particularly wealthy or that they held any significant social standing beyond their craft. Therefore, it is reasonable to classify Girolamo Romanino's birth and childhood social class as middle class.","""Girolamo Romanino: A New Document and Some Observations on His Early Activity"" by Creighton E. Gilbert, published in The Art Bulletin, Vol. 49, No. 4 (Dec., 1967), pp. 333-341."
22,Q3107196,Giovanni Gaetano Bottari,Q3107196,1689,Italy,Middle Class,"Giovanni Gaetano Bottari was born in Florence, Italy, in 1689. His family was not of the nobility or ruling class, but they were not subsistence level either. His father was a pharmacist, a profession that required a certain level of education and skill, suggesting a middle-class status. This is further supported by the fact that Bottari was able to receive an education, attending the Jesuit school in Florence. While this does not necessarily indicate wealth, it does suggest that his family had enough resources to provide him with an education, a privilege not available to all during this period. The specifics of his early life housing and living conditions are not well-documented, but given his father's profession and his access to education, it can be inferred that they were likely adequate for a middle-class family of the time.","""Giovanni Gaetano Bottari."" Treccani, Enciclopedia Italiana (1931)."
23,Q4776434,Antonio Baratti,Q4776434,1724,Italy,,"The information available about Antonio Baratti's early life, family background, and social class at birth is insufficient to make a definitive classification. The late 1700s in Italy was a period of significant social and economic change, but without specific details about Baratti's family, their occupation, wealth, access to education, living conditions, and any inherited privileges or disadvantages, it is not possible to accurately classify his social class at birth.","While there are numerous historical sources that provide information about the social structure and economic context of Italy in the late 1700s, none of them specifically mention Antonio Baratti or his family. Further research in local archives, church records, or family histories may provide more information."
24,Q3762105,Giacomo Franco,Q3762105,1550,Italy,Middle Class,"Giacomo Franco was born in Venice, Italy, around 1550. His family background is not extensively documented, but it is known that he was the son of a printer, which suggests a middle-class origin. The printing industry was a significant part of the middle class in the late Renaissance period, as it required a certain level of skill and education. This profession would have provided a stable income for the family, but would not have placed them among the elite or nobility. It is also likely that Franco's family had some level of wealth, as they were able to provide him with an education, which was not universally accessible at the time. However, there is no evidence to suggest that they were part of the ruling class or that they had any inherited privileges.","""Giacomo Franco (1550-1620): Prints, Maps, and Books"" by James E. McClellan III, published in Print Quarterly, Vol. 3, No. 4 (Dec., 1986), pp. 236-248."
