,individual_wikidata_id,individual_name,individual_wikidata_id,birth_year,country,classification,explanation,sources
143,Q324998,Pierre-Jean de Béranger,Q324998,1780,France,Middle Class,"Pierre-Jean de Béranger was born in Paris, France on August 19, 1780. His father, Jean-François de Béranger, was a tailor and his mother, Marie-Jeanne Daugé, was a seamstress. This suggests that his family belonged to the middle class, as they were skilled craftspeople. However, his family was not wealthy and he lived in relative poverty during his early years. His father left the family when Pierre-Jean was very young, and his mother struggled to support them. Despite these hardships, Béranger was able to receive an education due to the support of his grandfather, who was a retired public servant. His grandfather paid for his education at a local school, which suggests that his family had some access to resources and were not in the subsistence class.","""Pierre-Jean de Béranger"" by Robert T. Denomme, published in the Encyclopedia Britannica; ""Béranger, Pierre Jean de"" in the New International Encyclopedia (1905)."
144,Q310309,Bernard Le Bovier de Fontenelle,Q310309,1657,France,Middle Class,"Bernard Le Bovier de Fontenelle was born into a family of lawyers in Rouen, France. His father, François Le Bovier de Fontenelle, was a lawyer in the Parlement of Normandy, a regional court. His mother, Marthe Le Bovier de Fontenelle, was also from a family of lawyers. This suggests that Fontenelle was born into a family of some means and social standing, but not of the elite nobility. The family's legal profession would have provided them with a comfortable living and a degree of social prestige, but they were not part of the ruling class. Fontenelle's access to education would have been due to his family's middle-class status and not because of any inherited privileges. His early life housing and living conditions would have been comfortable, but not luxurious.","1. ""Fontenelle, Bernard Le Bovier De."" Complete Dictionary of Scientific Biography, vol. 5, Charles Scribner's Sons, 2008, pp. 166-170.
2. ""Bernard Le Bovier, sieur de Fontenelle."" Encyclopædia Britannica, https://www.britannica.com/biography/Bernard-Le-Bovier-sieur-de-Fontenelle."
145,Q366285,Auguste Villiers de l'Isle-Adam,Q366285,1838,France,Elite,"Auguste Villiers de l'Isle-Adam was born into an aristocratic family, the Villiers de l'Isle-Adam family, which had a long and distinguished lineage in France. His father, Théodore de Villiers de l'Isle-Adam, was a knight and a decorated officer in the French army. His mother, Marie-Françoise de Villiers de l'Isle-Adam, was also from a noble family. Despite their noble lineage, the family's financial situation was precarious due to the political and economic changes in France during this period. However, their social standing and access to education would have been significantly above average, even if their financial resources were not. Auguste was educated at home by private tutors, a privilege typically reserved for the elite class. His early life housing and living conditions would have been comfortable, reflecting his family's aristocratic status.","""Auguste Villiers de l'Isle-Adam: A Symbolist Drama"" by Robert Louis Sanderson; ""Villiers de l'Isle-Adam"" by A. W. Raitt."
146,Q42596,Frédéric Mistral,Q42596,1830,France,Middle Class,"Frédéric Mistral was born on September 8, 1830, in Maillane, a small village in the region of Provence, France. His family was part of the local bourgeoisie, owning a farm and vineyards. His father, François Mistral, was a well-to-do farmer, and his mother, Adelaide Poulinet, came from a family of wealthy merchants. This indicates that they were not part of the elite class, but they were also not subsistence class, as they had a certain level of wealth and property. 

Mistral's family wealth allowed him to receive a good education. He was initially educated at home by his mother and a parish priest, and later attended schools in Maillane and Avignon. This access to education was a privilege that was not common among the lower classes in France at the time, further supporting his classification as middle class.

In terms of housing and living conditions, Mistral's family owned a large farmhouse, indicating a comfortable standard of living. There is no evidence of any inherited privileges or disadvantages, but his family's wealth and social standing would have provided him with certain advantages in life.","1. ""Frédéric Mistral."" Encyclopædia Britannica. https://www.britannica.com/biography/Frederic-Mistral
2. ""Frédéric Mistral - Biographical"". NobelPrize.org. https://"
147,Q157672,Daniel François Esprit Auber,Q157672,1782,France,Middle Class,"Daniel François Esprit Auber was born in Caen, France, in 1782. His father was a print-seller, which was a skilled trade that would have placed the family in the middle class. Auber's father was also known to have artistic interests, suggesting that the family had enough wealth to afford leisure activities. Auber was given a good education, which further suggests a middle-class background, as education was often a privilege of the wealthier classes in late 18th-century France. There is no evidence to suggest that Auber was born into the elite or subsistence classes.","""Auber, Daniel François Esprit"" by Elizabeth Forbes in 'The New Grove Dictionary of Opera', and ""Daniel François Esprit Auber: The Man and His Music"" by Robert Letellier."
148,Q326215,Abraham Bosse,Q326215,1604,France,Middle Class,"Abraham Bosse was born in Tours, France, around 1604. His father, Louis Bosse, was a tailor, and his mother, Marie Cottreau, was the daughter of a master tailor. This suggests that Bosse was born into a family of skilled craftspeople, which would place them in the middle class according to the provided typology. The tailoring profession was a respectable trade during this period, providing a stable income and a comfortable living. However, there is no evidence to suggest that Bosse's family was particularly wealthy or had access to significant resources. Bosse's access to education was likely due to his family's middle-class status. He was apprenticed to the engraver Melchior Tavernier around 1620, which suggests that his family had the means to secure this apprenticeship for him.","""Abraham Bosse, graveur et savant."" by Blum, Andre (1924); ""Abraham Bosse et la gravure de genre au XVIIe siècle"" by Préaud, Maxime (1986)."
149,Q310791,Jules Michelet,Q310791,1798,France,Middle Class,"Jules Michelet was born in Paris, France, in 1798. His father was a printer, which was a skilled trade and a profession that would place the family in the middle class. Michelet's mother, who was the daughter of a master wigmaker, also came from a middle-class background. The family was not wealthy, but they were not impoverished either. Michelet's father's profession allowed him access to a wide range of books, which likely influenced Michelet's early education. However, the family's economic situation worsened after the French Revolution, which negatively impacted the printing industry. Despite these hardships, Michelet was able to attend the Lycee Napoleon (now Lycee Henri-IV), suggesting that the family still had enough resources to provide him with a good education.","""Jules Michelet, A Study of Mind and Sensibility"" by Robert J. Niess; ""Jules Michelet: Nature, History, and Language"" by Lionel Gossman."
150,Q49898,Hyacinthe Rigaud,Q49898,1659,France,Middle Class,"Hyacinthe Rigaud was born in Perpignan, in the Kingdom of France, around 1659. His father, Andreu Rigau, was a tailor and his mother, Maria Serra, was a daughter of a shoemaker. This suggests that Rigaud's family was part of the middle class, as both tailoring and shoemaking were skilled crafts at the time. It is also known that Rigaud received an education, as he was sent to study in Montpellier before moving to Lyon and finally to Paris. This access to education, while not necessarily indicative of great wealth, suggests that his family had enough resources to invest in his schooling. However, there is no evidence to suggest that Rigaud's family was particularly wealthy or that they were part of the ruling class or nobility. Therefore, it is most likely that Rigaud was born into a middle-class family.","""Hyacinthe Rigaud (1659–1743)"" by Katharine Baetjer, Department of European Paintings, The Metropolitan Museum of Art; ""Hyacinthe Rigaud, 1659-1743"" by Mary Sheriff, The Art Bulletin, Vol. 78, No. 2 (Jun., 1996), pp. 336-340."
151,Q203828,Gustave Moreau,Q203828,1826,France,Middle Class,"Gustave Moreau was born in Paris, France in 1826 to a well-off middle-class family. His father, Louis Jean Marie Moreau, was an architect for the city of Paris, which was a respected profession during this time. His mother, née Adele Pauline Desmoutier, came from a family of musicians. The family's wealth and status allowed Moreau to receive a good education. He attended the Lycée Louis-le-Grand, a prestigious secondary school in Paris, which indicates that his family had the means to afford a quality education. The family lived in a comfortable home in Paris, suggesting they were not struggling financially. However, there's no evidence to suggest that they were part of the elite or aristocracy, nor that they had any significant inherited privileges or disadvantages.","""Gustave Moreau: His Life and Works"" by F. C. Roberson, ""Gustave Moreau: Between Epic and Dream"" by Geneviève Lacambre."
152,Q723585,Ludovic Halévy,Q723585,1834,France,Middle Class,"Ludovic Halévy was born into a family with a strong artistic and intellectual background. His father, Léon Halévy, was a civil servant, art critic, and author, while his uncle, Fromental Halévy, was a well-known composer. This suggests that the family was part of the educated bourgeoisie, a group that typically falls within the middle class. The Halévy family was Jewish, and while they were not impoverished, they also were not part of the aristocracy or ruling class. Ludovic's access to education was likely due to his family's emphasis on intellectual pursuits rather than inherited wealth or status. His early life housing and living conditions, while not documented in detail, would have been consistent with those of the middle class in France during the 19th century.","""Ludovic Halévy."" Encyclopædia Britannica, https://www.britannica.com/biography/Ludovic-Halevy. ""Fromental Halévy."" Encyclopædia Britannica, https://www.britannica.com/biography/Fromental-Halevy."
153,Q163543,François Gérard,Q163543,1770,France,Middle Class,"François Gérard was born on May 4, 1770, in Rome to a French father and an Italian mother. His father, Jean-Baptiste Gérard, was a clerk in the French embassy in Rome, a position that would place the family within the middle class. The family was not of noble birth or extreme wealth, but they were not impoverished either. Gérard's access to education was likely due to his father's position. He was initially educated in Rome and later in Paris, indicating that his family had the means to provide him with a good education. However, this was not a privilege inherited from a noble or wealthy background, but rather a result of his father's occupation. His early life housing and living conditions would have been decent, given his father's employment, but not luxurious or indicative of an elite status.","""François Gérard: French Painter."" Encyclopædia Britannica. https://www.britannica.com/biography/Francois-Gerard-French-painter."
154,Q260,Jean-François Champollion,Q260,1790,France,Middle Class,"Jean-François Champollion was born on December 23, 1790, in Figeac, France, to Jacques Champollion and Jeanne-Françoise Gualieu. His father was a book trader, which would classify him as a merchant, a profession typically associated with the middle class during this period in France. His family was not wealthy, but they were not impoverished either. His father's occupation allowed him to have access to books and education from an early age, which was a privilege not commonly available to those in the subsistence class. However, it's important to note that his family's financial situation worsened when his father became ill, which led to Jean-François being sent to live with his brother in Grenoble. Despite this, his brother, who was a professor, ensured that Jean-François continued his education. Therefore, his early life housing and living conditions, as well as his access to education, suggest a middle-class upbringing.","""Champollion: Un scribe pour l'Égypte"" by Michel Dewachter; ""The Keys of Egypt: The Obsession to Decipher Egyptian Hieroglyphs"" by Lesley and Roy Adkins."
155,Q154353,François Arago,Q154353,1786,France,Middle Class,"François Arago was born on February 26, 1786, in Estagel, a small village in the Pyrenees in southern France. His father, François Bonaventure Arago, was a small landowner and the treasurer of the village. His mother, Marie Arago, was from a family of local notables. The Arago family was not wealthy, but they were respected in their community and had enough resources to provide their children with a basic education. François and his brothers attended the local school, and their father's position allowed them to have access to some educational opportunities that might not have been available to children from less privileged backgrounds. However, their living conditions were modest, and they did not have the luxuries that would have been available to children from the elite class.","- ""Arago, François."" Complete Dictionary of Scientific Biography. Vol. 1. Detroit: Charles Scribner's Sons, 2008. 172-175. Gale Virtual Reference Library.
- James, Ioan. Remarkable Physicists: From Galileo to Yukawa. Cambridge, U.K: Cambridge University Press, 2004."
156,Q378129,Félicien Rops,Q378129,1833,France,Middle Class,"Félicien Rops was born in Namur, in what is now Belgium, not France, on July 7, 1833. His father, Nicholas Rops, was a textile manufacturer, which suggests a middle-class background. The textile industry was a significant part of the industrial revolution, and those involved in it were typically considered middle class. His mother, Sophie Maubile, was the daughter of a bourgeois family, further supporting the middle-class classification. Rops was educated at the University of Brussels, indicating that his family had the means to provide him with a good education, a privilege often associated with the middle class. His family's wealth and social standing would have provided him with a comfortable early life and living conditions. However, there is no evidence of any inherited privileges or disadvantages.","""Félicien Rops."" Encyclopædia Britannica. https://www.britannica.com/biography/Felicien-Rops; ""Félicien Rops."" Musée Félicien Rops. http://www.museerops.be/en/rops/biographie."
157,Q188857,Nicolas Boileau-Despréaux,Q188857,1636,France,Middle Class,"Nicolas Boileau-Despréaux was born into a family of the bourgeoisie, the French middle class. His father, Gilles Boileau, was a government official, serving as a clerk in the Grand Châtelet, a court in Paris. This position would have provided the family with a stable income and a comfortable lifestyle, but they were not part of the nobility or ruling class. Nicolas was one of fifteen children, indicating that the family had enough resources to support a large family. His access to education was also a result of his family's social standing. He studied at the Collège de Beauvais, a well-regarded institution in Paris, and later studied law, a typical path for children of the bourgeoisie. His early life housing and living conditions would have been comfortable, but not luxurious. He did not have any inherited privileges or disadvantages, as his family was not part of the nobility or the lower classes.","""Nicolas Boileau."" Encyclopædia Britannica, https://www.britannica.com/biography/Nicolas-Boileau. ""Boileau-Despréaux, Nicolas."" The New Encyclopædia Britannica, 15th Edition."
158,Q131405,Louis Daguerre,Q131405,1787,France,Middle Class,"Louis Daguerre was born on November 18, 1787, in Cormeilles-en-Parisis, France. His father, Louis Jacques Daguerre, was a minor public servant, working as a clerk for the local police commissioner. His mother, Anne Antoinette Hauterre, came from a family of merchants. This suggests that the Daguerre family was part of the middle class, as they were neither part of the aristocracy nor were they laborers or peasants. The family's middle-class status is further supported by the fact that Daguerre was able to receive an education, attending a local school in his early years. His family's financial situation would have allowed him to have a comfortable upbringing, with access to basic amenities and a stable home environment. However, there is no evidence to suggest that Daguerre was born into wealth or privilege.","""Louis Daguerre (1787–1851) and the Invention of Photography."" Department of Photographs, The Metropolitan Museum of Art, New York. ""Louis Daguerre."" Encyclopædia Britannica."
159,Q1074290,Paul Gavarni,Q1074290,1804,France,Middle Class,"Paul Gavarni, whose real name was Sulpice Guillaume Chevalier, was born in Paris, France, in 1804. His father was a civil servant, a position that would have placed the family in the middle class during this period in France. There is no evidence to suggest that the family was particularly wealthy or impoverished, which further supports the classification of middle class. Gavarni's father was able to provide him with an education, as he attended a local school in his youth. This access to education, while not exclusive to the middle class, was more common among this social group than among the subsistence class. The family's living conditions are not well-documented, but given the father's occupation, it is likely that they lived in a modest home in the city.","""Paul Gavarni (Sulpice Guillaume Chevalier)"" by Michael Bryan, in Bryan's Dictionary of Painters and Engravers (A–K). I (3rd ed.). London: George Bell & Sons, 1886."
160,Q353746,Eugène Fromentin,Q353746,1820,France,Middle Class,"Eugène Fromentin was born on October 24, 1820, in La Rochelle, France. His father, Pierre-Jacques Fromentin, was a notable physician in the town, which suggests a middle-class background. The profession of a physician during this time period was typically associated with the middle class, as it required a certain level of education and provided a stable income, but did not grant the same level of prestige or wealth as the aristocracy. There is no evidence to suggest that the Fromentin family was particularly wealthy or impoverished, so it is reasonable to assume they lived comfortably within their means. As the son of a physician, Eugène likely had access to education due to his family background. However, there is no specific information available about his early life housing and living conditions, or any inherited privileges or disadvantages.","""Eugène Fromentin: A Life in Art and Letters"" by Ruth Jordan (2000), ""Fromentin: Painter and Writer"" by Michael Marlais (1987)."
161,Q18425,Marcellin Berthelot,Q18425,1827,France,Middle Class,"Marcellin Berthelot was born in Paris, France on October 25, 1827. His father, Jacques Martin Berthelot, was a doctor who served in the French army during the Napoleonic Wars. His mother, Jéronime Pauline Tardy, came from a family of civil servants. This suggests that Berthelot was born into a middle-class family, as his parents held professions that were typical of this social class during the 19th century in France. The family's access to education was also indicative of their middle-class status. Berthelot was educated at the Collège Henri IV, a prestigious secondary school in Paris, which suggests that his family had the means to provide him with a good education. However, there is no evidence to suggest that the Berthelot family was particularly wealthy or that they lived in luxurious conditions. Therefore, it can be concluded that Berthelot's birth and childhood social class was middle class.","""Marcellin Berthelot (1827–1907): French Chemist and Politician"" by Maurice Crosland, published in the Oxford Dictionary of National Biography; ""Marcellin Berthelot: A Synthetic Life"" by Alan J. Rocke, published in the journal Isis."
162,Q216873,Pierre Puvis de Chavannes,Q216873,1824,France,Middle Class,"Pierre Puvis de Chavannes was born into a middle-class family in Lyon, France. His father, Pierre-Claude Puvis, was a mining engineer and a senior civil servant in the French government, which suggests a comfortable, middle-class lifestyle. His mother, Marie-Julie-Césarie Binet, was the daughter of a French officer. The family's wealth and social standing would have provided Pierre with access to education and a comfortable early life housing and living conditions. However, there is no evidence to suggest that Pierre was born into the elite ruling class or nobility, nor that he was born into a subsistence-level family. His family background and circumstances suggest a middle-class upbringing.","""Pierre Puvis de Chavannes: A Collection of 91 Paintings (HD Download)"" by Daniel Ankele, Denise Ankele; ""Pierre Puvis de Chavannes"" by Aimée Brown Price, Jon Whiteley, Geneviève Lacambre."
163,Q314814,Philippe de Champaigne,Q314814,1602,France,Middle Class,"Philippe de Champaigne was born in Brussels, which was then part of the Spanish Netherlands, around 1602. His father, Jean de Champaigne, was a cloth merchant, a profession that would typically place the family in the middle class. There is no record of significant wealth or noble status in his family at the time of his birth. The fact that Philippe was able to study in Brussels under the landscape painter Jacques Fouquier suggests that his family had enough resources to provide him with an education, which was not a common opportunity for those in the subsistence class. However, there is no evidence of inherited privileges or aristocratic connections in his early life.","""Philippe de Champaigne (1602–1674): The Unknown Portrait"", by Pierre Rosenberg, published in The Burlington Magazine (1995); ""Philippe de Champaigne"", by Jacques Thuillier, published by Flammarion (1995)."
164,Q50186,François Couperin,Q50186,1668,France,Middle Class,"François Couperin was born into a family of musicians. His father, Charles Couperin, was the organist at Church Saint-Gervais in Paris, a position of some prestige within the musical community. His mother, Marie Guérin, was also from a family of musicians. This suggests that the Couperin family was part of the middle class, as they were skilled craftspeople in the field of music. The family's position would have provided François with access to education in music from a young age, which was a privilege not available to all children in this period. However, there is no evidence to suggest that the Couperin family was part of the elite or subsistence classes. They were not nobility, nor were they laborers or peasants.","1. ""François Couperin."" Grove Music Online. Oxford Music Online. Oxford University Press. 
2. Mellers, Wilfrid. ""François Couperin and the French Classical Tradition."" Faber & Faber, 1950.
3. Beausant, Philippe. ""François Couperin."" Fayard, 1980."
165,Q317920,Simon Vouet,Q317920,1590,France,Middle Class,"Simon Vouet was born into a family of artisans, which places him in the middle class according to the provided typology. His father, Laurent Vouet, was a painter and his mother, Marie Boullier, was the daughter of a notary, both occupations that fall within the middle class category. There is no evidence to suggest that the family was particularly wealthy or impoverished, but their professions suggest a level of skill and education that would be consistent with a middle-class lifestyle. Simon Vouet himself was educated in the arts from a young age, presumably due to his family's background and connections in the field. The family lived in Paris, which was a center of culture and learning at the time, suggesting they had access to a certain level of resources and opportunities. However, there is no evidence to suggest that they were part of the elite ruling class or that they had any particular inherited privileges or disadvantages.","""Simon Vouet: His Life and Work"" by Jacques Thuillier, ""The Age of Louis XIII"" by John B. Wolf."
166,Q181707,Charles Fourier,Q181707,1772,France,Middle Class,"Charles Fourier was born on April 7, 1772, in Besançon, France. His father, Charles François Fourier, was a small businessman and a fabric merchant, which would place the family in the middle class according to the provided typology. His mother, Marie Fourier, came from a family of shopkeepers. The Fourier family was not wealthy, but they were not poor either. They were able to provide Charles with a good education, which was a privilege not accessible to the lower classes at the time. Charles was educated by the Benedictines and the Jesuits, indicating a certain level of family wealth and social standing. However, the family's financial situation deteriorated after the death of Charles' father in 1781, forcing Charles to seek employment at a young age. Despite this, his early life was marked by a middle-class upbringing.","""Charles Fourier: Sein Leben und seine Theorien"" by Charles Pellarin, ""Charles Fourier: The Visionary and His World"" by Jonathan Beecher."
