,individual_wikidata_id,individual_name,individual_wikidata_id,birth_year,country,classification,explanation,sources
0,Q535,Victor Hugo,Q535,1802,France,Middle Class,"Victor Hugo was born on February 26, 1802, in Besançon, France. His father, Joseph Léopold Sigisbert Hugo, was a high-ranking officer in Napoleon's army, which would place the family in the middle class. His mother, Sophie Trébuchet, came from a family of ship owners from Nantes, which also suggests a middle-class background. The family was not of noble lineage or extreme wealth, but they were not impoverished either. 

Victor Hugo's access to education was likely due to his family's middle-class status. His mother was known to be well-educated and is believed to have taught Victor and his siblings at home. Furthermore, Hugo's father's military career would have provided a level of financial stability and social standing that allowed for educational opportunities.

The family moved frequently due to Joseph Hugo's military assignments, suggesting that their housing and living conditions varied. However, there is no indication that they lived in extreme poverty or had access to the luxuries of the elite class.

In terms of inherited privileges or disadvantages, Hugo was born into a politically turbulent time in France, with his father supporting Napoleon and his mother a Royalist. This political divide in his family may have presented both opportunities and challenges, but it does not significantly alter his classification as middle class.","- ""Victor Hugo: A Biography"" by Graham Robb
- ""Victor Hugo"" by John Pringle"
1,Q9068,Voltaire,Q9068,1694,France,Middle Class,"Voltaire, born François-Marie Arouet, was born into a middle-class family in Paris, France. His father, François Arouet, was a notary in the Châtelet and a minor treasury official, who worked for the French government. His mother, Marie Marguerite Daumard, was from a family of lesser nobility. The Arouet family was well-off, but not part of the elite nobility. Voltaire's access to education was due to his family's resources, as he was educated by the Jesuits at the Collège Louis-le-Grand in Paris, a privilege that would have been inaccessible to those of lower social standing. His early life housing and living conditions would have been comfortable, reflecting his family's middle-class status. He did not inherit any titles or significant wealth, but his family's status and connections provided him with opportunities for education and advancement.","1. ""Voltaire: A Life"" by Ian Davidson
2. ""Voltaire in Love"" by Nancy Mitford
3. ""Voltaire's Bastards: The Dictatorship of Reason in the West"" by John Ralston Saul
4. ""Voltaire Almighty: A Life in Pursuit of Freedom"" by Roger Pearson."
2,Q33977,Jules Verne,Q33977,1828,France,Middle Class,"Jules Verne was born on February 8, 1828, in Nantes, France. His father, Pierre Verne, was a lawyer, and his mother, Sophie Allote de la Fuÿe, came from a family of shipowners. This indicates that his family was part of the professional middle class, as they were not nobility but had occupations that required education and skill. Verne's access to education was also indicative of his middle-class status. He was sent to boarding school in Nantes and later studied law in Paris, showing that his family had the resources to invest in his education. The family's living conditions also suggest a middle-class lifestyle. They lived in a comfortable house in Nantes and owned a country house in Chantenay, where Verne spent his summers. While Verne did not inherit a title or significant wealth, his family's professional status and resources would have provided him with certain advantages, such as access to education and a comfortable upbringing.","1. Butcher, William (2006). Jules Verne: The Definitive Biography. Thunder's Mouth Press.
2. Martin, Andrew (2007). The Mask of the Prophet: The Extraordinary Fictions of Jules Verne. Oxford University Press."
3,Q6527,Jean-Jacques Rousseau,Q6527,1712,France,Middle Class,"Jean-Jacques Rousseau was born in Geneva, Switzerland, in 1712 to Isaac Rousseau and Suzanne Bernard. His father, Isaac, was a watchmaker, a profession that would place the family in the middle class, as it required a certain level of skill and craftsmanship. His mother, Suzanne, was the daughter of a minister, which also suggests a middle-class background. However, Rousseau's mother died shortly after his birth, and his father eventually fled Geneva to avoid a legal dispute, leaving Rousseau to be raised by his uncle. Despite these hardships, Rousseau was able to receive an education, suggesting that his family had enough resources to ensure his schooling.","""Jean-Jacques Rousseau."" Encyclopædia Britannica. Encyclopædia Britannica, inc., February 2, 2022. ""Jean-Jacques Rousseau."" Stanford Encyclopedia of Philosophy. Stanford University, July 20, 2015."
4,Q9711,Honoré de Balzac,Q9711,1799,France,Middle Class,"Honoré de Balzac was born in Tours, France, in 1799 to Bernard-François Balzac and Anne-Charlotte-Laure Sallambier. His father was a civil servant, having worked as a secretary to the King's Council and later as the director of the Commissariat of the French military. His mother came from a family of Parisian haberdashers, a trade considered middle class. 

The Balzac family was not wealthy, but they were comfortable. They owned a home in Tours and later moved to a larger house in Paris. Honoré de Balzac was sent to a boarding school in Vendôme at the age of eight, indicating that the family had enough resources to afford a private education. 

However, the family's financial situation was not always stable. Bernard-François made some poor investments that strained the family's finances. Despite these financial difficulties, the family maintained their middle-class status through their professions and were able to provide their children with an education.","- Robb, G. (1994). Balzac: A Biography. New York: W. W. Norton & Company.
- Maurois, A. (1965). Prometheus: The Life of Balzac. New York: Harper & Row."
5,Q448,Denis Diderot,Q448,1713,France,Middle Class,"Denis Diderot was born on October 5, 1713, in Langres, Champagne, France. His father, Didier Diderot, was a well-respected master cutler (artisan who makes, sells, and repairs cutlery), which would place the family in the middle class according to the given typology. His mother, Angélique Vigneron, came from a family of tanners and brewers, also considered middle class occupations. The family was not wealthy but had enough resources to provide Denis with a good education. Diderot was sent to the Jesuit college in Langres at a young age, indicating that his family had the means to afford a decent education for their children. The family lived in a comfortable house in Langres, which suggests a middle-class living condition. There is no evidence of inherited privileges or disadvantages.","""Denis Diderot"" by P.N. Furbank (1992), ""Diderot: A Critical Biography"" by Arthur Wilson (1992), ""Denis Diderot, a Comprehensive Biography"" by Frank A. Kafker (1981)."
6,Q38337,Alexandre Dumas,Q38337,1802,France,Middle Class,"Alexandre Dumas was born on July 24, 1802, in Villers-Cotterêts, France. His father, Thomas-Alexandre Dumas, was a general in the French army and was of mixed race, being the son of a French nobleman and a slave woman of African descent. His mother, Marie-Louise Labouret, was the daughter of an innkeeper. 

At the time of Dumas' birth, his father was already deceased, leaving the family in a precarious financial situation. Despite this, the family was not destitute and Dumas' mother worked hard to provide for her children. Dumas was able to receive a good education due to his father's military service and his mother's efforts. 

While the family was not wealthy, they were not subsistence level either. Dumas' father's status as a general and his noble lineage would have afforded the family some social standing, despite their financial difficulties.","1. ""Alexandre Dumas."" Encyclopedia Britannica. https://www.britannica.com/biography/Alexandre-Dumas-fils
2. ""Alexandre Dumas."" Biography.com. https://www.biography.com/writer/alexandre-dumas
3. ""Alexandre Dumas."" New World Encyclopedia. http://www.newworldencyclopedia.org/entry/Alexandre_Dumas
4. ""The Black Count: Glory"
7,Q1268,Frédéric Chopin,Q1268,1810,France,Middle Class,"Frédéric Chopin was born in Żelazowa Wola, a village in the Duchy of Warsaw, not France. His father, Nicolas Chopin, was a Frenchman who had emigrated to Poland, where he worked as a tutor to aristocratic families and later as a teacher at the Warsaw Lyceum. His mother, Justyna Krzyżanowska, was of Polish nobility, but her family was not wealthy. The Chopin family was not poor, but they were not part of the ruling elite either. They were well-educated and had connections to the Polish aristocracy through Nicolas' work, which allowed Frédéric access to a good education and the opportunity to mix with the higher social classes. The family lived in a comfortable apartment within the Warsaw Lyceum's building, indicating a decent standard of living. However, they did not possess significant wealth or land, and their status was largely due to Nicolas' employment and personal connections rather than inherited privilege.","""Chopin: Pianist and Teacher: As Seen by his Pupils"" by Jean-Jacques Eigeldinger; ""Chopin in Paris: The Life and Times of the Romantic Composer"" by Tad Szulc."
8,Q504,Émile Zola,Q504,1840,France,Middle Class,"Émile Zola was born in Paris, France on April 2, 1840. His father, Francesco Zola, was an Italian engineer, working on the construction of a municipal water supply system, which suggests a middle-class occupation. His mother, Emilie Aubert, was a native of the Burgundy region of France. After the death of his father when Zola was just seven years old, the family faced financial difficulties, but they were not destitute. Zola's mother managed to secure a small pension, which allowed them to live modestly. Zola was able to attend school, first in Aix-en-Provence and then in Paris, indicating that his family had enough resources to provide him with an education. However, his family's financial struggles likely limited his access to higher education. His early life housing and living conditions were modest, reflecting their middle-class status. There were no significant inherited privileges or disadvantages.","""Émile Zola: A Life"" by Frederick Brown, ""Zola: A Life"" by Henri Mitterand."
9,Q30755,Auguste Rodin,Q30755,1840,France,Middle Class,"Auguste Rodin was born on November 12, 1840, in Paris, France. His father, Jean-Baptiste Rodin, was a police department clerk, and his mother, Marie Cheffer, was a seamstress. The family was of modest means and belonged to the working-class society of Paris. Rodin's parents were able to provide him with a basic education, as he attended the Petite École, a school specializing in art and mathematics. This suggests that while the family was not wealthy, they had enough resources to provide for their children's education. The family lived in the 5th arrondissement of Paris, which was not a particularly affluent area during that period. There is no evidence to suggest that Rodin had any inherited privileges or disadvantages.","""Auguste Rodin."" Encyclopædia Britannica. Encyclopædia Britannica, inc., February 26, 2021. ""Auguste Rodin."" The Art Story, www.theartstory.org/artist/rodin-auguste/life-and-legacy/."
10,Q501,Charles Baudelaire,Q501,1821,France,Middle Class,"Charles Baudelaire was born on April 9, 1821, in Paris, France. His father, François Baudelaire, was a senior civil servant and an amateur artist. This would place the family in the middle class, as François held a respectable position in society but was not part of the aristocracy. His mother, Caroline Archimbaut-Dufays, was twenty-seven years younger than his father and worked as a chambermaid before her marriage. 

After the death of his father in 1827, his mother married Major Jacques Aupick, who later became a French ambassador to various noble courts. This marriage could have potentially elevated the family's social status, but it occurred after Baudelaire's birth and is therefore not considered in this classification. 

Baudelaire's access to education was a result of his family's middle-class status. He was educated in Lyon, where he was noted for his distinguished and scholarly traits. He later attended the Lycée Louis-le-Grand in Paris, a prestigious secondary school that was typically attended by middle and upper-class students.","1. ""Charles Baudelaire."" Encyclopædia Britannica. https://www.britannica.com/biography/Charles-Baudelaire
2. Richardson, Joanna. ""Baudelaire."" St. Martin's Press, New York, 1994.
3. Pichois"
11,Q6682,Gustave Doré,Q6682,1832,France,Middle Class,"Gustave Doré was born in Strasbourg, France, on January 6, 1832. His father, Pierre Louis Christophe Doré, was an engineer who worked for the French government, a profession that would have placed the family in the middle class. His mother's name was Alexandrine Marie Anne Pluchart. The family was not wealthy, but they were not poor either. They had enough resources to provide Gustave with a good education, which he received at the Lycee Louis-le-Grand in Paris. This suggests that the family had some level of financial stability and social standing. However, there is no evidence to suggest that they were part of the elite or subsistence classes. The family lived in a comfortable home in Strasbourg, which further supports their middle-class status.","- Delacroix, D. (2007). Gustave Doré, le rêveur éveillé. Paris: Éditions de la Martinière.
- Renonciat, A. (1983). La vie et l'œuvre de Gustave Doré. Paris: ACR Édition."
12,Q3816,George Sand,Q3816,1804,France,Elite,"George Sand, born Amantine Lucile Aurore Dupin, was born into the French aristocracy. Her father, Maurice Dupin, was a soldier and a grandson of the Marshal General of France, Maurice, Comte de Saxe. Her mother, Sophie-Victoire Delaborde, was a commoner, but the family's social standing was primarily determined by the father's lineage. The Dupin family was wealthy and owned a large estate in Nohant, in the French province of Berry, where Sand spent much of her childhood. Her access to education was also indicative of her elite status. After her father's death, she was raised by her paternal grandmother, Marie-Aurore de Saxe, who ensured she received a good education, including lessons from the esteemed tutor Deschartres. Her early life housing and living conditions were comfortable, reflecting her family's wealth and status.","""George Sand: A Brave Man, The Most Womanly Woman"" by Bertha Thomas, ""George Sand: A Woman's Life Writ Large"" by Belinda Jack, ""George Sand: A Biography"" by Curtis Cate."
13,Q44403,Heinrich Heine,Q44403,1797,France,Middle Class,"Heinrich Heine was born in Düsseldorf, which was under French rule at the time of his birth. His father, Samson Heine, was a textile merchant, which places the family in the middle class according to the given typology. His mother, Betty, was the daughter of a physician, which also suggests a middle-class background. The family was not wealthy, but they were not impoverished either. Heine's parents were able to provide him with a basic education, and he attended a Jewish school and later a business school in Düsseldorf. However, the family's financial situation deteriorated due to the father's failing business, which might have affected Heine's access to education and living conditions in his later childhood. But considering the family's initial standing and occupation, the classification would be middle class.","1. Heinrich Heine: A Modern Biography by Jeffrey L. Sammons
2. Heinrich Heine: His Life and Works by Francis Storr
3. The Poetry of Heinrich Heine by Edgar Alfred Bowring."
14,Q42831,Ivan Turgenev,Q42831,1818,France,Elite,"Ivan Turgenev was born into a wealthy and noble family in Russia. His father, Sergei Nikolaevich Turgenev, was a colonel in the Russian cavalry, a member of the Russian nobility, and owned a substantial estate. His mother, Varvara Petrovna Lutovinova, was an heiress to a rich and noble family. Turgenev's parents were known for their wealth and high social standing. 

Turgenev's family owned several estates, including the Spasskoye-Lutovinovo estate where he was born. The family's wealth allowed Turgenev to receive a good education. He was educated by private tutors at home before attending boarding schools and later universities in Moscow, St. Petersburg, and Berlin.","1. ""Turgenev, Ivan Sergeyevich."" Encyclopædia Britannica. https://www.britannica.com/biography/Ivan-Sergeyevich-Turgenev
2. ""Ivan Turgene"
15,Q687,Molière,Q687,1622,France,Middle Class,"Molière, whose real name was Jean-Baptiste Poquelin, was born in Paris in 1622. His father, Jean Poquelin, was a successful upholsterer who held the official title of ""valet de chambre tapissier du roi"" or ""upholsterer of the king's chamber"". This position was a royal appointment, indicating a certain level of prestige and wealth, but it was not a title of nobility. His mother, Marie Cressé, came from a bourgeois family. Molière's family was therefore part of the bourgeoisie, or middle class, which included merchants, artisans, and other professionals. 

Molière's family had enough wealth to provide him with a good education. He attended the prestigious Collège de Clermont, a Jesuit school in Paris, which suggests that his family had the means to afford a quality education. 

In terms of housing and living conditions, Molière would have grown up in a comfortable urban environment, typical of the bourgeoisie of the time. His father's position would have also provided some privileges, such as access to the royal court, but these were not inherited titles or lands as would be the case with the nobility.","1. Scott, Virginia. ""Molière: A Theatrical Life."" Cambridge University Press, 2000.
2. Gaines, James F. ""The Molière Encyclopedia."" Greenwood Publishing"
16,Q43444,Gustave Flaubert,Q43444,1821,France,Middle Class,"Gustave Flaubert was born on December 12, 1821, in Rouen, France. His father, Achille-Cléophas Flaubert, was a well-respected surgeon and the chief physician at the Rouen municipal hospital. His mother, Anne Justine Caroline Fleuriot, was the daughter of a physician. This suggests that the family had a comfortable middle-class lifestyle. Flaubert's father's occupation as a surgeon would have provided a stable income and a certain level of social standing within the community. 

Flaubert's family lived in a house within the hospital compound, indicating a comfortable living situation. His access to education was also a result of his family's middle-class status. He was educated at home by private tutors and later attended the prestigious Lycée Pierre Corneille in Rouen, which would have been beyond the means of a subsistence-level family.","1. ""Gustave Flaubert."" Encyclopædia Britannica. https://www.britannica.com/biography/Gustave-Flaubert
2. ""Gustave Flaubert: A Life,"" by Frederick Brown."
17,Q9726,Gioacchino Rossini,Q9726,1792,France,Middle Class,"Gioacchino Rossini was born in Pesaro, a town in Italy, not France, on February 29, 1792. His father, Giuseppe Rossini, was a trumpeter and inspector of slaughterhouses, while his mother, Anna Guidarini, was a singer and the daughter of a baker. This suggests that Rossini's family was not part of the elite or subsistence classes, but rather the middle class. They were skilled workers who had regular employment, but they were not wealthy or part of the nobility. Rossini's parents were both involved in music, which likely influenced his early exposure to the field. However, their occupations were not high-status or high-income, suggesting a middle-class background. Rossini's access to education was likely due to his family's moderate means and their involvement in music, rather than any inherited privilege.","""Gioachino Rossini: Italian Composer"" by Alexander Weatherson, Grove Music Online; ""Rossini: His Life and Works"" by Richard Osborne."
18,Q5432,Francisco de Goya,Q5432,1746,France,Middle Class,"Francisco de Goya was born in Fuendetodos, Aragon, Spain, not France, around 1746. His father, José Benito de Goya y Franque, was a master gilder by profession, which was a skilled craft occupation, indicating a middle-class status. His mother, Gracia de Lucientes y Salvador, came from a family of minor gentry, which also suggests a middle-class background. The family lived in a house that was owned by his mother's family, indicating a certain level of wealth and property ownership. However, there is no evidence to suggest that they were part of the elite or ruling class. Goya's access to education was also typical of the middle class. He studied under local artist José Luzán as a teenager, indicating that his family had the resources to provide him with an education, but not necessarily the elite education that would have been available to the upper classes.","""Goya: A Life in Letters"" by Francisco de Goya, Sarah Symmons; ""Goya"" by Robert Hughes; ""Goya: His Life & Works in 500 Images"" by Susie Hodge."
19,Q1151,Hector Berlioz,Q1151,1803,France,Middle Class,"Hector Berlioz was born on December 11, 1803, in La Côte-Saint-André, a small town in the French Alps. His father, Louis-Joseph Berlioz, was a respected local physician, which would place the family in the middle class according to the typology provided. His mother, Marie-Antoinette, was a devout Catholic, and her influence on young Hector was significant. The family was not wealthy, but they were comfortable and had access to education. Berlioz's father taught him Latin, Greek, and natural sciences. The family lived in a house that Louis-Joseph had built, indicating a certain level of financial stability. However, there is no evidence of inherited privileges or significant disadvantages.","""Berlioz: Scenes from the Life and Work"" by Jacques Barzun, ""Berlioz: Volume One: The Making of an Artist, 1803-1832"" by David Cairns."
20,Q160333,Prosper Mérimée,Q160333,1803,France,Middle Class,"Prosper Mérimée was born on September 28, 1803, in Paris, France. His father, Léonor Mérimée, was an artist and a professor of painting and drawing at the École Polytechnique, a prestigious French institution. His mother, Anne Moreau, was the daughter of a Parisian bourgeois family. The family was not part of the aristocracy, but they were not subsistence-level either. They were part of the educated, professional middle class. Mérimée's parents' occupations and social standing, as well as his access to education because of his family background, suggest that he was born into the middle class. His early life housing and living conditions are not well-documented, but given his parents' professions, it is likely that they were comfortable. There is no evidence of any inherited privileges or disadvantages.","""Prosper Mérimée: A Biographical and Critical Study"" by A. W. Raitt, ""Prosper Mérimée"" by Pierre Josserand."
21,Q1290,Blaise Pascal,Q1290,1623,France,Middle Class,"Blaise Pascal was born into a middle-class family in Clermont-Ferrand, France, in 1623. His father, Étienne Pascal, was a local magistrate and tax collector for the Crown, which would place the family within the middle class according to the provided typology. Étienne Pascal was also known to have an interest in science and mathematics, which he passed on to his son, indicating that the family had access to education and intellectual pursuits. The family's wealth and social standing allowed them to move to Paris in 1631, where Blaise Pascal would have access to more educational opportunities. However, there is no evidence to suggest that the Pascal family was part of the elite ruling class or nobility.","1. ""Blaise Pascal."" Encyclopædia Britannica. https://www.britannica.com/biography/Blaise-Pascal
2. ""Blaise Pascal."" Stanford Encyclopedia of Philosophy. https://plato.stanford.edu/entries/pascal/"
22,Q33477,Eugène Delacroix,Q33477,1798,France,Elite,"Eugène Delacroix was born into an elite family in Charenton-Saint-Maurice, Île-de-France, near Paris. His father, Charles-François Delacroix, was a French statesman who held various high-ranking positions in the government, including Minister of Foreign Affairs and ambassador to the Netherlands. His mother, Victoire Oeben, came from a prosperous family of furniture craftsmen. Delacroix's father was already quite old when he was born, leading to speculation that his biological father may have been the statesman Talleyrand, a friend of the family. Regardless of the truth of this rumor, the fact that it exists at all indicates the high social circles in which his family moved. Delacroix's family would have had the wealth to provide him with a good education and comfortable living conditions. His early life would have been characterized by privilege and access to opportunities not available to those of lower social classes.","""Delacroix, Eugène."" Encyclopædia Britannica. Encyclopædia Britannica, Inc., 2020. Web. 10 Dec. 2020. ""Eugène Delacroix."" The Art Story. The Art Story Foundation, 2020. Web. 10 Dec. 2020."
