,individual_wikidata_id,individual_name,individual_wikidata_id,birth_year,country,classification,explanation,sources
213,Q433434,Anne-Louis Girodet de Roussy-Trioson,Q433434,1767,France,Middle Class,"Anne-Louis Girodet de Roussy-Trioson was born in Montargis, France, in 1767. His father was a lawyer, a profession that would have placed the family in the middle class during this period in France. His mother, Anne-Marie Girodet, was the daughter of a wealthy merchant, further solidifying their middle-class status. Girodet's father died when he was young, and he was adopted by Dr. Trioson, a close family friend. This adoption would have maintained his middle-class status, as doctors were also considered part of the middle class. Girodet's access to education, including his early training in art, was likely due to his family's social and economic standing. His family's wealth would have also ensured comfortable living conditions during his early life.","""Girodet-Trioson, Anne-Louis."" Grove Art Online. Oxford Art Online. Oxford University Press. Web. 10 Dec. 2021. <http://www.oxfordartonline.com/subscriber/article/grove/art/T032697>."
214,Q466987,Marceline Desbordes-Valmore,Q466987,1786,France,Middle Class,"Marceline Desbordes-Valmore was born in Douai, France, in 1786. Her father, Nicolas Desbordes, was a painter and decorator, which was a skilled trade and would have placed the family in the middle class. Her mother, Fanny Valmore, was a musician. The family was not wealthy, but they were not impoverished either. Marceline's parents were able to provide her with a good education, which was not common for girls at the time, suggesting that they had some means. However, the family's fortunes declined during the French Revolution, and they were forced to move to Guadeloupe. This suggests that while they had some resources, they were not part of the elite and their circumstances were precarious.","""Marceline Desbordes-Valmore: The Woman and the Work"" by Rosemary Lloyd, ""Marceline Desbordes-Valmore: A Bicentenary Appraisal"" by Germaine Brée."
215,Q311816,Gaston Maspero,Q311816,1846,France,Middle Class,"Gaston Maspero was born in Paris, France on June 23, 1846. His father, Jean-Baptiste Maspero, was a technical director at a local sugar factory, which indicates a skilled occupation and thus a middle-class standing. His mother, Sophie Massias, was a daughter of a tax collector, which also suggests a middle-class background. There is no evidence to suggest that the family was particularly wealthy or impoverished, but their occupations suggest a comfortable, middle-class lifestyle. Maspero's early access to education can also be attributed to his family's middle-class status. He studied at the Lycée Louis-le-Grand in Paris, a prestigious secondary school that was typically attended by middle and upper-class students. His family's financial stability likely played a role in his ability to attend this school. There is no evidence to suggest that Maspero was born into a family with significant inherited privileges or disadvantages.","""Gaston Maspero, 1846–1916: The Gentle Servant of Egyptology"" by William Kelly Simpson, ""The Great Egyptologists"" by Raymond O. Faulkner, ""A History of Egyptology"" by Jason Thompson."
216,Q462597,Numa Denis Fustel de Coulanges,Q462597,1830,France,Middle Class,"Numa Denis Fustel de Coulanges was born in Paris on March 18, 1830. His father, Denis Fustel, was a civil servant, which would have placed the family in the middle class of French society at the time. His mother, Marie-Louise-Caroline Petit, came from a family of merchants, further supporting the middle-class classification. The family's financial situation would have been stable but not extravagant, typical of the middle class. Fustel de Coulanges' access to education was likely due to his family's middle-class status, as his father's position would have allowed for this. His early life housing and living conditions would have been comfortable but not luxurious, again typical of the middle class. There is no evidence of any inherited privileges or disadvantages.","""Fustel de Coulanges, Numa Denis"" in The New Encyclopaedia Britannica, 15th edition, 1998."
217,Q18420,Joachim du Bellay,Q18420,1522,France,Elite,"Joachim du Bellay was born into a noble family in the Anjou region of France. His parents were René du Bellay and Marie du Bellay, both members of the French nobility. His father was a lord, indicating a high social standing and wealth. The family's wealth and status would have provided du Bellay with access to education, which was typically reserved for the elite during this time period. His early life housing and living conditions would have been comfortable and luxurious, reflecting his family's status. As a member of the nobility, du Bellay would have inherited certain privileges, such as the right to own land and participate in governance.","""Joachim du Bellay."" Encyclopædia Britannica. https://www.britannica.com/biography/Joachim-du-Bellay; ""Joachim du Bellay."" Poetry Foundation. https://www.poetryfoundation.org/poets/joachim-du-bellay."
218,Q362003,Giovanni Boldini,Q362003,1842,France,Middle Class,"Giovanni Boldini was born on December 31, 1842, in Ferrara, Italy, not France. His father, Antonio Boldini, was a painter of religious subjects and an esteemed restorer of frescoes, indicating a skilled craft occupation. This would place the family within the middle class according to the given typology. There is no evidence to suggest that the family was particularly wealthy or impoverished, but their ability to support Antonio's artistic career suggests a degree of financial stability. Giovanni's access to education was likely influenced by his father's profession, as Antonio provided his son with his first art lessons. The family's living conditions are not well-documented, but it can be inferred from Antonio's occupation that they lived in a reasonably comfortable, urban setting. There is no record of any inherited privileges or disadvantages.","""Giovanni Boldini."" Encyclopædia Britannica. https://www.britannica.com/biography/Giovanni-Boldini"
219,Q20710,Jean-Martin Charcot,Q20710,1825,France,Middle Class,"Jean-Martin Charcot was born on November 29, 1825, in Paris, France. His father, Simon Charcot, was a carriage maker, which was a skilled craft occupation. This would place the family in the middle class according to the given typology. His mother, Marie-Françoise Charcot, was a seamstress. The family lived in a modest house in the Saint-Antoine district of Paris, which was known for its artisan and merchant population. There is no evidence to suggest that the Charcot family had significant wealth or that Jean-Martin Charcot had access to education due to family wealth. However, his father's occupation as a carriage maker would have provided a stable income for the family and likely allowed for a basic education.","Goetz, Christopher G. ""Jean-Martin Charcot and the Demarcation of Early Neurology."" The Neuroscientist, vol. 1, no. 2, 1995, pp. 134-141."
220,Q424348,Paul-Albert Besnard,Q424348,1849,France,Middle Class,"Paul-Albert Besnard was born into a middle-class family in Paris, France, on June 2, 1849. His father, a senior civil servant, and his mother, a musician, were both educated and had stable professions, which was typical of the middle class during this period. Besnard's family had enough wealth to provide him with a comfortable upbringing and access to education. He attended the École des Beaux-Arts in Paris, a prestigious art school, which suggests that his family had the financial means to support his education. His early life housing and living conditions would have been typical of the middle class in Paris during the late 19th century, which would have included a comfortable home in a decent neighborhood. There is no evidence to suggest that Besnard inherited any significant privileges or disadvantages due to his family background.","""Paul-Albert Besnard (1849–1934): Painter of Light."" The Metropolitan Museum of Art Bulletin, New Series, Vol. 43, No. 3 (Winter, 1985–1986), pp. 1+4-56. Published by The Metropolitan Museum of Art."
221,Q20882,Gustave Eiffel,Q20882,1832,France,Middle Class,"Gustave Eiffel was born in Dijon, France, in 1832 to a middle-class family. His mother, Catherine Melanie Moneuse, was from a family of successful merchants, and his father, Alexandre Bonickhausen dit Eiffel, was a soldier and later worked in administration. The family was not wealthy, but they were comfortable and had access to resources. Eiffel's mother took over her family's coal business after her husband's death, which provided a stable income for the family. Eiffel's early education was provided by his mother at home, and he later attended the local Lycee Royal in Dijon, indicating a level of financial stability and access to education typical of the middle class. His family's circumstances allowed him to pursue further education at the prestigious École Centrale des Arts et Manufactures in Paris.","""Gustave Eiffel."" Encyclopedia of World Biography, 2nd ed., vol. 5, Gale, 2004, pp. 369-371. Gale Virtual Reference Library. ""Eiffel, Gustave."" The Columbia Encyclopedia, Paul Lagasse, and Columbia University, Columbia University Press, 8th edition, 2018. Credo Reference."
222,Q311387,Anton Reicha,Q311387,1770,France,Middle Class,"Anton Reicha was born on 26 February 1770 in Prague, which was part of the Habsburg Monarchy (now the Czech Republic) and not France. His father, Simon Reicha, was a carriage-maker, a skilled craft occupation, which suggests a middle-class background. His mother, Theresia Keller, was the daughter of a local draper, another middle-class occupation. After the death of his parents when he was just 10 years old, Reicha was adopted by his uncle, Josef Reicha, a cellist and composer. This suggests that the family had some access to education and cultural resources, which is also indicative of a middle-class background. However, there is no evidence of significant family wealth or inherited privileges.","""Anton Reicha: A Biography and Thematic Catalog"" by Ron Drummond; ""The New Grove Dictionary of Music and Musicians"" edited by Stanley Sadie."
223,Q551740,Jean-Pierre Claris de Florian,Q551740,1755,France,Elite,"Jean-Pierre Claris de Florian was born into an aristocratic family. His father, Jean Claris, was a lawyer in the Parliament of Toulouse, a position that was typically held by members of the nobility. His mother, Jeanne Ursule de Florian, was also from a noble family. Florian was orphaned at a young age and was taken under the wing of his uncle and godfather, Voltaire, a well-known philosopher and writer of the French Enlightenment. This relationship would have provided Florian with access to education and intellectual circles, privileges typically reserved for the elite class. His early life housing and living conditions would have been comfortable, reflecting his family's wealth and status.","""Florian, Jean-Pierre Claris de (1755–1794)."" Encyclopedia of the Enlightenment (2004); ""Jean-Pierre Claris de Florian."" Encyclopædia Britannica (2021)."
224,Q109875,François Adrien Boieldieu,Q109875,1775,France,Middle Class,"François Adrien Boieldieu was born in Rouen, France, in 1775. His father, Charles Boieldieu, was a secretary to the Archbishop of Rouen, a position that would have placed the family in the middle class. This is further supported by the fact that François received a good education, including music lessons, which would have been more accessible to middle-class families. There is no evidence to suggest that the family was part of the nobility or that they were particularly wealthy. Similarly, there is no indication that they were living in poverty or were part of the subsistence class.","""François-Adrien Boieldieu"", Grove Music Online, Oxford University Press; ""François-Adrien Boieldieu"", Encyclopædia Britannica."
225,Q55037230,Stéphanie Félicité Ducrest de Saint-Aubin de Genlis,Q55037230,1746,France,Elite,"Stéphanie Félicité Ducrest de Saint-Aubin de Genlis was born into the French nobility, specifically the minor nobility, which places her in the elite class. Her father, Pierre César Ducrest, was a knight and the lord of Saint-Aubin, indicating a high social standing. Her mother, Marie Françoise de Pelleport, was also from a noble family. Despite being minor nobility, her family had enough wealth to provide her with a good education, which was not common for women in the 18th century. This education was likely provided by private tutors, another sign of their wealth and status. The family's noble status would have also granted them certain privileges, such as exemption from certain taxes and access to positions of power.","- ""Madame de Genlis: French Moralist and Educator."" Encyclopædia Britannica. https://www.britannica.com/biography/Madame-de-Genlis
- ""Madame de Genlis."" New World Encyclopedia. https://www.newworldencyclopedia.org/entry/Madame_de_Genlis
- ""Madame de Genlis."" The Editors of Encyclopaedia Britannica. https://www.britannica.com/biography/Madame-de-Genlis
- ""Stéphanie Félicité Ducrest de Saint-Aubin, comtes"
226,Q315003,Hector Malot,Q315003,1830,France,Middle Class,"Hector Malot was born on May 20, 1830, in La Bouille, Seine-Maritime, France. His father was a notary, a profession that typically belonged to the middle class in 19th century France. Notaries were responsible for preparing, drawing up, and keeping legal documents, which required a certain level of education and literacy. This suggests that Malot's family had access to some level of wealth and education, which would be consistent with a middle-class background. However, there is no evidence to suggest that his family was part of the elite or aristocracy. Similarly, there is no evidence to suggest that they were subsistence-level laborers or peasants. Therefore, based on his father's occupation, it is reasonable to classify Malot's birth and childhood social class as middle class.","""Hector Malot"", Encyclopædia Britannica, https://www.britannica.com/biography/Hector-Malot. ""Notaries in Nineteenth-Century France"", Journal of Social History, https://www.jstor.org/stable/3787411."
227,Q334950,Agrippa d'Aubigné,Q334950,1552,France,Elite,"Agrippa d'Aubigné was born into a noble family in Saint-Maury, near Pons, in the province of Saintonge. His father was Jean d'Aubigné, a Huguenot soldier. His mother was Anne de Cardilhac. His family was of noble lineage, tracing their ancestry back to the 10th century. His father's position as a soldier in the service of the French king would have afforded the family a certain level of prestige and wealth. Additionally, the fact that d'Aubigné was able to receive an education, studying Latin and Greek under the tutelage of a local pastor, suggests that his family had the means to provide for his education, a privilege not commonly afforded to those outside the elite class during this time period. His early life housing and living conditions would have been comfortable, befitting a family of their status.","""Agrippa d'Aubigné: Un homme, une œuvre, un siècle"" by Jean-Raymond Fanlo; ""Agrippa d'Aubigné and the Huguenot Wars"" by Mark Greengrass."
228,Q312630,Théodore de Banville,Q312630,1823,France,Middle Class,"Théodore de Banville was born on March 14, 1823, in Moulins, France, to Claude Théodore Faullain de Banville and Zélie Décembre. His father was a naval officer, which would suggest a middle-class background. The naval officer profession required a certain level of education and was considered a respectable occupation, but it was not part of the aristocracy or ruling class. There is no evidence to suggest that the family was particularly wealthy or impoverished, so it is reasonable to assume they were of average means for their social class. Théodore de Banville received a good education, which was more accessible to middle-class families at the time. His early life housing and living conditions are not well-documented, but given his father's profession, it is likely they were adequate but not luxurious. There is no evidence of inherited privileges or disadvantages.","""Théodore de Banville."" Encyclopædia Britannica. Encyclopædia Britannica, inc., n.d. Web. 10 Dec. 2021."
229,Q123062,Jacques Necker,Q123062,1732,France,Middle Class,"Jacques Necker was born in Geneva, Switzerland, in 1732 to a family of modest means. His father, Karl Friedrich Necker, was a professor of public law and later a civil servant, while his mother, Jeanne Gautier, came from a family of lawyers. Although not wealthy, the family was well-respected and had a comfortable lifestyle. Necker's access to education was due to his family's emphasis on learning and their ability to afford a basic education. His early life housing and living conditions would have been modest but comfortable, typical of a middle-class family in Geneva at the time. There is no evidence of any inherited privileges or disadvantages.","""Jacques Necker: Enlightenment, Revolution, and the French State"" by Robert D. Harris; ""The Life of Jacques Necker"" by Madame de Staël."
230,Q462666,Léon Bloy,Q462666,1846,France,Middle Class,"Léon Bloy was born on July 11, 1846, in Périgueux, France. His father, Jean-Baptiste Bloy, was a volunteer in the Napoleonic Wars and later worked as a railway official. His mother, Anne-Marie Carreau, was a devout Catholic. The family was not wealthy, but they were not living in poverty either. Bloy's father's occupation as a railway official would have provided a stable income, placing them in the middle class. Bloy was able to receive an education, attending a local school in Périgueux before moving on to study at a seminary in Bordeaux. This access to education further supports the classification of Bloy's family as middle class, as education during this time was often a privilege reserved for the middle and upper classes. Bloy's early life housing and living conditions would have been modest but comfortable, reflecting the family's middle-class status.","""Léon Bloy: Pilgrim of the Absolute"" by Raïssa Maritain; ""Léon Bloy"" by Jacques Maritain; ""Léon Bloy"" by Max Milner."
231,Q295548,André Chénier,Q295548,1762,France,Elite,"André Chénier was born into a family of the elite class in France. His father, Louis Chénier, was a Greek native who moved to France and became a successful merchant, which allowed him to ascend to the French bourgeoisie. His mother, Elisabeth Marie Thérèse de Lamoignon, was from a noble family, the Lamoignons, who held significant power in the French judiciary. This connection to the nobility through his mother would have provided André with certain inherited privileges. 

André's family wealth at the time of his birth and childhood was substantial due to his father's successful business and his mother's noble background. This wealth and social standing allowed André access to a high-quality education. He studied at the prestigious Collège de Navarre in Paris, a privilege typically reserved for the elite class.

His early life housing and living conditions would have been comfortable and luxurious, reflecting the family's elite status. The family lived in a grand house in the wealthy neighborhood of Saint-Paul in Paris.","1. ""André Chénier: His Life and Work 1762–1794"" by H. Ashton
2. ""André Chénier and the Greek Tradition"" by A. M. Wilson
3. ""André Chénier"" by M. Turnell
4. ""The French Revolution and the Birth of Modernity"" by Ferenc Fehér"
232,Q381248,James Tissot,Q381248,1836,France,Middle Class,"James Tissot was born Jacques Joseph Tissot in Nantes, France, in 1836. His father, Marcel Théodore Tissot, was a successful draper who had built a prosperous business. This would place the Tissot family in the middle class, as Marcel was a merchant. His mother, Marie Durand, came from a more traditional background, being from a family of Catholic Breton. The Tissot family was devoutly Catholic, which may have influenced their social standing and connections within their community. James Tissot received a good education, likely due to his family's financial stability and middle-class status. He studied at a Jesuit school before moving to Paris to pursue his art studies, indicating that his family had the means to support his education.","""James Tissot: A Biography"" by Krystyna Matyjaszkiewicz, ""James Tissot"" by Michael Wentworth."
233,Q82934,"Claude Henri de Rouvroy, comte de Saint-Simon",Q82934,1760,France,Elite,"Claude Henri de Rouvroy, comte de Saint-Simon, was born into the French nobility, a segment of the society that was considered the elite during the late 1700s. His father, Claude de Rouvroy, was a nobleman from a distinguished family, and his mother, Marie-Henriette de Voyer de Paulmy d'Argenson, was also from a noble family. The family's wealth and status were significant at the time of his birth and throughout his childhood. As a member of the nobility, Saint-Simon would have had access to education, housing, and living conditions that were superior to those of the middle class and subsistence class. He would also have inherited certain privileges, such as the right to hold certain offices and exemptions from certain taxes, which were not available to those of lower social classes.","""Claude Henri de Rouvroy, comte de Saint-Simon,"" Encyclopædia Britannica, https://www.britannica.com/biography/Claude-Henri-de-Rouvroy-comte-de-Saint-Simon; ""Saint-Simon, Claude Henri de Rouvroy, comte de,"" The Columbia Encyclopedia, 6th ed., https://www.encyclopedia.com/people/social-sciences-and-law/sociology-biographies/claude-henri-de-rouvroy-comte-de-saint-simon."
234,Q354563,Jean Mabillon,Q354563,1632,France,Middle Class,"Jean Mabillon was born in Saint-Pierremont, then in the ancient Province of Champagne, now in the Department of Ardennes, France. His parents were Estienne Mabillon and Jeanne Guérin, two respectable but not aristocratic individuals. His father was a yeoman, a free man who owned his own farm, and his mother was the daughter of a notary. The family was not wealthy, but they were not poor either. They were able to provide a basic education for Mabillon, which was not a privilege accessible to everyone at the time. His early life housing and living conditions would have been modest but comfortable for the time period. There is no evidence of any inherited privileges or disadvantages.","""Jean Mabillon"", Catholic Encyclopedia, New York: Robert Appleton Company, 1913; ""Jean Mabillon"", Encyclopædia Britannica, 1911."
235,Q1234248,Jules de Goncourt,Q1234248,1830,France,Middle Class,"Jules de Goncourt was born into a family of the bourgeoisie, the French middle class. His father, Marc-Pierre Huot de Goncourt, was a former soldier who had served in the Napoleonic wars and later became a civil servant. His mother, Annette-Cécile de Goncourt, came from a family of lawyers. The family was not wealthy, but they were comfortable and had access to education. Jules and his brother Edmond were both educated at home by their mother and later at the Lycée Condorcet, a prestigious secondary school in Paris. The family lived in a comfortable home in the city. While they did not have the privileges of the aristocracy, they were certainly not subsistence level.","""The Goncourt Brothers"" by Robert Baldick, ""The French Middle Classes in the Nineteenth Century"" by Theodore Zeldin."
236,Q185914,Michael Servetus,Q185914,1511,France,Middle Class,"Michael Servetus was born in Villanueva de Sijena, in the Kingdom of Aragon, which is now part of Spain, not France. His father, Antón Serveto, was a notary of the royal court, a position that required literacy, education, and a certain level of social standing. This suggests that the Servetus family was part of the middle class. Michael Servetus himself had access to education from an early age, studying Latin, Greek, and Hebrew. This access to education indicates a certain level of family wealth and social standing, as education during this time was not universally accessible and was often reserved for those of higher social classes. The family's housing and living conditions are not well-documented, but given Antón Serveto's occupation, it is likely that they lived in a town or city rather than in rural poverty. There is no evidence to suggest that Servetus inherited any significant privileges or disadvantages due to his birth.","""Out of the Flames"" by Lawrence and Nancy Goldstone; ""Michael Servetus: Humanist and Martyr"" by John F. Fulton."
