,individual_wikidata_id,individual_name,individual_wikidata_id,birth_year,country,classification,explanation,sources
0,Q5586,Katsushika Hokusai,Q5586,1760,Japan,Middle Class,"Katsushika Hokusai was born in the Katsushika district of Edo (modern Tokyo). His father was Nakajima Ise, a mirror-maker for the shogun. This occupation placed the family in the artisan class, which was considered part of the middle class in the social hierarchy of the Edo period. The family was not wealthy, but they were not impoverished either. Hokusai's access to education was likely due to his family's middle-class status, as he was apprenticed to a wood-carver at the age of 14 and later entered the studio of the ukiyo-e painter Katsukawa Shunshō. His early life housing and living conditions would have been typical of the middle class in Edo Japan, which was characterized by urban living in relatively comfortable, if not luxurious, circumstances. There is no evidence of any inherited privileges or disadvantages.","""Hokusai: Beyond the Great Wave"" by Timothy Clark, published by the British Museum; ""Hokusai"" by Gian Carlo Calza, published by Phaidon Press."
1,Q200798,Utagawa Hiroshige,Q200798,1797,Japan,Middle Class,"Utagawa Hiroshige, also known as Andō Hiroshige, was born in Edo (now Tokyo), Japan, in 1797. His father, Andō Gen'emon, was a member of the fire-fighting organization responsible for protecting Edo Castle, the residence of the shogun. This role was hereditary and considered a samurai rank, which placed Hiroshige's family in the middle class, according to the social structure of Japan in the late 1700s. However, they were not wealthy. After his parents' death, Hiroshige took over his father's role at a young age, but he also showed an early interest in art and managed to get an apprenticeship with Utagawa Toyohiro, a renowned ukiyo-e artist. This suggests that his family had enough resources to support his education in art, further indicating a middle-class status. His early life housing and living conditions would have been modest but comfortable, typical of the samurai class of the time.","""Hiroshige: From Fireman's Son to Ukiyo-e Master"" by Henry D. Smith II, Impressions, The Journal of the Ukiyo-e Society of America, Inc., 1991; ""Hiroshige: 100 Famous Views of Edo"" by Melanie Trede and Lorenz Bichler, Taschen, 2007."
2,Q5676,Matsuo Bashō,Q5676,1644,Japan,Middle Class,"Matsuo Bashō was born in Ueno, in Iga Province, Japan. His father was a low-ranking samurai, which would place the family in the middle class according to the social structure of Japan in the late 1600s. Samurai were considered part of the ruling class, but their wealth and influence varied greatly. Bashō's family was not wealthy, but they had enough resources to provide him with a solid education, which was a privilege not available to everyone in that era. Bashō's father's position would have provided the family with a certain level of social standing and stability, but not with the wealth and influence of the higher-ranking samurai or nobility. Bashō's early life housing and living conditions would have been modest but comfortable, reflecting the family's middle-class status.","""Bashō's Journey: The Literary Prose Of Matsuo Bashō"" by David Landis Barnhill, ""The Life of Bashō"" by Makoto Ueda, ""Matsuo Bashō"" by Haruo Shirane."
3,Q313638,Lafcadio Hearn,Q313638,1850,Japan,Middle Class,"Lafcadio Hearn was born on June 27, 1850, in and on the Greek island of Lefkada. His father, Charles Bush Hearn, was an Irish surgeon in the British army, and his mother, Rosa Antoniou Kassimati, was a native Greek woman. His parents' marriage was not accepted by the Victorian society of the time, and after his father was called back to Ireland, Lafcadio was left in the care of a great-aunt in Dublin. This indicates that while his father had a respectable profession, the family was not part of the elite class. His childhood was marked by neglect and poverty, especially after his great-aunt's death. However, he was able to attend a Catholic boarding school, Ushaw College, indicating some access to education. His early life housing and living conditions varied, from living with his great-aunt to living in a boarding school.","1. Hearn, Lafcadio, and Elizabeth Bisland. ""The Life and Letters of Lafcadio Hearn."" Houghton, Mifflin, 1906.
2. Dawson, Carl. ""Lafcadio Hearn and the Vision of Japan."" Johns Hopkins University Press, 1992."
4,Q272045,Kitagawa Utamaro,Q272045,1754,Japan,Middle Class,"Kitagawa Utamaro was born around 1754 in Edo, Japan. His exact family background is not well-documented, but it is generally accepted that he was born into a middle-class family. His father, Kitagawa Ichitaro, is believed to have been a member of the town's yoshiya, or teahouse owners, which would place the family in the middle class according to the social structure of the time. This class included merchants and artisans, among others. The teahouse culture was a significant part of the urban culture in Edo period, and owners of such establishments were considered respectable middle-class citizens. However, there is no concrete evidence of the family's wealth or Utamaro's early life housing and living conditions. As for education, Utamaro likely had access to some form of education due to his family's status, as he was able to read and write, but the specifics are not known.","""Utamaro and the Spectacle of Beauty"" by Julie Nelson Davis; ""The Passionate Art of Kitagawa Utamaro"" by Asano Shugo and Timothy Clark."
5,Q193344,Miyamoto Musashi,Q193344,1585,Japan,Middle Class,"Miyamoto Musashi was born in Harima Province, Japan, around 1584. His father, Shinmen Munisai, was an accomplished martial artist and master of the sword and jitté (a specialized weapon for defeating swords). Munisai had an official role as the martial arts instructor for the Ashikaga lords of the shogunate, a position of considerable prestige. This suggests that Musashi was born into a family with a respectable social standing, but not into the ruling class or nobility. 

Musashi's early access to martial arts training, presumably from his father, indicates a degree of educational opportunity not available to those of lower social classes. However, there's no evidence to suggest that his family was particularly wealthy or that he had access to the broader academic education typically associated with the elite class.

Musashi's mother died shortly after his birth, and his father either died or abandoned him when he was around seven years old. He was raised by his uncle, a monk, which suggests that his living conditions were likely modest.","""The Lone Samurai: The Life of Miyamoto Musashi"" by William Scott Wilson; ""Miyamoto Musashi: His Life and Writings"" by Kenji Tokitsu."
6,Q317736,Utagawa Kuniyoshi,Q317736,1798,Japan,Middle Class,"Utagawa Kuniyoshi was born in Edo (now Tokyo), Japan, in 1797 or 1798. His father, Yanagiya Kichiyemon, was a silk-dyer, which was a skilled craft occupation. This would place their family in the middle class according to the provided typology. Kuniyoshi was not born into a samurai family or the ruling class, which rules out the elite classification. He also was not born into a subsistence-level family, as his father's occupation provided a stable income. Kuniyoshi was given the opportunity to study woodblock printing under Utagawa Toyokuni, a well-known artist of the time, which suggests that his family had enough resources to provide him with this education. His early life housing and living conditions are not well-documented, but his father's occupation suggests they were likely adequate for the time and place.","Roberts, Laurance P. ""A Dictionary of Japanese Artists: Painting, Sculpture, Ceramics, Prints, Lacquer"". Weatherhill, 1976."
7,Q31523,Yosa Buson,Q31523,1716,Japan,Middle Class,"Yosa Buson was born in the village of Kema in Settsu Province (now Kema-cho, Miyakojima Ward in the city of Osaka). His family were likely of the middle class, as his father was a farmer. However, his father died when Buson was still young, and his mother took him to live in the city of Kyoto, where he would have been exposed to the cultural and artistic life of the city. This suggests that his family had some means and connections, as they were able to relocate and provide him with an education. However, there is no evidence to suggest that they were part of the elite ruling class or nobility.","""Yosa Buson: His Life & Work"" by Edith Marcombe Shiffert and Yuki Sawa; ""The Year of My Life"" by Yosa Buson, translated by William R. Nelson."
8,Q467427,Utagawa Kunisada,Q467427,1786,Japan,Middle Class,"Utagawa Kunisada, also known as Toyokuni III, was born in 1786 in Honjo, an eastern district of Edo (now Tokyo), Japan. His father was the owner of a ferry boat business, which suggests a middle-class background. The ferry business was a respectable occupation in Edo period Japan, providing a stable income and social standing within the community. This would have allowed Kunisada access to education, as it was common for children of middle-class families to receive some form of schooling. However, there is no specific information about his early life housing and living conditions or any inherited privileges or disadvantages.","""Utagawa Kunisada (1786–1865)"" by Sebastian Izzard, published in Impressions, the Journal of the Ukiyo-e Society of America, Inc. (1993); ""The Life and Works of Utagawa Kunisada"" by Amy Reigle Newland, published in Andon 63 (1999)."
9,Q360978,Suzuki Harunobu,Q360978,1725,Japan,Middle Class,"Suzuki Harunobu was born into a family of artisans in Edo (now Tokyo), Japan. His father was a samurai, which placed them in the middle class according to the social hierarchy of the time. Samurai were considered part of the ruling class, but their actual living conditions varied greatly, with many living modestly. Harunobu's family was not wealthy, but they were not poor either. They had enough resources to provide Harunobu with an education, as was typical for samurai families. However, there is no evidence to suggest that they lived in luxury or had significant wealth. The samurai class was characterized by a strong sense of duty and honor, rather than material wealth. Harunobu's early life would have been shaped by these values.","""The World of the Shining Prince: Court Life in Ancient Japan"" by Ivan Morris; ""The Making of Modern Japan"" by Marius B. Jansen."
10,Q714175,Ueda Akinari,Q714175,1734,Japan,Middle Class,"Ueda Akinari was born in Osaka, Japan, in 1734. His biological parents are unknown, but he was adopted by Ueda, a wealthy Osaka merchant. This would place him in the middle class, as merchants were considered part of the chōnin, or townsmen class, in Edo period Japan. This class was composed of non-samurai urban dwellers, including merchants and artisans. Despite the social restrictions of the time, the chōnin class had access to certain forms of education and could accumulate wealth, although they were socially below the samurai class. Akinari's adoptive father was a successful oil wholesaler, suggesting a degree of wealth and stability in the family. However, his adoptive father died when Akinari was just four years old, and his mother remarried, leaving him to be raised by his grandmother. Despite these changes, it seems likely that Akinari would have maintained his middle-class status through his early life.","""Ueda Akinari"" by Haruo Shirane, in The Princeton Companion to Classical Japanese Literature (Princeton University Press, 1985); ""The Chonin Culture"" by Tetsuo Najita, in The Cambridge History of Japan, Vol. 4 (Cambridge University Press, 1988)."
11,Q352561,Ihara Saikaku,Q352561,1642,Japan,Middle Class,"Ihara Saikaku was born in Osaka, Japan, to a merchant family, which places him in the middle class according to the specified typology. His father was a wealthy merchant, which provided Saikaku with a comfortable upbringing. The merchant class, or chōnin, was a significant part of the urban culture in Edo-period Japan (1603-1868), and Osaka was a thriving commercial center during this time. Saikaku's family wealth allowed him access to education, which was not uncommon for children of the chōnin class. His early life housing and living conditions would have been comfortable, reflecting his family's merchant status. However, as a member of the chōnin class, Saikaku would not have had the same inherited privileges as the samurai (warrior) class or the nobility.","""Five Women Who Loved Love"" by Ihara Saikaku (translated by Wm. Theodore de Bary); ""The Merchant's Tale: Yokohama and the Transformation of Japan"" by Simon Partner; ""Tokugawa Society: Material Culture, Standard of Living, and Life-Styles"" by Kazui Tashiro."
12,Q312709,Kobayashi Issa,Q312709,1763,Japan,Middle Class,"Kobayashi Issa was born in Kashiwabara, Shinano Province, which is now part of Nagano Prefecture in Japan. His father was a farmer, but the family was relatively well-off, owning a good amount of land. This places them in the middle class according to the typology provided, as they were landowners. Issa's mother died when he was very young, and his stepmother treated him poorly, which may have affected his living conditions, but this does not change his family's social class. As for education, Issa was literate, suggesting he had some form of education, which was not uncommon for children of middle-class families in this period of Japanese history.","""The Spring of My Life and Selected Haiku"" by Kobayashi Issa, ""Kobayashi Issa: A Biography"" by Makoto Ueda."
13,Q324986,Chikamatsu Monzaemon,Q324986,1653,Japan,Middle Class,"Chikamatsu Monzaemon was born into a samurai family, which would place him in the middle class according to the provided typology. His father was a rōnin, a samurai without a lord or master, which suggests that the family was not of high nobility but had some level of social standing and access to education. Samurai families were typically literate and valued education, so it's likely that Chikamatsu had access to some form of education due to his family background. However, the specific details about his family's wealth, living conditions, and inherited privileges or disadvantages are not well-documented.","""Chikamatsu Monzaemon."" Encyclopædia Britannica. https://www.britannica.com/biography/Chikamatsu-Monzaemon"
14,Q952938,Ogata Kōrin,Q952938,1658,Japan,Middle Class,"Ogata Kōrin was born into a merchant family in Kyoto, Japan. His father, Ogata Sōken, was a wealthy merchant who also had a passion for painting. This suggests that the family had a comfortable lifestyle and were part of the middle class, as they were able to afford to pursue interests beyond mere survival. The family's merchant status also indicates that they were not part of the ruling class or nobility. Kōrin's access to education was likely due to his family's wealth and status, as his father was able to provide him with a good education, including training in painting. The family's housing and living conditions were likely comfortable, given their merchant status and wealth. However, as merchants, they would not have had the same privileges as the ruling class or nobility.","""Ogata Kōrin."" Encyclopædia Britannica. https://www.britannica.com/biography/Ogata-Korin; ""Ogata Kōrin."" The Metropolitan Museum of Art. https://www.metmuseum.org/art/collection/search/60008583."
15,Q950316,Utagawa Toyokuni I,Q950316,1769,Japan,Middle Class,"Utagawa Toyokuni I, originally named Kumakichi, was born in Edo (now Tokyo), Japan around 1769. His father, Kurahashi Gorobei, was a carver of dolls and puppets, a profession that falls within the category of skilled craftspeople. This suggests that Toyokuni I was born into a middle-class family. His father's occupation would have provided the family with a stable income, but they were not part of the elite ruling class or nobility. Toyokuni I's early access to education was likely due to his family's middle-class status, as he was apprenticed to the ukiyo-e master Utagawa Toyoharu at a young age. This apprenticeship would have provided him with a solid education in the arts, but it was likely only possible because of his family's ability to support him during this time. His early life housing and living conditions would have been typical of a middle-class family in Edo during the late 1700s, which would have included a comfortable but not extravagant home.","""Utagawa Toyokuni."" Encyclopædia Britannica. https://www.britannica.com/biography/Utagawa-Toyokuni; ""Utagawa Toyokuni I (1769-1825)."" Ronin Gallery. https://www.roningallery.com/artists/utagawa-toyokuni."
16,Q177059,Hakuin Ekaku,Q177059,1686,Japan,Middle Class,"Hakuin Ekaku was born into a family of artisans, specifically his parents were cotton farmers. This places them in the middle class according to the provided typology, as they were skilled craftspeople. His family was not wealthy, but they were not impoverished either, indicating a middle-class status. Hakuin's early access to education was also indicative of a middle-class upbringing. He was sent to a local temple for schooling at a young age, which suggests his family had the resources to provide him with an education. His early life housing and living conditions are not well-documented, but given his family's occupation, it can be inferred that they were modest but adequate. There is no evidence of any inherited privileges or disadvantages.","Waddell, Norman (2010). Hakuin's Precious Mirror Cave: A Zen Miscellany. Counterpoint. ISBN 978-1-58243-612-1."
17,Q467337,Yoshitoshi,Q467337,1839,Japan,Middle Class,"Yoshitoshi was born in Edo (now Tokyo), Japan, in 1839. His father was a wealthy merchant and his mother was a geisha. His father's occupation places the family in the middle class according to the given typology. However, it's important to note that his mother's occupation as a geisha, while respected in Japanese society, was not considered high class. Yoshitoshi was adopted by his father's brother, who was also a merchant, suggesting that the family had some wealth and stability. As a child, Yoshitoshi had access to education, as he began studying woodblock printing at the age of 11 under the artist Kuniyoshi, which indicates that his family had the resources to provide him with this opportunity. His early life housing and living conditions are not well-documented, but given his family's status as merchants, it can be inferred that they were at least adequate.","""Yoshitoshi's One Hundred Aspects of the Moon"" by John Stevenson, ""Yoshitoshi's Strange Tales"" by John Stevenson, ""Beauty & Violence: Japanese Prints by Yoshitoshi 1839-1892"" by Eric van den Ing and Robert Schaap."
18,Q2838030,Kawanabe Kyōsai,Q2838030,1831,Japan,Middle Class,"Kawanabe Kyōsai was born into a family of samurai, a social class that was part of the ruling class in Japan but not necessarily wealthy. His father was a lower-ranking samurai who served the daimyo of Koga. The samurai class was not monolithic in terms of wealth or influence; it included both high-ranking lords and lower-ranking warriors and officials. Kyōsai's father was of the latter category, suggesting a middle-class status according to the typology provided. The samurai class was characterized by a certain level of education, as they were expected to be literate and knowledgeable in Confucian classics. This suggests that Kyōsai would have had access to some education due to his family background. However, the family's exact wealth and living conditions are not well-documented, making it difficult to provide a more precise classification.","""Kawanabe Kyōsai: An Eccentric Artist Depicting the Past and the Present"" by Timothy Clark (2017); ""The World of the Shining Prince: Court Life in Ancient Japan"" by Ivan Morris (1964)."
19,Q3121142,Kobayashi Kiyochika,Q3121142,1847,Japan,Middle Class,"Kobayashi Kiyochika was born into a family of government officials, which would place them in the middle class according to the provided typology. His father was a minor retainer of the Shogun, which provided the family with a stable income and a certain level of social standing. The family was not of noble or aristocratic lineage, nor were they peasants or laborers, which rules out the classifications of Elite and Subsistence. As for education, Kiyochika likely had access to some form of education due to his family's status, although specific details are not readily available. The family's living conditions would have been comfortable, but not luxurious, consistent with a middle-class lifestyle.","""Kobayashi Kiyochika: Artist of Meiji Japan"" by Henry D. Smith II; ""Kobayashi Kiyochika: A Retrospective"" by Tokyo Metropolitan Museum of Art."
20,Q427642,Torii Kiyonaga,Q427642,1752,Japan,Middle Class,"Torii Kiyonaga was born into a family of picture and fan printmakers in Edo (now Tokyo), Japan. His father, Torii Kiyotsune, was a member of the Torii school of ukiyo-e artists, which was a well-established and respected lineage of printmakers and painters. This indicates that Kiyonaga was born into a family of skilled artisans, a characteristic of the middle class in the social structure of Japan in the late 1700s. The Torii school was not aristocratic, but it was not subsistence-level either. It was a professional, artisanal lineage that would have provided a comfortable, middle-class lifestyle. Kiyonaga's access to education in the arts was likely due to his family background, as the Torii school was a hereditary institution. His early life housing and living conditions would have been typical of the urban middle class in Edo period Japan.","""The Art of the Japanese Book"" by Jack Hillier (1987); ""The Passionate Art of Kitagawa Utamaro"" by Shugo Asano and Timothy Clark (1995)."
21,Q746217,Hishikawa Moronobu,Q746217,1618,Japan,Middle Class,"Hishikawa Moronobu was born into a family of dyers, specifically working with the yuzen resist-dyeing method, a skilled craft that would place them in the middle class according to the provided typology. His father was a well-known artisan in their local community. This occupation would have provided a stable income and a comfortable living, but not to the extent of the elite class. It's also known that Moronobu had access to education, as he was trained in his family's craft from a young age, which was a common practice in artisan families. However, there's no evidence to suggest that his family was particularly wealthy or that he had any inherited privileges.","""Hishikawa Moronobu: First Master of the Japanese Print"" by Richard Lane; ""The Birth of the Japanese Print"" by David Waterhouse."
22,Q3046492,Keisai Eisen,Q3046492,1791,Japan,Middle Class,"Keisai Eisen was born to a family of calligraphers, which was a skilled craft and thus would place them in the middle class according to the given typology. His father, Ikeda Yoshimasa, was a well-known poet and calligrapher. Eisen was also given an education in the arts from a young age, indicating that his family had the resources to provide this. However, there is no evidence to suggest that his family was particularly wealthy or part of the ruling class, nor that they were struggling to subsist. Therefore, it is most likely that they were part of the middle class.","""Keisai Eisen: Artist of the Floating World"" by Amy Reigle Newland, ""The Great Mirror of Male Love"" by Ihara Saikaku."
23,Q2661041,Ike no Taiga,Q2661041,1723,Japan,Middle Class,"Ike no Taiga was born into a family of Kyoto craftspeople, a social class that would be considered middle class according to the provided typology. His father was a carver of Buddhist images, which was a skilled craft occupation. His family was not wealthy, but they were not living in poverty either. They had enough resources to provide Taiga with a basic education, as evidenced by his early literacy and his ability to study Chinese classics, which was not common among the lower classes. However, there's no evidence that Taiga inherited any significant privileges or disadvantages due to his family background. His early life housing and living conditions would have been typical for a craftsman's family in Kyoto during the Edo period.","""Ike no Taiga and Tokuyama Gyokuran: Japanese Masters of the Brush"" by Patricia J. Graham and ""Ike Taiga and Tokuyama Gyokuran: Japanese Masters of the Brush"" by Kyoko Kinoshita."
24,Q1358636,Katsukawa Shunshō,Q1358636,1726,Japan,Middle Class,"Katsukawa Shunshō was born into a family of bookshop owners, a profession that would place them in the middle class according to the social structure of Japan in the 18th century. The book trade was a respected profession, often associated with the educated and literate classes. It is likely that Shunshō had access to education due to his family background, as literacy and knowledge of literature would have been important in his family's trade. However, there is no evidence to suggest that his family was particularly wealthy or that they were part of the ruling class or nobility. His early life housing and living conditions would have been typical of the middle class in Edo (modern-day Tokyo), where he was born.","""Katsukawa Shunshō"" in Grove Art Online. Oxford Art Online. Oxford University Press."
