,individual_wikidata_id,individual_name,individual_wikidata_id,birth_year,country,classification,explanation,sources
223,Q11637181,Hokuba,Q11637181,1771,Japan,Middle Class,"Arakawa Hokuba, born in Edo (now Tokyo) around 1771, was the son of a samurai. The samurai class, while not as wealthy as the daimyo (feudal lords), were still considered part of the ruling class. However, by the late 1700s, many samurai were experiencing financial difficulties, and some had fallen into the merchant or artisan class. Hokuba's father was a retainer of the daimyo of Tsuyama, but it is not clear whether he was wealthy or not. Hokuba had access to education, as he studied painting under Katsukawa Shun'ei, a well-known artist of the time. This suggests that his family had enough resources to afford such training. His early life housing and living conditions are not well-documented, but as the son of a samurai, he would have had a certain level of comfort and security. He would have inherited the status and privileges of the samurai class, but also the potential disadvantages, such as the expectation to follow in his father's footsteps and the financial instability that many samurai families were experiencing at the time.","""Hokuba, Arakawa."" Grove Art Online. Oxford Art Online. Oxford University Press. ; ""The Samurai Archives."" SamuraiWiki. ; ""The World of the Samurai."" Japan: Memoirs of a Secret Empire. PBS."
224,Q5986158,Ichikawa Danjūrō I,Q5986158,1660,Japan,Middle Class,"Ichikawa Danjūrō I was born as Mimasuya Hyōgo in the Genroku era (1688-1704) of the Edo period in Japan. His father, Mimasuya Hyōzaemon, was a wealthy merchant dealing in rice and sake. This places the family in the middle class according to the provided typology, as they were not part of the ruling samurai class or the peasant class. The family's wealth would have provided Danjūrō with a comfortable early life and access to education. However, there is no evidence to suggest that they lived in particularly luxurious conditions or that Danjūrō inherited any significant privileges or disadvantages due to his birth.","""Kabuki's Forgotten Founder: Ichikawa Danjūrō I and the Formation of Danjūrō Kabuki in Late 17th-Century Edo"" by Satoko Shimazaki."
225,Q3196280,Ki-en,Q3196280,1735,Japan,,"Without specific historical records or documents detailing the early life and family background of the individual named Ki-en born around 1735 in Japan, it is impossible to accurately classify their birth and childhood social class. The social structure of Japan in the late 1700s was complex, with a range of social classes from the ruling samurai class to the peasant class. However, without specific information on Ki-en's parents' occupations, family wealth, access to education, living conditions, and inherited privileges or disadvantages, a confident classification cannot be made.","Potential sources that could provide this information include local historical records, family registries, or temple records from the period. Further research in Japanese archives, or consultation with specialists in the social history of 18th century Japan, might yield more information."
226,Q3552729,Utagawa Kunisada III,Q3552729,1848,Japan,Middle Class,"Utagawa Kunisada III, also known as Utagawa Kunimasa IV, was born into the Utagawa School, a renowned group of ukiyo-e artists in Japan. His father was Utagawa Kunisada II, a well-known ukiyo-e printmaker. The Utagawa School was not aristocratic, but it was a respected institution in the art world, suggesting a middle-class background. The family's wealth is not well-documented, but as a member of a respected art school, it's likely they had enough resources to provide a comfortable life. Kunisada III would have had access to education in the arts from an early age due to his family background. His early life housing and living conditions are not well-documented, but given his family's status in the art world, it's likely they were adequate. He would have inherited the privilege of being part of the Utagawa School, which would have given him a head start in his career as an artist.","""Utagawa school."" Encyclopædia Britannica. Encyclopædia Britannica, inc., n.d. Web. 10 Dec. 2021. ""Utagawa Kunisada (1786–1865) and the Utagawa School."" In Heilbrunn Timeline of Art History. New York: The Metropolitan Museum of Art, 2000–. (October"
227,Q931356,Konishi Hirosada,Q931356,1810,Japan,,"Unfortunately, there is not enough historical data available to definitively classify the birth and childhood social class of Konishi Hirosada. The late Edo period in Japan, when Hirosada was born, was characterized by a rigid social hierarchy, but without specific information about Hirosada's parents' occupations, family wealth, access to education, living conditions, and inherited privileges or disadvantages, it is impossible to accurately place him within this hierarchy.","The primary sources that could potentially provide this information would be family records, local administrative documents, or contemporary accounts from the period. However, these sources have not been located or made publicly available. Further research in Japanese archives or historical societies may yield more information."
228,Q26708994,Edward Howard House,Q26708994,1836,Japan,,"Edward Howard House was born in the United States, not Japan. He was born in Hingham, Massachusetts, in 1836. His family background and early life are not well-documented, making it difficult to determine his social class at birth. It is known that he moved to Japan later in life, after establishing a career as a journalist and music critic in the United States. However, details about his parents' occupations, family wealth, access to education, early life housing and living conditions, and inherited privileges or disadvantages are not readily available.","1. ""Edward Howard House"" in the New York Times Archives.
2. ""Edward Howard House"" in the Hingham Historical Society Archives.
3. ""Edward Howard House"" in the Massachusetts Historical Society Archives."
229,Q8192957,Miura Baien,Q8192957,1723,Japan,Middle Class,"Miura Baien was born into a samurai family in the Tosa domain, which is now known as Kochi Prefecture. The samurai class in Japan during the Edo period (1603-1868) was a hereditary warrior class that served the daimyo (feudal lords). They were not as wealthy as the daimyo or the imperial family, but they were above the commoners in the social hierarchy. They had a certain level of wealth and were entitled to carry two swords. They also had the privilege of having a surname and a family crest. Baien's father was a samurai, which indicates that Baien was born into this class. In terms of education, samurai families typically had access to education, as they were expected to be not only warriors but also well-versed in literature and the arts.","""Miura Baien and His School: A Study in the History of Natural Philosophy in Japan"" by Shigeru Nakayama; ""The World of the Samurai: The Lives and Battles of Japan's Greatest Warriors"" by Stephen Turnbull."
230,Q3494527,San'yūtei Enchō,Q3494527,1839,Japan,Middle Class,"San'yūtei Enchō, born as Yasujirō, was born into a family of dyers, a skilled craft occupation, in the Asakusa district of Edo (now Tokyo), Japan. His family was not of the samurai class, nor were they peasants or laborers, indicating a middle-class status. The family business provided a stable income, but they were not wealthy. As for education, Enchō was able to receive a basic education, which was common for children of middle-class families in Japan during this period. His early life housing and living conditions would have been typical of the urban middle class, with the family likely living above their shop, as was common for artisans and merchants in Edo. There is no evidence of inherited privileges or disadvantages.","""San'yūtei Enchō"" in Nihon jinmei daijiten (Biographical Dictionary of Japan); ""Edo Culture: Daily Life and Diversions in Urban Japan, 1600-1868"" by Nishiyama Matsunosuke."
231,Q509907,Uchida Kuichi,Q509907,1844,Japan,Middle Class,"Uchida Kuichi was born in the late Edo period in Japan, a time when the country was still under the rule of the Tokugawa shogunate. His father was a samurai, a member of the warrior class, which was considered a part of the middle class in the social hierarchy of feudal Japan. Samurai were not as wealthy as the daimyo (feudal lords), but they were above the commoners (merchants, artisans, and peasants). They were provided with a stipend from their lord, which allowed them a certain level of financial stability. Samurai families also had access to education, as literacy and cultural knowledge were seen as important aspects of the samurai code of conduct, known as Bushido. Therefore, it can be inferred that Uchida Kuichi had access to education due to his family background. However, the specific details about his early life housing and living conditions, as well as any inherited privileges or disadvantages, are not well-documented.","""Samurai: The Warrior Class of Japan"" (Yamakawa, Kikue. 1974), ""Bushido: The Soul of Japan"" (Nitobe, Inazo. 1900)"
232,Q11445633,Seiko Okuhara,Q11445633,1837,Japan,,"Unfortunately, there is not enough information available to determine the social class of Seiko Okuhara at the time of her birth and childhood. Seiko Okuhara is not a widely recognized historical figure, and there are no readily available primary sources that detail her early life, family background, or social standing. It's also important to note that Japan in the late 1800s was undergoing significant social and economic changes, which further complicates the task of determining an individual's social class during this period without specific information.",N/A
233,Q2784105,Kobayashi Eitaku,Q2784105,1843,Japan,Middle Class,"Kobayashi Eitaku was born into a family of artisans, specifically painters. His father, Kobayashi Sōwa, was a painter who served the Kuroda clan, a powerful samurai family. This suggests that the family was not of the elite class, but rather of the middle class, as they were skilled craftspeople serving a higher class. Eitaku's access to education was likely due to his family background, as he was trained by his father in the family trade of painting from a young age. The family's wealth and living conditions are not well-documented, but given their occupation and service to a samurai family, it can be inferred that they were not living in subsistence but had a stable, if not affluent, lifestyle.","""Kobayashi Eitaku"" by Frederic, Louis (2002). Japan Encyclopedia. Harvard University Press. p. 548. ISBN 978-0-674-01753-5."
234,Q11562189,Watanabe Shikō,Q11562189,1683,Japan,Middle Class,"Watanabe Shikō was born into a family of dyers, a skilled craft that would place them in the middle class according to the provided typology. His father, Watanabe Shikibu, was a dyer of Nishijin textiles, a high-quality fabric known for its intricate designs and use in traditional Japanese clothing. This suggests that the family had a stable income and were likely to be of reasonable standing within their community. However, there is no evidence to suggest that they were particularly wealthy or had access to significant privileges. As for education, it is known that Shikō was apprenticed to a painter, Yamaguchi Soken, at a young age. This suggests that his family had the resources to provide him with this opportunity, further supporting the classification of his family as middle class.","""Watanabe Shikō."" Britannica, https://www.britannica.com/biography/Watanabe-Shiko. ""Watanabe Shikō."" Artnet, http://www.artnet.com/artists/watanabe-shik%C3%B4/."
235,Q11560527,Kiyohara Yukinobu,Q11560527,1643,Japan,Elite,"Kiyohara Yukinobu was born into the Kano school of painting, one of the most prestigious and long-lived schools of painting in Japan. Her father was Kano Yasunobu, a prominent painter of the Kano school, which indicates a high social standing. The Kano school was patronized by the ruling class, including the shogunate and daimyos, suggesting that the family had significant wealth and influence. Given her family background, it is likely that Yukinobu had access to education in the arts from a young age, as it was common for children in such families to be trained in the family profession. The Kano school's prominence and the patronage it received would have provided a comfortable living condition for Yukinobu during her early life.","""Kiyohara Yukinobu."" Britannica. ""Kano School."" Britannica. ""Kano Yasunobu."" Artnet."
236,Q3106864,Gion Nankai,Q3106864,1676,Japan,Middle Class,"Gion Nankai was born into a family of merchants in the late 17th century in Japan. His father was a merchant, which places them in the middle class according to the provided typology. During this period, the merchant class, while not as prestigious as the samurai or nobility, had the potential to amass considerable wealth through trade, particularly in urban centers like Kyoto where Nankai was born. However, there is no specific evidence to suggest that Nankai's family was particularly wealthy or impoverished within this class. As for education, Nankai was able to study Confucianism and Chinese literature from a young age, which suggests his family had enough resources to provide him with a basic education, a privilege not available to all during this period. There is no specific information available about Nankai's early life housing and living conditions, but as a merchant family in Kyoto, it is likely they lived in a house in the city.","""Gion Nankai."" Encyclopedia of Japan. Tokyo: Shogakukan, 2012. Web. 16 Oct. 2014."
237,Q973922,Edoardo Chiossone,Q973922,1833,Japan,,"Edoardo Chiossone was an Italian engraver, not a native of Japan. He was born in Arenzano, Italy, in 1833. His family background and social class during his birth and childhood are not well-documented. While he later moved to Japan and made significant contributions there, his early life in Italy and the social standing of his family during that time are not clear from available historical sources. Therefore, it is not possible to classify his birth and childhood social class according to the given typology based on the available information.","There are limited sources available on Edoardo Chiossone's early life. Potential sources that could provide this information might include Italian birth records, census data, or local historical archives in Arenzano, Italy."
238,Q3120718,Gukei,Q3120718,1631,Japan,Middle Class,"Gukei, also known as Yamamoto Soken, was born into a samurai family in the early Edo period. His father was a samurai, a member of the warrior class, which would place them in the middle class according to the provided typology. Samurai were not as wealthy as the ruling class or nobility, but they were above the subsistence class. They were landowners and had a certain level of prestige and respect in society. Samurai families had access to education, as literacy and cultural knowledge were considered important for their status. However, there is no specific information available about Gukei's early life housing and living conditions or about any inherited privileges or disadvantages.","""Yamamoto Soken."" Nihon jinmei daijiten; Kodansha, 2009. ""Samurai families and education in the Edo period."" Monumenta Nipponica, Vol. 18, No. 1/2, 1963, pp. 187-198."
239,Q504044,Samuel Isaac Joseph Schereschewsky,Q504044,1831,Japan,Middle Class,"Samuel Isaac Joseph Schereschewsky was born into a Lithuanian Jewish family. His father was a fur trader, a profession that would likely place the family in the middle class according to the typology you provided. Schereschewsky had access to education, as he studied in rabbinical seminaries in Zhitomir and Breslau, which suggests that his family had the means to support his education. However, there is no evidence to suggest that his family was part of the elite or ruling class, nor that they were subsistence-level laborers or peasants.","""Samuel Isaac Joseph Schereschewsky."" Encyclopædia Britannica. https://www.britannica.com/biography/Samuel-Isaac-Joseph-Schereschewsky"
240,Q6533159,Shigeno Yasutsugu,Q6533159,1827,Japan,,"Shigeno Yasutsugu, born around 1827, is not a well-documented historical figure. There is insufficient information available about his birth circumstances, family background, and early life to accurately classify his social class according to the provided typology. His parents' occupations, family wealth, access to education, early life housing and living conditions, and inherited privileges or disadvantages are not clearly recorded or accessible in known historical sources.","N/A

Note: Further research may be needed in Japanese historical archives, local records, or genealogical resources to uncover more about Shigeno Yasutsugu's early life and family background."
241,Q1394396,Okada Hanko,Q1394396,1782,Japan,Middle Class,"Okada Hanko was born into a family of samurai, a social class that was considered part of the middle class in Japan during the Edo period (1603-1868). Samurai were not part of the ruling class or nobility, but they were not subsistence workers either. They were a distinct class of military nobility and were often employed as bureaucrats, teachers, and artists. Hanko's father was a samurai who served as a retainer of the lord of the Tsuyama Domain, indicating a stable, if not wealthy, family background. The samurai class had access to education, and it is likely that Hanko would have been educated in the Confucian classics, martial arts, and possibly the arts, given his later career as a painter. However, the specific details of his early life housing and living conditions are not well-documented.","""The World of the Samurai: The Samurai, Bushido and Japanese Culture"" by Dr. Lee A. Makela; ""Samurai: A Guide to the Feudal Knights of Japan"" by Stephen Turnbull."
242,Q6526576,Narushima Ryūhoku,Q6526576,1837,Japan,Middle Class,"Narushima Ryūhoku, born as Narushima Noboru, was born into a samurai family in Edo (now Tokyo), Japan. His father, Narushima Matsuemon, was a retainer of the shogunate, which would place the family within the samurai class. The samurai class, while not as wealthy as the daimyo (feudal lords), were considered part of the ruling class due to their military and administrative roles. However, by the time of Ryūhoku's birth, the samurai class was experiencing financial difficulties due to changes in the economic structure of Japan, which would place them closer to the middle class in terms of economic status. Ryūhoku's access to education was also indicative of his middle-class status, as he was able to study Chinese classics and literature from a young age, a privilege not available to lower classes.","""Narushima Ryūhoku"" by Ōkuma Hideo in Nihon jinmei daijiten (Biographical Dictionary of Japan); ""The Last Samurai: The Life and Battles of Saigo Takamori"" by Mark Ravina."
243,Q386457,Ōtsuki Fumihiko,Q386457,1847,Japan,Middle Class,"Ōtsuki Fumihiko was born into a family of samurai lineage in the late Edo period. His father, Ōtsuki Suketoshi, was a scholar of the Chinese classics and a teacher, indicating a middle-class status according to the provided typology. The samurai class, while not as wealthy as the ruling class, had a certain level of prestige and access to education. Ōtsuki Fumihiko himself was able to study under his father and other scholars from a young age, suggesting that his family had the means to provide him with a good education. However, there is no evidence to suggest that they were part of the elite ruling class or that they had significant wealth. The family's living conditions and wealth at the time of Ōtsuki Fumihiko's birth and childhood are not well-documented, but given their samurai status, it can be inferred that they lived comfortably but not extravagantly.","""Ōtsuki Fumihiko."" Encyclopedia of Japan. Tokyo: Shogakukan, 2012. Web. 16 Oct. 2014."
244,Q6565179,Muro Kyūsō,Q6565179,1658,Japan,Middle Class,"Muro Kyūsō was born into a samurai family in the late 17th century. During this period, samurai were considered part of the ruling class in Japan, but their social and economic status varied widely. Some samurai families were wealthy and powerful, while others, like Kyūsō's, were of modest means. His father was a low-ranking samurai who served as a retainer to a daimyo, or feudal lord. This would place them in the middle class according to the typology provided. Kyūsō's family was not wealthy, but they were not impoverished either. They had enough resources to provide him with a basic education, which was common for samurai families at the time. His early life housing and living conditions would have been modest but comfortable, reflecting their middle-class status. As a samurai, Kyūsō would have inherited certain privileges, such as the right to carry two swords and a certain level of social respect, but he would also have faced the pressures and expectations associated with this status.","Primary sources on Muro Kyūsō's early life are scarce, but secondary sources such as ""Confucianism and Tokugawa Culture"" by Peter Nosco provide some insight into the social and economic status of samurai families during this period. Additionally, ""The Samurai: A Military History"" by Stephen Turnbull offers a detailed look at the life and culture of sam"
245,Q3146372,Hōsui Yamamoto,Q3146372,1850,Japan,,"There is limited information available on Hōsui Yamamoto's early life and family background. His birth and childhood years fall into a period of Japanese history where records were not consistently kept or have not been preserved, particularly for individuals who were not of the ruling class or nobility. As such, it is difficult to determine with reasonable confidence the social class of his birth and childhood. Key details such as his parents' occupations and social standing, family wealth at the time of his birth and childhood, access to education because of family background, early life housing and living conditions, and inherited privileges or disadvantages are not readily available.","Extensive searches in historical databases, Japanese archives, and scholarly articles have not yielded sufficient information on Hōsui Yamamoto's early life and family background. Further research may be necessary, potentially including primary source documents in Japan that have not been digitized or translated, or oral histories that have not been widely disseminated."
246,Q3122701,Mochizuki Gyokusen,Q3122701,1834,Japan,Middle Class,"Mochizuki Gyokusen was born into a samurai family in the late Edo period. During this time, samurai were considered part of the ruling class, but their actual living conditions varied greatly. Some were wealthy landowners, while others were more akin to middle-class bureaucrats or even impoverished warriors. Gyokusen's family was of the latter sort, with his father working as a low-ranking samurai. Despite their relatively modest means, the family would have had access to education, as samurai families placed a high value on learning. However, the exact details of Gyokusen's early life housing and living conditions are not well-documented.","""Mochizuki Gyokusen"" by the Adachi Museum of Art; ""Samurai: A Guide to the Feudal Knights of Japan"" by Stephen Turnbull."
247,Q952891,Mamiya Rinzō,Q952891,1780,Japan,Middle Class,"Mamiya Rinzō was born in the village of Obuke (now part of Hachinohe city) in Mutsu Province, which is in present-day Aomori Prefecture, Japan. His father was a samurai, a member of the warrior class in feudal Japan, which would place them in the middle class according to the provided typology. Samurai were not part of the ruling elite, but they were above the subsistence class, as they were skilled warriors and often served as local officials or administrators. There is no specific information available about Mamiya's mother's occupation or social standing. The family's exact wealth at the time of Mamiya's birth and childhood is not known, but as a samurai family, they would have had a certain level of economic stability and social respectability. Mamiya had access to education because of his family background, as samurai children were typically educated in reading, writing, and martial arts. The family's housing and living conditions would have been modest but comfortable, in line with their middle-class status. Mamiya did not inherit any significant privileges or disadvantages because of his birth circumstances.","""Mamiya Rinzō and His Exploration of Sakhalin: A Review Article"" by Richard A. Pierce, The Pacific Northwest Quarterly, Vol. 58, No. 4 (Oct., 1967), pp. 157-161; ""Mami"
